Tweet id	Poster username	Tweet post Date	Tweet text	Number of retweets	Tweet type
1155064003963629569	@Maggiestoneham	2019-07-27 16:04:53	Hey kid, first they screamed it was the ice age comets, and we would all be buried in ice, then it was global warming, now it is climate change. I’ve lived through all of these lies and it won’t be climate change that kills me.	0	Tweet
1155057678437232640	@philallen02	2019-07-27 15:39:45	So intelligent about climate change etc but didn’t know about the t-shirt !! 😂😂	0	Tweet
1155056206026870785	@UKurbanite	2019-07-27 15:33:54	If climate change is real, why are the solutions fake? Take electric cars, for instance: compared to vehicles converted to run on gas, their carbon footprint is hideous. Of course, if we were to develop thorium reactors, the maths might change, but that's not on the agenda!	0	Tweet
1155052165817413632	@thx22099	2019-07-27 15:17:50	2019 is Breaking All Records for Cold – The Real Threat is a Global Freeze https://twitter.com/Carbongate/status/1102103982821048321 … Pure Climate Change Sceptic https://twitter.com/Carbongate	0	Retweet
1155051009632276480	@thx22099	2019-07-27 15:13:15	New Finnish Study Finds No Evidence For Man-Made Climate Change https://summit.news/2019/07/11/new-finnish-study-finds-no-evidence-for-man-made-climate-change/ … Climate change hoax COLLAPSES as new science finds human activity has virtually zero impact on global temperatures https://www.naturalnews.com/2019-07-12-climate-change-hoax-collapses-new-science-cloud-cover.html …	0	Tweet
1155044673498603521	@RealityCheckout	2019-07-27 14:48:04	Why should anyone listen to you on climate change if you can't understand that? Against fascism, but not "anti-fascism". Nicely worded 👍	0	Tweet
1155044623921946624	@antibessteve	2019-07-27 14:47:52	Like you didn't know what antifa are!! It's pretty clear what your agenda is and it isn't just climate change, is it?	2	Tweet
1155026703711985664	@VirginieSauvag3	2019-07-27 13:36:40	So many French people and especially politician are sooo retarded !! And yes, I’m French....... I’ve given up on politician being able (willing) to do anything about climate change. We, the people, can, and I’m confident we will. Together.	0	Tweet
1155010936241082370	@seal_1988	2019-07-27 12:34:00	you probably don't have control of your twitter account but you are a pawn being used by the elite. to push their climate change agenda. go back to school.	0	Tweet
1155003083937800193	@JamesSa01681654	2019-07-27 12:02:48	Switch your stance from climate change which is absolute bullshit to cleaning up plastic pollution and I think everybody in the universe will support you!	0	Tweet
1154996789461864452	@mittyhater	2019-07-27 11:37:48	Greta. You are the product of a manipulative crackpot( or two). It really IS child abuse. Forget climate change. You should be focusing on ridding yourself of your controllers. I am surprised the authorities have so far not intervened. https://notalotofpeopleknowthat.wordpress.com/2019/07/17/icebreaker-headed-for-north-pole-turned-back-by-thicker-ice-than-expected/ …	0	Tweet
1154993438657601536	@JerryGi64464772	2019-07-27 11:24:29	Get use to it, climate change is here to stay.	0	Tweet
1154980104684101632	@supertrowel86	2019-07-27 10:31:30	Approach: pick young girl who's easily influenced but will appeal to media as sweet innocent little girl who wants to save the planet and tell us about climate change Reality: it was 38c on Thursday and 22c on Friday because of natural occurring weather streams.	0	Tweet
1154968275153018880	@TheDJValkyrie	2019-07-27 09:44:29	Greta, I support your fight for climate change, but please don't be misled. Antifa is simply short for antifascist or antifascism. It is not a cohesive movement with any organized hierarchy. Moreover, defensive violence taken against fascism is justifiable in the face of hate.	0	Tweet
1154944989258035200	@Mazdafun2	2019-07-27 08:11:57	Right-wingers are the same the world over when it comes to climate change. https://www.newscientist.com/article/2210621-deforestation-in-brazil-has-rocketed-since-bolsonaro-became-president/ …	0	Tweet
1154923978424762374	@Smedley_Butler	2019-07-27 06:48:28	I just bought that shirt. Antifa is NOT movement. It simply means "antifascist", and nothing more. Those are the same liars who say climate change isn't real. # Antifa	12	Tweet
1154904684362129409	@LEm203	2019-07-27 05:31:48	@ GretaThunberg I love watching you raise awareness. I am currently completing a project on climate change, and I need an expert opinion. Can you tweet me back to tell me what you think?	0	Tweet
1154893948739096576	@elPaco1949	2019-07-27 04:49:08	The real ‘Climate Emergency’ is western Governments pouring money down the drain. What we need is proper research, which I am sure will lead to a recognition that man-made global warming is bs. We need to learn how to manage & live with climate change, not try and stop it.	0	Tweet
1154886902584991744	@EOPAmerica	2019-07-27 04:21:08	Thank you, Greta, for all of the amazing work that you do! We agree that climate change should be every country's top priority. That is why we are asking every local and state elected official to sign the Climate Justice Letter: http://bit.ly/LetterForClimateJustice … We must act. Now.	0	Tweet
1154881090508808197	@RenewOregon	2019-07-27 03:58:03	@ GretaThunberg has recorded a song with The 1975 calling for a climate change rebellion Via @ CNN # ClimateActionNow https://cnn.it/32Tq4mc pic.twitter.com/lAbtHRYdhq	0	Tweet
1154877933732974599	@WelshCelt	2019-07-27 03:45:30	Xi Jinping extends his heartfelt invitation to yourself to openly speak and discuss Climate change! Bring a face mask as his City can be quite dangerous to Human's	1	Tweet
1154870016946384898	@WRDV51	2019-07-27 03:14:03	And guess who is the new president of Brazil? Another right wing homophobic sexist climate change denier Asscavity!!	0	Tweet
1154866455743254529	@HinrichsRahlwes	2019-07-27 02:59:54	There is nothing wrong about being against fascism & it is certainly not wrong showing it publicly. Just the other way round: fascists don’t care for humanity, but for a small group of peers... they preach hatred ... Fascism is evil: racism, dictatorship, climate change denial...	1	Tweet
1154863428390887424	@NickyDommy	2019-07-27 02:47:52	With time, hopefully you will see that fighting fascism is as critical to humanity as is fighting climate change Fighting fascism is self defense, and self defense is not the same as violence Solidarity	2	Tweet
1154860152127987712	@hercirnews	2019-07-27 02:34:51	@ GretaThunberg is a 16 year old activist who stands for action to combat climate change. Greta's voice should be heard. All young people should be. Their voices will ring loud, and will be the change that the rest of the world seems afraid to be. https://www.youtube.com/watch?v=J1yimNdqhqE&fbclid=IwAR1ZlYZJG_Oa71V19fwjwFMElQdB5GYVSUrFLPVzToa4ABZNHEv4vznYISw …	0	Tweet
1154843966392668160	@hercirnews	2019-07-27 01:30:32	@ GretaThunberg is a 16 year old activist who stands for action to combat climate change. Greta’s voice should be heard. All young people should be. Their voices will ring loud, and will be the change that the rest of the world seems afraid to be. https://www.youtube.com/watch?v=J1yimNdqhqE …	0	Tweet
1154841576264392704	@JohnLH14	2019-07-27 01:21:02	God you are an irritating little cow and hardly at the forefront of climate change. Go clean the beaches or oceans and do something useful	0	Tweet
1154839855777681409	@BrownCcfc	2019-07-27 01:14:12	When will you be visiting China 🇨🇳 Russia 🇷🇺 North Korea 🇰🇵 Pakistan 🇵🇰 India 🇮🇳 on you world tour of climate change. Can’t wait to see reception you get there.	0	Tweet
1154838662129037312	@tommydoesmore	2019-07-27 01:09:27	Weird how some so young can spout so much garbage / who is paying the bills and what motivates them to do so beyond the climate change misinformation	0	Tweet
1154835668251447296	@MyLittleRescues	2019-07-27 00:57:33	@ GretaThunberg: "i want you to act (on climate change) as if your house was on fire... Because it is." # ClimateEmergency @ ExtinctionRhttps://twitter.com/nowthisnews/status/1154833262767771648 …	0	Retweet
1154834602479050752	@brianypaul	2019-07-27 00:53:19	You should with your family take a break. Holiday A holiday away from climate change for a few weeks Then you can come back refreshed..🌏🌏🌏💚💚👊👊👊	0	Tweet
1154815537249169409	@StudioKes	2019-07-26 23:37:34	Wow, so much hate from the climate change deniers! What the hell is wrong with them?! Greta, you are brave & resilient & they are ignorant shits who will sadly never get it until it starts affecting them. I hope we manage to turn it round before that point...	0	Tweet
1154813852036587520	@Ralle002	2019-07-26 23:30:52	the reason for climate change is the wrong monetary and banking system, that causes more and more debts, because money is based on debts	0	Tweet
1154813001125519362	@RaffaelHuber9	2019-07-26 23:27:29	You are a liar! I hope you are aware that it is not proven if the climate change exists. You are predicting the great climate apocalypse and you do not know for your self whether that is true. Shame on you!!!	0	Tweet
1154806908978491392	@dan_psyd	2019-07-26 23:03:17	I’m a psychologist interested in helping more people become climate change activists. Here are my ideas about 1) how to become an activist, & 2) if you are already active, how to increase your impact. https://medium.com/@danrubinpsyd/everyone-an-activist-25f68fe6d448 …	0	Tweet
1154802213698646017	@Always_1A	2019-07-26 22:44:37	Climate change is made up bullshit.	0	Tweet
1154794484091236353	@abickerton	2019-07-26 22:13:54	@ GretaThunberg While I fully appreciate that something must be done to counter climate change. What can I as an individual in a developed country do that I am not already? I recycle, avoid driving, and despise single use plastics. Buy some land and plant trees, but on my salary?	0	Tweet
1154791424216506368	@WindsorNickW	2019-07-26 22:01:45	This is exceedingly worrying along with Arctic wildfires. @ BBCNews you need to start explaining the consequences of this, not ask the same old question is this climate change? Of course it is!	0	Tweet
1154780784563277824	@RoyalTee_8515	2019-07-26 21:19:28	Greta, here’s a suggestion free of charge. Be a kid and go play with your friends. Stop promoting the hoax of climate change. Sadly, this “industry” has duped you. You’re welcome.	0	Tweet
1154772683525017600	@shafzaps	2019-07-26 20:47:17	Climate change attacks France right after the French politicians made a mockery out of Greta	2	Tweet
1154760820594753536	@8lanch	2019-07-26 20:00:08	Brainwashed little child! 🤦 Climate change just a tool to keep the left further left! pic.twitter.com/xIRdpon9po	0	Tweet
1154748188382945280	@DerickYates1	2019-07-26 19:09:56	The people who told you it was a violent movement are the people antifa are fighting, climate change deniers, anti-abortion, islamaphobic, homophobes, wear it with pride	0	Tweet
1154745878877487104	@Cty2CtyLyle	2019-07-26 19:00:46	No plan but there are ways to reduce CO2 and US has done many: use Natural gas instead of coal; Nuclear power is clean emissions. But Germany and most of Europe doesn't want to listen to these solutions. The Climate Change alarmism is based on junk science.	0	Tweet
1154741413361438720	@agage6	2019-07-26 18:43:01	If I’d have walked into my dad when I was younger and said I’m having day off school tomorrow because we’re striking due to climate change, he’d have laughed me out of the room.	0	Tweet
1154732854233853952	@DaveSMT	2019-07-26 18:09:01	Strike traditional school,. Learn and create climate change Solutions for the world 🌎 🌞🌈	0	Tweet
1154726543719108608	@MaiaEnergyLtd	2019-07-26 17:43:56	@ GretaThunberg Climate Change Deniers abuse shows your message is getting through. Respect them, understand the pyschology of Climate Change Denial and continue your message	1	Tweet
1154721204160389122	@larkieranger	2019-07-26 17:22:43	How did you get here, did you walk or did you contribute to your fantasy Climate change.	0	Tweet
1154717853645336576	@ValiantThor16	2019-07-26 17:09:24	What you should be fighting for is pollution. If we clean up the mess humans have made, climate change will follow suit. Check out the “Great Pacific Garbage Patch”. pic.twitter.com/MeOhSIEl2U	0	Tweet
1154715783693516800	@dave_nordh	2019-07-26 17:01:11	Wow! Nice AFA shirt there, Greta! Thanks for revealing your true crusade, antifascism/leftist agenda. Also the money from this song goes to another anti-democratic organisation. Climate change, my ass.	0	Tweet
1154708876526120960	@itsme_hary	2019-07-26 16:33:44	Because of the industrial revolution, EU and other western countries are in a position of developed countries. The second world countries like India China Pakistan Brazil are suffering now with the Climate Change.. You are talking because you are suffering...	0	Tweet
1154705703560519680	@HumansAreNodes	2019-07-26 16:21:07	Climate change is a HOAX Yes, you are used by not so nice entities. Think for yourself. Sending you love and light.	0	Tweet
1154691186290020352	@AnankeAion	2019-07-26 15:23:26	Not a secret panel no, at the International Conference on Climate Change 31,487 Scientists say your basically wrong, and there should be no alarm. https://www.youtube.com/watch?v=eiPIvH49X-E …	0	Tweet
1154681026439983104	@DavidDlambie1	2019-07-26 14:43:04	Preaching to the countries that are doing most against climate change is gonna do jack shit . You need to get yourself over to China and India and start preaching to them let’s see how far it gets you . Oh and you best go by boat cuz we need to keep that carbon footprint down .	0	Tweet
1154680037578178567	@worldcitizen1st	2019-07-26 14:39:08	There is not a secret, from individuals, communities, cities&🌎countries, everyone is only talking about climate change, utilising it as a political weapon. BUT, Not collaborating in rational terms, with rational necessary concrete actions, in order to protect the environment.	0	Tweet
1154661391166509057	@worldcitizen1st	2019-07-26 13:25:02	Unless. concrete&coordinate actions in part of individuals, communities, cities&🌎countries, in relation to the environment protection are present, the goal of impact &curb the temperatures link to climate change can’t be reach. A radicalCHANGE in terms ofCOLLABORATION necessary	0	Tweet
1154659123822243840	@OllypopZA	2019-07-26 13:16:02	Get ready for "Bla Bla fakE neWs" "truMp aNd Boris sexY" "clImatE Change nO real" "WhaT is sciEnce?"	0	Tweet
1154656918457081856	@estuaryviews	2019-07-26 13:07:16	We are all fucked and still the governments sit around with their heads up their arses and do nothing. We all need to start suing them over climate change.	0	Tweet
1154634963620376577	@Call0utfakemsm	2019-07-26 11:40:02	Stop being used tell them theres always been climate change and always will be	0	Tweet
1154621403355844609	@Hvid79	2019-07-26 10:46:09	So do you have any scientific backup that these warm records has anything to do with the the climate change? No!	0	Tweet
1154618535995461633	@SenekalWillie	2019-07-26 10:34:45	I hear the press saying "The time for action is now". Wrong. It is no longer a question of what we do about climate change, but the challenge is how we survive in the changed climate. We have had warnings for decades, but we chose to ignore it. more.	0	Tweet
1154606485328015361	@MarcMoravia	2019-07-26 09:46:52	@ GretaThunberg If I hear one more politician say: "We need toook into the possibility of a sustainable and responsible way of dealing with climate change", I might puke without warning. You started great, but unfortunately your talk is as ineffective as their ability to change.	0	Tweet
1154561785275539457	@paulosa23738190	2019-07-26 06:49:14	They don't want stop with the climate change and the damages, because they think ,"the Green actions"would put the United states in 1929 again..or some "great recession" again.	0	Tweet
1154551097291206656	@JandRHunt	2019-07-26 06:06:46	And yet the naysayers are saying climate change/global warming aren’t real. They need to stop and think and do serious research before believing what people post as truth. It’s very real and it’s too far along already but we can minimize the impact it will have if we act now!!	0	Tweet
1154537402033201153	@WhiteEmis	2019-07-26 05:12:21	@ GretaThunberg and @ the1975 have done more for climate change in one day than our government how we feeling pic.twitter.com/84gq34nXWa	0	Tweet
1154528928737964032	@Hylton_twatter	2019-07-26 04:38:41	To be realistic unless we stop the cutting down of the rainforest nothing we do in this west will stop climate change ..	0	Tweet
1154524134476374016	@Tetrisnet	2019-07-26 04:19:38	Come to Australia if you want to see ☀️Hot 40°C to 45°C in Summer is normal for Suburban areas. Mid 50°C 's for Summer in Country areas. Our Govt denys Climate Change and Science. Our Govts response is " Pray for Rain ".	0	Tweet
1154515685940199424	@Creamih8	2019-07-26 03:46:04	No, because it's Earth's Natural Cycle Greta. Climate change is a hoax. You Can't fight nature. I hope you'll be allowed to go back to a normal childhood. You deserve it.	3	Tweet
1154512078343983107	@AmericaNarrati1	2019-07-26 03:31:43	You misspelled civilization. I think you should probably work on that before you tackle climate change. Just a thought. 😂	0	Tweet
1154504056527659009	@PacoPxifh	2019-07-26 02:59:51	Greta, the world needs an extraordinary climate change conference!! Is probably a big moment to shake the people's mind your voice now will be louder...be always strong, you are the strong voice of everyone # ClimateEmergency	0	Tweet
1154499446358630401	@DaveyCrockett23	2019-07-26 02:41:32	Hey. Climate change isn't caused by C02. Pass it on.	0	Tweet
1154497640681263104	@Jalalud52345457	2019-07-26 02:34:21	hey Greta please raise the issue of genocide and killings of children , women and elders in Afghanistan , it is not at all a small issue than climate change as it has impact over the world	0	Tweet
1154492480471142400	@Gerat1t	2019-07-26 02:13:51	@ GretaThunberg real emergency is population explosion since 1900. This is driving deforestsation, loss of wild life habitat & sea pollution. Governments, globalists & multis dont want reduction in population because it cuts growth. Climate change better because it can be taxed. pic.twitter.com/LNnIctOSdu	0	Tweet
1154491364567990273	@JohnnyAz12	2019-07-26 02:09:25	You are a paid propaganda shill. Ever heard of a real scientist. NOBEL Laureate? You should have a discussion with him about you're FAKE HUMAN CAUSED CLIMATE CHANGE AGENDA.	0	Tweet
1154488473614573568	@JoeOm4	2019-07-26 01:57:56	I'm not fooled for one minute. Any able adult is able to spout this climate change BS. Why are they using a child to project their message. Because it's virtue signalling to the young minds, who haven't a clue how the global elite work and who they use to spread fake propaganda.	5	Tweet
1154483307528241154	@BVandewoestyne	2019-07-26 01:37:24	Yes, there are quite some organizations and scientists that have another opinion. The consensus (about what exactly???) is far from 97%. And yes, there is for example the Nongovernmental International Panel on Climate Change (NIPCC). But you probably already knew that...	1	Tweet
1154480176715014144	@AwakenMo	2019-07-26 01:24:57	Dismayed to see 16-year-old kids explain that they are thinking about not making children so that they do not experience climate change. Fortunately our ancestors were not so fragile between 3 plague epidemics and 12 wars.	1	Tweet
1154479532750954496	@HeraldoMunoz	2019-07-26 01:22:24	In Chile, one of the most vulnerable countries to climate change, we see glaciers recede.	1	Tweet
1154477293718233093	@Saints_Dragons	2019-07-26 01:13:30	So what say all the climate change deniers?	0	Tweet
1154475739540008960	@Decolonise	2019-07-26 01:07:20	One way to actually do make it less hot within cities is to actually have less concrete an less asphalt. Not that it will combat climate change but that one is coming wether we like it or not. It is utter stupidity to not make sure there is more green than concrete in cities.	1	Tweet
1154472880786300941	@mittyhater	2019-07-26 00:55:58	Look here Greta . Kick your mother up her backside. Grow up normally. Climate change? Climate con.	0	Tweet
1154471318491992065	@mhh02	2019-07-26 00:49:46	If your real serious about climate change you be explaining why no woman should have more than 2 children as the best way it to stop the human population increasing and you be doing your conferences over the internet so your not putting green house gasses out,	0	Tweet
1154462179833331712	@QueenBe32178524	2019-07-26 00:13:27	I’m sorry, but you know diddly squat about climate change, go and start another worthless protest for all of the champagne socialist to jump on. This ones getting very tiresome due to the black hole in your argument!	0	Tweet
1154457518115975173	@jools6691	2019-07-25 23:54:55	Dear Greta. Seeing as you’re an expert and all I would love to hear your explanation as to why Climate change is only affecting the south east of England. Seems it’s decades since any records (101 years in Scotland) were broken elsewhere pic.twitter.com/E9BKqpSQUB	0	Tweet
1154452804523704320	@Melanie39413211	2019-07-25 23:36:11	Your such an inspirational young lady. Thank you for being at the forefront of tackling climate change. If we all make small changes the world would be a better place (I try do my bit) but unfortunately money talks I fear big corporations/countries wont act until it's too late	1	Tweet
1154446620035047425	@DarcessDossen	2019-07-25 23:11:37	Climate change is real and it's happening whether we ignore it or not, so the best thing we can do for ourselves accept that it's happening and act NOW!	0	Tweet
1154434727534911488	@NIMN2019	2019-07-25 22:24:22	Evolutionary history shows us quite clearly that when climate changes, species which adapt to the changes surivive: those that don't become extinct. As humans we need to adapt to climate change using our intelligence & technology. We cannot control climate change. We must adapt.	1	Tweet
1154432593963737088	@PaoloMoles	2019-07-25 22:15:53	I think many other things are hidden behind those criminal announces «Climate change» sounds like the name of a new successful movie, not a global and very urgent warning ! Let’s pronounce the right words and ACT for a global huge issue !!! For once we are facing the same problem	0	Tweet
1154428008767336450	@JohnMaksuta	2019-07-25 21:57:40	# ClimateChange is a global conspiracy by the elites to levy taxes. This is oppressive against the poor, who are the ones hurt the most by carbon taxes. These taxes will not be applied to "saving" the environment, but will be used for their personal gain. Climate change is a myth.	0	Tweet
1154427532365746177	@hmrnews	2019-07-25 21:55:46	Behold the human shield of the cult of climate change!	0	Tweet
1154426106813923328	@borisyeltzin	2019-07-25 21:50:06	Restricting climate change to a level of degrees by carbon control and political change is equivalent to trying to insert your own head inside your own colon. Go ahead, give it a go.	0	Tweet
1154420047911227393	@derekmoreton	2019-07-25 21:26:02	Climate change is a myth	0	Tweet
1154393934233264129	@Scrughat	2019-07-25 19:42:16	@ GretaThunberg hello Greta. What about the vegan movement behind the climate change activism?	0	Tweet
1154387321908846594	@JohnQPu05436686	2019-07-25 19:15:59	It’s bullshit to generate revenue for the EU which is almost financially insolvent. Climate change should not need money to fix, bc it is not real.	0	Tweet
1154368678009409543	@HILIADA	2019-07-25 18:01:54	https://youtu.be/Tx-Zmjzv_EQ Fake Climate Change	1	Tweet
1154368502578524160	@HILIADA	2019-07-25 18:01:12	https://youtu.be/dC_2WXyORGA Climate Change	1	Tweet
1154363437725753344	@tamrp69	2019-07-25 17:41:05	What a lot of CO2 this journey will create just as well climate change is a hoax	0	Tweet
1154359850308165632	@HILIADA	2019-07-25 17:26:49	Climate Change is a big hoax. everything is fake. Scientists fixed the data. The only one who can fix the climate change is God. All of you are totally ignorant people. STOP LYING ABOUT IT !!! EVERYTHING IS ABOUT 💰 MONEY. LIBERALS ARE FAKE SCIENTISTS. SHAMEFUL!!!	0	Tweet
1154349226412978177	@hermanator68	2019-07-25 16:44:37	You @ GretaThunberg are truly inspiring and the planet desperately needs more people like you in government.... Meanwhile, in Britain we now have a right-wing cabinet led by a climate-change sceptic PM.	0	Tweet
1154348556783894528	@mauro_mpa	2019-07-25 16:41:57	We went on the # moon 50 years ago. Why can’t we save the planet now? We have more knowledge, better technology, immensely faster computers, enormous budgets spent for military purpose. Let’s fight climate change as a war. Let’s put it on the # NATO agenda. And let’s attack!	1	Tweet
1154328835787243520	@Stfidel1	2019-07-25 15:23:35	U talk about climate change, moreover thousand of children are dying in # Africa without electricity, nor health care reform bill, nor good education system, and so forth & so on. U should better speak for children right in the 21st century, and the ongoing genocide in # Ambazonia	0	Tweet
1154317369453568000	@op_mikkonen	2019-07-25 14:38:01	Of course they know, they just don't care. Money is where the power is and atm fight against climate change won't bring you any money, actually opposite. This is a huge problem and needs to be solved somehow.	0	Tweet
1154311056451395584	@AlexMauricioZe2	2019-07-25 14:12:56	climate change is an emergency let`s push the goverment around the world to be responsible for climate change for the planet	0	Tweet
