Tweet id	Poster username	Tweet post Date	Tweet text	Number of retweets	Tweet type
1154302214111944705	@dgrwhippet	2019-07-25 13:37:48	I would suggest you research climate change for a few more years, you appear to know very little of the science eg what gases make up our atmosphere? what is the miserly amount of CO2? (0:04%), what % is human made CO2 of total? what influence our sun has on climate? Many more.	0	Tweet
1154299286387089409	@FieldAgent1990	2019-07-25 13:26:10	Well, I certainly hope you're walking to all these different countries and venues. All we need is another 'climate change' protester using transport which damages the climate. # hypocrite	0	Tweet
1154291471765377025	@spidercanard	2019-07-25 12:55:07	Thank you so much for all your work. The problem with those rich climate deniers is not that they don't believe in climate change ; they just think they have enough resources and money to survive. I guess if they had an average income they'd be looking for solutions.	0	Tweet
1154274667764637697	@Nufc_22	2019-07-25 11:48:20	I’m so sorry that you are being abused and denied a childhood by adults forcing this non existent climate change nonsense on you.	1	Tweet
1154273748465463296	@Ev3tonian	2019-07-25 11:44:41	@ GretaThunberg I don't care about climate change, I love how earth is warming up. I don't care about future generations. If humans don't respect animals and plants and kill them then reap what you reward.	0	Tweet
1154272741270466560	@BrunoMims	2019-07-25 11:40:41	The mean manufacturers and policy makers and corrupted experts will die of old age but we will die of climate change	0	Tweet
1154256061140017152	@DJandrewAD	2019-07-25 10:34:24	She is being raped by various political media and it is a shame to let this happen to her parents. The current climate change of the earth would be without humanity in this condition as today with humans! - MAX2017facts -	0	Tweet
1154196402223951873	@Scamper33412101	2019-07-25 06:37:20	Climate change. That's what climate has been doing for 4.5 billion years and not a human being in sight until a few thousand years ago. Made made climate change? Prove it!!!	0	Tweet
1154183807253110784	@NoToTheUN	2019-07-25 05:47:18	It's almost like her handlers don't know that the head of the IPCC in 2010 said: "...one has to free oneself from the illusion that international climate policy is environmental policy. Instead, climate change policy is about how we redistribute de facto the world's wealth..."	0	Tweet
1154182565638656003	@NoneOfy88049470	2019-07-25 05:42:21	You are children and therefore easily manipulated. The IPCC is a UN linked group that will make up any stat that will get them more control over all peoples. Your civilization is at risk but not from climate change. It's the Socialists.	0	Tweet
1154180685378260993	@MarkL00775	2019-07-25 05:34:53	N hotter every year now, n yet there are people that still deny there's such a thing as climate change, money the main blockage to any action being done, should be put aside n action taken now before there becomes no future for any living thing on the planet	0	Tweet
1154177295919308802	@liztaggart2	2019-07-25 05:21:25	Sorry, you act like you don't know evidence contradicting "climate change" exists. How about living up to your own standards and do some more research.	0	Tweet
1154169513471909888	@SugiyamaRobert	2019-07-25 04:50:30	When you come up with a solution for world Greta, then maybe climate change can be addressed by the world leaders.	0	Tweet
1154167008050724867	@bobo33262097	2019-07-25 04:40:32	Climate change is a hoax on American people in idiots like you keep pushing it	0	Tweet
1154163320359813121	@Karmageddon67	2019-07-25 04:25:53	Same for overpopulation. You think climate change denial is entrenched, try overpopulation denial... https://academic.oup.com/bioscience/article/67/12/1026/4605229 …	1	Tweet
1154158521421897728	@SMeldrew	2019-07-25 04:06:49	The two words that really incense climate change freaks are, “David Bellamy”! You could also add the 91 Italian scientists that recently wrote to their own Government demonstrating scientific support for the ‘sceptical view’ to that as well, if you wish!	0	Tweet
1154158327154315270	@Jscott1145	2019-07-25 04:06:03	@ GretaThunberg @ AOC As these two have told us we must take action now, right @ HouseDemocrats @ SpeakerPelosi BBC News - Climate change: Current warming 'unparalleled' in 2,000 years https://www.bbc.com/news/science-environment-49086783 …	4	Tweet
1154156058551521280	@cryptocoinage	2019-07-25 03:57:02	"One has to free oneself from the illusion that international climate policy is environmental policy. Instead, climate change policy is about how we redistribute de facto the world’s wealth." - IPCC official Ottmar Edenhofer	1	Tweet
1154147178249510912	@Allouchsit	2019-07-25 03:21:44	"IPCC" means "Intergovernmental Panel on Climate Change." This is NOT a scientific report. It is a government report largely written by nonscientific politicians. It is basically garbage.	0	Tweet
1154145130850316288	@liv_XR05	2019-07-25 03:13:36	This is the George Soros stooge pushing the BS climate change hoax.	0	Tweet
1154143319875837952	@Djdheadbt	2019-07-25 03:06:25	Who warned us that the ice age was ending? Did you warn the dinosaurs that the ice age was coming? If only you were around back then, we would have to listen to your self righteous rubbish now. Climate change doesn’t exist it was designed by politicians and business to make money	0	Tweet
1154141569416482816	@m3speeder_j	2019-07-25 02:59:27	Also I know we have climate change because we have had climate change for millions of years.	0	Tweet
1154134999622287360	@SweetWm5150	2019-07-25 02:33:21	You are young so you did not experience these things science told us would happen: 1. The coming Ice Age in the 1970's. 2. Everyone getting fried from the hole in the Ozone layer in the 1980's. 3. Global warning in the 1990's re-branded as Climate Change due to a cooling trend.	0	Tweet
1154124208299028480	@LuisZamora_Nica	2019-07-25 01:50:28	Why do you go to # China # India and # Indonesia to speak about the pollution and climate change that these countries are responsible for? Or # Russia ?	0	Tweet
1154123917780537344	@alnwright	2019-07-25 01:49:19	@ GretaThunberg I am doing all I can: no car, 16 solar panels, insulated house, promote bicycling, talk about climate change, to everyone including politicians & promote this https://citizensclimatelobby.org/energy-innovation-and-carbon-dividend-act/ …. Pls educate world about carbon pricing @ citizensclimatehttps://twitter.com/GretaThunberg/status/1153940926517194752 …	0	Retweet
1154121677942349824	@_Gravity_Man	2019-07-25 01:40:25	maybe she can talk about sex traffiking of her generation and not worrry about climate change bullshit	0	Tweet
1154121100176965632	@DLMtd2	2019-07-25 01:38:07	All you climate change deniers just buzz off!!	0	Tweet
1154120541822840832	@TrevorP74003986	2019-07-25 01:35:54	Blah blah blah. Al Gore said the same thing 20 yrs ago, that we would all die in 10 yrs. They're taught this garbage in school and the media reinforces it. Climate change remains the biggest hoax ever perpetrated on the human race.	0	Tweet
1154120224603611136	@OliverC26152412	2019-07-25 01:34:38	Ah moans about climate change, flies, trains cars all around the world 😂😂 the young lass alone is causing more harm to the environment than I do driving my diesel 9 miles collectively every day, stupid hypocrite	0	Tweet
1154120197009096706	@JoshuaCoburn17	2019-07-25 01:34:32	I realize that climate change is in-fact happening, and in-fact has always happened in the past. This is irrefutable! However, you will be adding insult to injury if we are led to believe we must budget carbon in any form! Carbon credits or any scheme like it ARE A TAX ON LIFE!	0	Tweet
1154119629104734209	@fantasticsofa	2019-07-25 01:32:16	In the old days brainwashed nutters like you Greta would be sectioned in the UK. Don't fall for this climate change con job. The climate has always changed even when man was not on the planet and carbon emissions are irrelevant.	0	Tweet
1154117419683631104	@vsiscott	2019-07-25 01:23:29	@ GretaThunberg great speech. However, one report does not make it a crisis. What do you know about ice ages? Where are we at in the cycle, what happens? Climate change is what the planet does. Humans, in the continuum of the planet haven't even registered yet.	0	Tweet
1154114318448975878	@indijomo	2019-07-25 01:11:10	Greta, it's worse than climate change they are bringing in GMO crops to the UK and 20,000 5G satellites to implement Orwellian social control, this must be stopped!!	0	Tweet
1154110120990793730	@daschmidt883	2019-07-25 00:54:29	@ GretaThunberg - You are my hero!! Children taking the mantle to battle catastrophic climate change because adults are not "mature enough" to face the truth. # ClimateEmergencyhttps://twitter.com/GretaThunberg/status/1153940926517194752 …	0	Retweet
1154108233952288768	@florentino5012	2019-07-25 00:46:59	BRAINWASHING our youth should be a crime. GLOBAL WARMING/CLIMATE CHANGE HYPE is all a HOAX by the liberals to CONTROL American Businesses and control American lives.	0	Tweet
1154108194928648192	@JaxBrownZA	2019-07-25 00:46:50	@ GretaThunberg News - Climate change: Current heating 'unparalleled' in 2,000 years https://www.bbc.co.uk/news/science-environment-49086783 …	0	Tweet
1154107735870328832	@Scooter30205	2019-07-25 00:45:01	Climate change is the single most important issue facing us as a civilization. our man made inventions and norms pale in comparison. The youth get it, but the old fossils in the government want to continue using fossil fuels, enriching themselves and others.	0	Tweet
1154105604153257985	@CuffJMan	2019-07-25 00:36:32	Not sure if many will agree but I think religion has a lot to do with denying climate change. Why would millions of people who believe that when the world ends it will be ‘gods will’ or ‘gods plan’ and not the fault of humans?	0	Tweet
1154104821588340737	@RobertT52999302	2019-07-25 00:33:26	All they politicians you had Pissing their knickers over climate change,have went back on their word😟 especially that Scotish poison dwarf,Sturgeon😕	0	Tweet
1154104768966680578	@Sfcbows	2019-07-25 00:33:13	You’re travelling to lecture people on climate change Ok..... pic.twitter.com/MoyVdUe3Uk	0	Tweet
1154104687630659584	@ArtMarius2	2019-07-25 00:32:54	@ GretaThunberg 1/ I know 2 good and respectable people, known among other things, for their fight against climate change and in favor of preservation of the environment, they could help you send Your message in the Parliament of Canada.	1	Tweet
1154104420961050624	@peterpalmer52	2019-07-25 00:31:50	What about your education? Say, learning that we need CO2 to live. Or that CO2 isn't responsible for climate change? Maybe some astrophysics and the role of solar flares and cosmic rays on Earth's climate. Or basic evolution: adaptation is key to survival.	0	Tweet
1154072770952728578	@Iliketostrut	2019-07-24 22:26:04	@ GretaThunberg Hi Greta. I am now just becoming aware of your fight against Climate Change. You're an inspiration, and I'll do my best to help you from my place in the world. 🕊️🌎	0	Tweet
1154064544148459521	@Vickaric	2019-07-24 21:53:23	@ GretaThunberg This is how our current Opposition party thinks we ‘address’ climate change! https://twitter.com/CPC_HQ/status/1153726973606289421 …	0	Retweet
1154057712528961539	@KrisSamsel	2019-07-24 21:26:14	Exactly. Adults need to toss every politician that don’t want to act on climate change. Get them out ASAP!	0	Tweet
1154044664908877824	@ArtMarius2	2019-07-24 20:34:23	Thanks for following the proposal to speak before the parliaments of the friendly and combatant countries of the same battles as It is the climate change and the preservation of the environment. France is one of them. Congratulations!	1	Tweet
1154044429155442688	@lenelderup	2019-07-24 20:33:27	Be strong Greta, and go on fighting for New generations on the planet! Adults must take responsability for climate change and not put the burden on children. 🍀	0	Tweet
1154035772598571008	@alachuagreen	2019-07-24 19:59:03	We can debate how much climate change is due to human action vs. solar cycles or natural patterns but there is no denying that it is happening, and human activity is accelerating it. A huge impact is from massive geoengineering & weather warfare projects: https://www.geoengineeringwatch.org/	0	Tweet
1154033941793271809	@mushotoku2019	2019-07-24 19:51:47	Yes, it sums up most of french politicians' behaviour, but I think you should have had a word against the treaties signed by Europe / France which accelerate pollution and global climate change. France took the wrong path again just a few hours after your talk.	0	Tweet
1154031945015156739	@magneleokarlsen	2019-07-24 19:43:51	And # IPCC experts do not tell politicians the full story. Their reports are always too soft on the seriousness of climate change.	2	Tweet
1154019159270973440	@hans_daams	2019-07-24 18:53:02	Magnificent! Question: do you know what the politicians produced for backing their opinions about climate change and their reasons not to attend to your speech. For sure, they must produce more than a simple: I don't want, I am not convinced, I don't trust the given statistics!	0	Tweet
1154014552373248000	@demokratiecasa	2019-07-24 18:34:44	@ GretaThunberg Sinds Europe is not able to stop climate change (not enough influence) will you demonstrate in countries hoe are able to make a change (China, Afrika, India and US)?	0	Tweet
1154005081618038784	@moniquedhooghe	2019-07-24 17:57:06	@ GretaThunberg thank you for all your hard work We need to hold policy makers accountable...we need to exert political pressure to do all that can be done to avert ecocide thru climate change https://twitter.com/Independent/status/1153969251709009920 …	0	Retweet
1154004365423734784	@karxpava	2019-07-24 17:54:15	@ GretaThunberg is so eloquent. yes, why are so few politicians addressing climate change? the consequences are global and will cause even greater instabilities as people flee uninhabitable regions https://twitter.com/GretaThunberg/status/1153940926517194752 …	0	Retweet
1154003049574277120	@Daniel2Davies	2019-07-24 17:49:02	The UK government ( @ Conservatives) have committed to cutting funding to those government departments that are tasked with tackling climate change. Taking action is a positive step with fantastic opportunities. Opportunities that the UK government doesn't not want to take.	0	Tweet
1154002474551980032	@Stinson_	2019-07-24 17:46:44	Funny how liberals can get behind phony climate change science but deny the actual, fact based science that states that there are only two genders. WTF? pic.twitter.com/aXS5FHKGAy	0	Tweet
1153996870957588480	@kacie_clement	2019-07-24 17:24:28	I am so very proud of you. Stay true to your beliefs, your voice, your integrity. You will one day be a strong amazing world leader in the fight of climate change. You’re well on your way! Thank you.	0	Tweet
1153988694384267264	@vancat85	2019-07-24 16:51:59	There is something nauseating about using this young automaton for propaganda purposes, getting her to spout lies which the climate change lobby can later deny.	13	Tweet
1153986768536055808	@sundayshopping	2019-07-24 16:44:20	https://www.facebook.com/Save-Our-Sundays-102221753225986/?ref=bookmarks … Greta it's time you speak about it. It's not only the plastic we are using that contributes to Climate change but the lights as well. https://www.facebook.com/Save-Our-Sundays-102221753225986/?ref=bookmarks … .Please take a stand this is so so wrong.	0	Tweet
1153986346853314561	@sundayshopping	2019-07-24 16:42:39	Why is it that people fighting Climate change aren't talking about it? Stores that have there lights on 24/7 that are burning fossil fuels. Is it because people are addicted to shopping? We have to take responsibility for this and realize that we have problem.	0	Tweet
1153986095182336002	@fathoms_deep	2019-07-24 16:41:39	In 2015 the 'Climate change industry' was estimated to be a $1.5 trillion global business.	5	Tweet
1153985704394940416	@ju_nias	2019-07-24 16:40:06	Climate change is a big hoax which will fall apart soon!	0	Tweet
1153984745962975232	@Crosscolin88	2019-07-24 16:36:18	You recently claimed that our planet has no future, unless politicians act decisively on "Climate Change". You later said that if they didn't act they would be seen as criminals in the future. Which future is that, the one that we don't have? I think you're being used, for money	0	Tweet
1153984215324737536	@MarvelAngel13	2019-07-24 16:34:11	Can we arrange an interview with you for my new climate change movie production with @ RealGDT @ chrisrock and @ GwynethPaltrow from # AvengersEndgame Greta? 🎬	0	Tweet
1153979751200989184	@officialsujan01	2019-07-24 16:16:27	@ GretaThunberg urges people to to 'unite behind the science' in powerful climate change speech..against # climatechange to all globle . And People !!!!https://twitter.com/Independent/status/1153969251709009920 …	0	Retweet
1153976904220925952	@Gill01352720	2019-07-24 16:05:08	Should be in school not whining about climate change, which she has no idea about	0	Tweet
1153975406900523008	@favouresther13	2019-07-24 15:59:11	@ GretaThunberg Thanks for being a world hero daring to do what many have failed to do I # agree with climate change is a globe issue the world has to stand with you in this # StandwithGretaThunberg	0	Tweet
1153973293654913024	@JamesRider3	2019-07-24 15:50:47	I'm looking forward to studying your latest scientific paper on climate change.	0	Tweet
1153971285988454400	@cherbic555	2019-07-24 15:42:48	Here’s a challenge for you, Greta. When I visited China a few years ago, there were many, many factories belching out smoke of all the colours of the rainbow. Go and speak to the Chinese authorities about Climate change and pollution, ok?	54	Tweet
1153970565411168256	@happyyoungfella	2019-07-24 15:39:57	Go lecture China & India! Begging the question of whether climate change is real, there's absolutely no proof that anything we do now will significantly alter the effects of climate change. It's better to save our resources to mitigate real problems as they occur.	1	Tweet
1153970404144418816	@Eurylochos_Fr	2019-07-24 15:39:18	Even for skeptics about climate change. They can't ignore all the disasters humans are doing for all animals and vegetables. https://fr.wikipedia.org/wiki/The_Anthropocene_Extinction … Change our way of life should be the primary purpose of politics. Unfortunately it is not what want lobbies.	0	Tweet
1153967958462517248	@GaryNoble19	2019-07-24 15:29:35	@ GretaThunberg take no notice of these idiots denying climate change, just keep pointing to the facts.... well done and keep up the great work 👍👍	0	Tweet
1153959468205584384	@piatallgren	2019-07-24 14:55:51	Greta = Truth. Refering to the # IPCC report. Repeating the # UN scientists. Intergovernmental Panel on Climate Change. http://www.unep.org/	1	Tweet
1153958269620293632	@TCrusaderr	2019-07-24 14:51:05	They wont hear or change things until bodies start being counted Know those words cause in the near future when the first thousands of people start to die the countries will all the sudden start to work on fixing climate change	0	Tweet
1153955019273711618	@FlashMob4EU	2019-07-24 14:38:10	Thanks Greta, keep up the great work and you have our support. We need far more global protests against governments that are not doing enough to halt climate change including here in Britain	4	Tweet
1153954890743341057	@JamesFox6	2019-07-24 14:37:40	Please go back home and play with your dolls. Climate Change is a scam, you are being used to push this evil agenda.	0	Tweet
1153950673135898624	@NPCBOBO	2019-07-24 14:20:54	I think you'll find it's # 5G that's going to cause an extingshin event! Not your climate change BS! 👍😲https://youtu.be/1oRnHkx26Gg	1	Tweet
1153944147990122496	@balder383	2019-07-24 13:54:58	maybe learn the real climate change that is always been on the planet billions of year? the name is the sun output and earth vulcanos plus the the space rays.. Video series 4, Part 5B, covers where to go to survive the next Polar Reversal and Ice Age. https://www.youtube.com/watch?v=dtFwzbJ6rkk …	4	Tweet
1153941911855611904	@SCanopee	2019-07-24 13:46:05	Thanks for your speech in the French parliament, hope a lot of people heard you and change their minds on climate change and understand the urgency to act together.	3	Tweet
1153941814837153793	@MaximeEqual	2019-07-24 13:45:42	People don't seem to unite behind science on climate change. Why? Why suddenly landing in major illiteracy? Is there an underlying reason for this that we don't know about?	0	Tweet
1153909922578366465	@elmmoves2	2019-07-24 11:38:58	Thank u Greta 4 ur continued hard work on the fight 4 our environment & climate change awareness. U r an inspiration 2 many including myself & 12 year old son in Portland, OR USA. THANK u 4 ur inspiration. It’s a difficult time in the world. U bring so much Light. Gratitude 2 u.	0	Tweet
1153905793126797312	@beaubrent	2019-07-24 11:22:34	You are like a climate change Joan of Arc.	0	Tweet
1153902353814155264	@JenDegtjarewsky	2019-07-24 11:08:54	Dear Greta - I am so glad you are here to say the hard things to politicians & advocate for # science. Climate change IS a crisis & those who will not listen will still feel the effects of climate change, even if they don’t acknowledge its existence. Keep fighting. 💪	0	Tweet
1153874776718528512	@roy_lesage	2019-07-24 09:19:19	I don't blame you for regurgitating garbage, that's all you have been fed, when you grow up you'll see how ridiculous the climate change narrative is.	0	Tweet
1153865301236125697	@WesleyGripes	2019-07-24 08:41:40	Lol, the science says that climate change is not influenced my human activity. How dumb do you have to be to blindly believe this weird kid?	0	Tweet
1153864892774060035	@angusx13	2019-07-24 08:40:02	Man made climate change is hoax. https://newspunch.com/tens-of-thousands-of-scientists-declare-climate-change-a-hoax/ …	0	Tweet
1153861866122285059	@NicoRidley	2019-07-24 08:28:01	Congrats Greta! If only China and the USA would hear you and changed their attitudes! I wonder if there is any chance that pure capitalism could succesfully "deal" with climate change...	0	Tweet
1153851769992241152	@kriss_krinkle	2019-07-24 07:47:54	Climate change is nothing but an excuse to foist communism on the west. pic.twitter.com/2FRYkBsdTE	0	Tweet
1153840617652404225	@oathkeeper1985	2019-07-24 07:03:35	Science....ACTUAL science....not pseudoscience, proves climate change is a myth...	0	Tweet
1153840178366226432	@craiggorsuch	2019-07-24 07:01:50	Young lady, you are being used by politicians who care neither about you, nor climate change per se save the political power they gain	0	Tweet
1153831677279346689	@USA4FutureGen	2019-07-24 06:28:03	First of all there are countless numbers of scientists that would say you are crazy. Climate change always has and always will exist. This world continues on in cycles. Secondly - God created this complex world and it will remain until he determines otherwise.	0	Tweet
1153827343871467521	@GlennJericho	2019-07-24 06:10:50	Climate change rhetoric pic.twitter.com/b9nhAY75RP	0	Tweet
1153819593455984642	@climatecouncil	2019-07-24 05:40:02	@ GretaThunberg has received the first Freedom Prize in France, and urged people to be aware of the “silent war going on” - climate change. She will donate the AU$28,000 prize money to four climate change organisations. http://ow.ly/H1B950v9Eru	1	Tweet
1153810489501028352	@hagia_s	2019-07-24 05:03:52	We evolved through climate change. The entire planet evolves through climate changes. This is not man made. Socialism is a lie.	2	Tweet
1153810126907691008	@BobbyBouchea	2019-07-24 05:02:25	Dear climate change has been going on with earth since it’s existence, you won’t be changing anything that God has been in control of since the beginning of time. So sit back and enjoy the ride.	0	Tweet
1153803766883241984	@Sean70591353	2019-07-24 04:37:09	Exploiting a girl with documented mental illness to further your political agenda under the guise of climate change. Disgusting.	0	Tweet
1153803402704326656	@renegnozid	2019-07-24 04:35:42	She is just a kid being used by interest group to promote their own financial interest. What dries she know of the deeper cause of climate change!!	0	Tweet
1153797858451021831	@grege1953	2019-07-24 04:13:40	Sorry Greta ... But you have been misled ... Manmade climate change is a hoax !! ---> https://twitter.com/VickiMcKenna/status/1149685041846317056?s=19 …	0	Retweet
1153797145821974528	@GrandvilleShow	2019-07-24 04:10:50	Why are people taking the word of a 14yo as if she is the top most scientific authority on climate change? @ GretaThunberg is a propaganda piece and nothing more.	0	Tweet
1153786564209590272	@Zeex_The_Fox	2019-07-24 03:28:47	Your lack of scientific sources is telling. Climate change has been a natural cycle of the planet for millions of years. Mankind's impact on the climate is insignificant, the REAL science has proven that. I'll stick to the experts on the topic.	0	Tweet
1153784224144449544	@senthazalravi	2019-07-24 03:19:29	Climate change may be a fake news and academic funding scam, but you fight for what you believe in. I like it. Good that you have a celeb mom, so you don’t have to study for a living, but I advise you to focus on studies other than climate change. For example mathematics.	0	Tweet
