Tweet id	Poster username	Tweet post Date	Tweet text	Number of retweets	Tweet type
1156310212996927489	@Tangomitteckel	2019-07-31 02:36:52	Don't go on the sail boat! The people indoctrinating you are evil. They may be planning on throwing you overboard to make you a martyr for climate change.	0	Tweet
1156230952374427648	@Ze_Abitbol	2019-07-30 21:21:55	Hi! We are very sensitive about climate change and will be glade to spend 2 weeks holiday in New York and also in California. After that trip will it be possible to borrow that boat and its crew to get me there ? Ps: all I can offer is a great time with a cool guy 😎	0	Tweet
1156214392716963841	@Patobato1	2019-07-30 20:16:07	@ GretaThunberg I see climate change, and having technology to combat it, governments continue to use fossil fuels. In my city we had never had 40 °. I support you. 👋from🇲🇽	0	Tweet
1156211599096651778	@jdwright67	2019-07-30 20:05:01	@ GretaThunberg Hi Greta, I'm a Producer with weather .com, we are following your planned sailing trip to the USA and wanted to see if you ever have time to talk, we would enjoy listening to your activism on Climate Change. Thank you for your time. Dan daniel.wright@weather.com	0	Tweet
1156209051811946496	@dernickmueller	2019-07-30 19:54:53	@ GretaThunberg There is way more important shit going on in this world than the climate, climate change is a thing humans cannot stop nor influnce. Climate change happend already millions of years ago when no humans where around...	0	Tweet
1156175514865848320	@CommonCents61	2019-07-30 17:41:38	You simple, ignorant, little girl. The changing paths of orbits of the solar system is the overwhelming cause of climate change. Planets many times larger than ours have had many catastrophic events over the millions of years without any human habitation. Speak with an astronomer	0	Tweet
1156149091207995392	@AdamSrigley	2019-07-30 15:56:38	@ GretaThunberg @ Fridays4future @ FFF_Sweden @ Malena_Ernman @ Svante_Thunberg @ FFF_Sweden "The terrible truth of climate change." Joëlle Gergis is an award-winning climate scientist and she contributes to the upcoming IPCC report. https://www.themonthly.com.au/issue/2019/august/1566136800/jo-lle-gergis/terrible-truth-climate-change …	0	Tweet
1156140506717593601	@AdamSrigley	2019-07-30 15:22:31	@ GretaThunberg @ Malena_Ernman @ Svante_Thunberg @FRIDAYSFORFUTURE The terrible truth of climate change. Joëlle Gergis is an award-winning climate scientist writing on the comming IPCC report. https://www.themonthly.com.au/issue/2019/august/1566136800/jo-lle-gergis/terrible-truth-climate-change …	0	Tweet
1156139307964469248	@HenryHumphries	2019-07-30 15:17:45	I’m so sorry to read that you left your home without a T-shirt! Hopefully you weren’t uncovered for too long. At least the climate change kept you warm enough. Or maybe you can spin the story and say that the heat was the reason you forgot to dress properly. *sarcasm off*	0	Tweet
1156138187846311936	@AdamGosling4	2019-07-30 15:13:18	I'd like to thank Greta. For the first time today, Trump is now odds-on with all bookies to be re-elected. I believe this is in no small part thanks to her putting the fake "climate change" agenda as the lead issue for Democratic Presidential candidates. Please, keep it up 👍	0	Tweet
1156136371721052160	@_pedrovsky	2019-07-30 15:06:05	Greta, it would mean a great deal if you could extend your trip and visit a few Central and South American countries as well. Some of the greatest environmental struggles are fought by our indigenous peoples, and tropical regions are set to be much affected by climate change.	0	Tweet
1156120691508305920	@DavidLennonFre1	2019-07-30 14:03:47	Climate change is fake, not real. Stop listening to this kid, she is telling kids to skip class so they can protest about fake climate change.	0	Tweet
1156116943998455809	@Ptrck66563198	2019-07-30 13:48:53	Talk to me about climate change when you have a degree in climatology and have 5 years+ field experience, I mean really weres your evidence.... Hmmm Where's your paper, thesis whatever... I feel sorry for you.. Your being used and exploited by the politicians and climate groups..	0	Tweet
1156109470348410880	@JackRya03440050	2019-07-30 13:19:11	Good news? Simply proves you are a grandstanding climate alarmist hypocrit who doesn't practice what she preaches! Lucky your carbon footprint won't any difference to climate change and global warming or cooling. Climate involves much greater forces than man's influence.	0	Tweet
1155982743215300608	@redurs73	2019-07-30 04:55:37	Keep speaking up and pushing the conversation about Climate Change with facts. I admire your passion and boldness. Awareness will aid in holding everyone accountable! The other women in this Vogue issue should be just as honored to be in your company.💞👏🏽🗣	0	Tweet
1155974294624600066	@nickmyer	2019-07-30 04:22:03	What a shock you're supporting the UN & its agenda. Who would have thought. Anyway..always worth noting Greta that boat rides don't save Earth from the New World Order's "Climate Change" scam agenda that is fueled by Weather Warfare( inc Heatwaves)& Electromagnetic Wave Warfare. pic.twitter.com/JTywETdycH	5	Tweet
1155962597977423876	@MargieAt5	2019-07-30 03:35:34	Greta, you are a child. The future will come soon enough and you need to prepare yourself - not for climate change but for the criticism you will get for having fooled so many people. The earth will still be here doing what it does and you and your followers will feel stupid.	0	Tweet
1155960710901276673	@EliahGutierrez	2019-07-30 03:28:04	You can wear whatever u want,u can have whatever political view. When a cloth is more important than climate facts,something is very wrong.Climate change is about EVERYONE on Earth and is what brainless people like Vox will never understand.We need u!! 🇪🇸	0	Tweet
1155916214855786498	@Magnetron00	2019-07-30 00:31:16	Climate change is not because of humanity, climate change is a thing that is going on on earth for millions of years, we are just starting to go in a new age.. please little girl, don't let these activist polute your brain. I hope you will see the truth when you educate yourself	0	Tweet
1155910331073552390	@HelmutE6	2019-07-30 00:07:53	”Greta Thunberg” a great product for someone that wants to use Greta to earn money on climate change! # freegretathunberg # climate # GretaThunberg # climatechange # fake # fakenews # product # someoneelseisbehindthis # gotoschool # stopbothering # stayinschool	0	Tweet
1155904652392747011	@jdeanknight	2019-07-29 23:45:19	A great opportunity to influence the world of fashion, I hope you can do that. Climate change is a consequence of inequality and greed, I hope the wealthy readers of @ vogue @ voguemagazine @ BritishVogue will hear.	0	Tweet
1155887646994051073	@GemUmesh	2019-07-29 22:37:45	@ GretaThunberg first time in history I guess..my city is getting alternate day water supply..as there is no enough rain..Climate Change at doorstep..I m spreading awareness on social media amongst the friends..and talking it about with common people..	0	Tweet
1155886928178401280	@iwannago_higher	2019-07-29 22:34:53	And yet some idiots will still argue that there is no climate change, and that burning fossil fuels is okay. So stupid and dangerous!	0	Tweet
1155861909951975424	@worldcitizen1st	2019-07-29 20:55:28	In realistic terms: Concrete&coordinate actions among individuals, communities, cities and 🌎countries, relate to the protection of the environment maybe....can count with the impact necessary to curb the temperatures link to climate change.	0	Tweet
1155851578651414528	@1rolf_heinemann	2019-07-29 20:14:25	Please leave ALL electronic devices such as cell phone, laptop etc. at home. And remember avoiding the use of ANY other electrical appliances as these will contribute to the so called climate change. God speed	1	Tweet
1155839888694136832	@FerranR3	2019-07-29 19:27:58	That's the definition of accelerating climate change. This natural disaster is, at the same time, an effect and a cause of climate change ...which will invariably cause many more natural disasters in the future.	0	Tweet
1155809967854759936	@epersson	2019-07-29 17:29:04	@ GretaThunberg Greta Thunberg, climate change campaigner and student: https://www.vogue.co.uk/gallery/forces-for-change-british-vogue-september-issue-cover#z6jPq6pzvx0 …pic.twitter.com/V9ZZeZKvdp	0	Tweet
1155803280036904960	@karan6388	2019-07-29 17:02:30	How is it going to affect our fight against climate change? On ground level....	0	Tweet
1155793709394477056	@moonbites	2019-07-29 16:24:28	Whatever small steps we have each made to mitigate climate change mean that we have tried. I am however, like many, in awe of the lengths that @ GretaThunberg will go to to get her message across. God speed you all safely there.https://twitter.com/GretaThunberg/status/1155764342274629632 …	1	Retweet
1155780541230276610	@paul__tully	2019-07-29 15:32:09	@ GretaThunberg 40 years ago, scientists predicted climate change. And hey, they were right http://theconversation.com/40-years-ago-scientists-predicted-climate-change-and-hey-they-were-right-120502?utm_source=twitter&utm_medium=twitterbutton … via @ ConversationEDU @ ExtinctionR @TDeclares @ UNFCCC	1	Tweet
1155761568216469505	@OliviaCrellin	2019-07-29 14:16:45	@ GretaThunberg Hi Greta, I hope you're well. I have a proposal for you connected to raising a large amount of money for climate change and climate action. Can you follow me so we can DM?	0	Tweet
1155757754050592770	@GalaxyCripple	2019-07-29 14:01:36	@ GretaThunberg @ MollyMEP @ TheGreenParty @ XRBristol - I keep hearing we have 18mths before climate change becomes irreversible, but why? Genuine question from concerned inhabitant of Planet Earth	0	Tweet
1155744915428712448	@78_adams	2019-07-29 13:10:35	Remember when you were asked "What do you say to climate change deniers?" and your answer was "I don't"? That's how you should deal with these people, too. They want to change the subject so we're talking about you instead of about climate change. Don't take the bait.	0	Tweet
1155646653547679745	@elyduhh_	2019-07-29 06:40:07	@ GretaThunberg is woke about the problems of today, about the issue of climate change more woke than the leaders who are supposed to make a change	0	Tweet
1155618222822944768	@theBotanizer	2019-07-29 04:47:09	Opposing climate change IS a political position, as is opposing fascism. You are in a unique position to TAKE A POLTICAL POSITION and influence other to do so. This is the only way we can defeat climate change, which will only ultimately be stopped if we defeat capitalism	0	Tweet
1155611982176743426	@KenSchultz87	2019-07-29 04:22:21	@ GretaThunberg Great to soak up the adulation of misguided elites and indoctrinated students but you should have a serious look at the science of climate change before you make even more of a fool of yourself http://bit.ly/2OkRle6 # ClimateChangeIsReal # ExtinctionRebellionhttps://twitter.com/JohnKeily1/status/1155320139488739328 …	0	Retweet
1155549841176563712	@ChrisA3030911	2019-07-29 00:15:25	The only people getting pissed off were those who were never going to be on your side, or even believe in Climate Change, Greta. It’s kind of like my Twitter profile; the only people who get pissed about it and question me about it are actual Nazis and White Supremacists.	0	Tweet
1155540867358298113	@LOudestVibE	2019-07-28 23:39:46	Don’t fall for they’re trap. Focus on climate change	0	Tweet
1155521286619238400	@superestribillo	2019-07-28 22:21:57	from Spain https://www.superestribillo.com Against climate change	0	Tweet
1155500185860169729	@InclusvEdPartnr	2019-07-28 20:58:07	@ GretaThunberg , you do you with pride. You have many fans!—many of us ashamed adults who couldn’t figure out how to get people to listen about climate change. Once again a child is leading us. Very proud to be one of your followers!!!	0	Tweet
1155499221405118465	@AnthonyConsalvo	2019-07-28 20:54:17	You became a darling of the Left as an activist against climate change. But that comes with consequences like this. If I was you, I would leave activism and just be a kid.	0	Tweet
1155493660601069568	@XitlalliC1	2019-07-28 20:32:11	@ GretaThunberg Today we went to Chicago to pass out climate change awareness brochures we made! We are inspired by you and will continue to be💙💚 # SundayFunday # savetheearthpic.twitter.com/KfIPPdE8ll	0	Tweet
1155471060160176128	@RichReed84	2019-07-28 19:02:23	Don't follow their narrative and set your own. They will do all they can to set the conversation elsewhere but when you talk about climate change it leaves them on the back foot.	0	Tweet
1155452740061061120	@airstripone84	2019-07-28 17:49:35	You know the world is ending due to "climate change" but can't choose an appropriate T-shirt to wear whilst you're trying to lecture us on junk science? 🤔	0	Tweet
1155451123395903490	@ChristyMarie223	2019-07-28 17:43:09	When hasn’t the climate changed? There are camels & palm fronds under the ice in the Arctic. Solar & volcanic activities are the main drivers of climate. The man-made climate change hoax is about $$$ and control.	0	Tweet
1155437665195610113	@MMrtornado	2019-07-28 16:49:41	@ GretaThunberg So where has the climate changed today, Greta? Is your neighborhood unlivable now because it's become a desert, rainforest, or arctic climate? You're fighting anthropogenic climate change.... So where has the climate changed?	0	Tweet
1155437392318386176	@jannmyr	2019-07-28 16:48:35	This is the absolute wrong reaction. No one should ever apologize for being anti-fascist! Rightwing claim that it’s all violence but well they also claim that there ain’t no climate change	0	Tweet
1155433915416530944	@Kate_samuel	2019-07-28 16:34:47	@ GretaThunberg you have inspired my 8 year old daughter. She has made her own climate change t-shirt. She is passionate about stopping climate change # stopclimatechange # reducereuserecyclepic.twitter.com/jtD492JHQ5	0	Tweet
1155428854003044352	@bacardinen	2019-07-28 16:14:40	CO2 is not carbon Carbon dioxide is a CO2 compound / molecule 🔥 One carbon atom and 2 oxygen CO2 is not a poison or a pollution! Nor should it be classified as an emission Without CO2, there would be no life on earth 🌿🌱 CO2 has not caused any climate change 🌍 in history pic.twitter.com/5ScwPndyUv	0	Tweet
1155419025213665280	@f00g3n	2019-07-28 15:35:36	Both capitalism and nationalism as ideologies are fundamentally incapable of dealing with climate change and will let the earth burn just so it can rule over the ashes. Kill those ideologies or kill the planet that is the choice every human faces today.	0	Tweet
1155400982747996160	@jenleahhh	2019-07-28 14:23:55	Many of us have also read agenda 21 and know exactly how and why global warming/climate change started	0	Tweet
1155397801452429312	@AnarchoWildCat	2019-07-28 14:11:16	You're are really going to cave to fascists? At a time we need to fight fascism? I was told you was someone who wasn't afraid to speak your mind Greta? Don't cave to lies, the right have been lying about and dismissing climate change for years too.	0	Tweet
1155396258347065344	@AlessandraD_C	2019-07-28 14:05:08	@ GretaThunberg please help us to prevent this Huge disaster # JovaBeachParty and # wwfitalia pretend to save the climate change with this event leading to kill the Nature. They Use hashtag # plasticFree but they sell tons of bottle of water HELP US # nojovabeachparty	1	Tweet
1155378597068247040	@CantMandi	2019-07-28 12:54:58	Attention # RemainAlliance We need climate change at the top of the agenda! Whatever happens with Brexit it will pass. Life will go on! Climate change threatens worse things! Remain parties should agree 4-5 step changes on climate. Don’t get distracted! # REMAINgreenalliance	0	Tweet
1155370562442731525	@Kristin60253509	2019-07-28 12:23:02	You are getting too famous so those you threaten want to put you down. Your message is clear. Wear any T shirt you like. Climate change actions will be costly for some businesses so they are bound to kick up. The facts are still there, unobscured. Keep going Greta. 👏👏👏👏👏👏👏	0	Tweet
1155366397201002496	@airstripone84	2019-07-28 12:06:29	But obviously you support the redistribution of wealth under the pretence of "climate change". pic.twitter.com/h9xsjVt4BK	1	Tweet
1155358228739448832	@CapoOrsoInPiedi	2019-07-28 11:34:01	We love your battle for climate change. Because we have always been # ecologist. We love you because we have always been # antifascists. Also necessary # feminist. Great ambition, # vegan. We need to stop the industrial and food production mode against nature, animals and humanity🤗pic.twitter.com/hSn8TE8fGT	1	Tweet
1155354202123767813	@yol1s1	2019-07-28 11:18:01	Actually we do need to listen ... for obvious reasons re. climate change ... but also because in the not too distant future you’ll be voting.	0	Tweet
1155344613571354624	@FridaysNepal	2019-07-28 10:39:55	@ GretaThunberg is only 16 and is already one of the most vocal climate change activists in the world. https://www.wbur.org/hereandnow/2019/07/26/greta-thunberg-climate-crisis …	0	Tweet
1155322126640926723	@sirjoltalot	2019-07-28 09:10:34	Sometimes I do feel that democracy, in its current forms, is not well suited to addressing the challenge of climate change, because addressing it will likely involve some short term hardship for some people. Curious if you have thought about this at all?	0	Tweet
1155299269097639936	@elyduhh_	2019-07-28 07:39:44	@ GretaThunberg is an icon, save the world, climate change is an issue, Antarctica slowly melts, thats all thank you	0	Tweet
1155295844964458496	@SamPasser1	2019-07-28 07:26:08	@ GretaThunberg I feel so helpless. No matter how hard we try to combat climate change, things seem to only get worse and worse. I feel like giving up hope. Is there any advice you have on how to keep on fighting in times of bleakness? Because I feel so weak and tired.	0	Tweet
1155271937482006529	@jamie95loake	2019-07-28 05:51:08	@ GretaThunberg Ben’s talking shit can you beat him up, he thinks climate change is bullshit	0	Tweet
1155257540923547650	@Now4NI	2019-07-28 04:53:56	Greta, apologies for the amount of stupid replies from Fisher Price crypto-fascists you're going to get. You did nothing wrong, fascism will need to be eliminated in order to overcome climate change.	0	Tweet
1155247655091445760	@Metalhead_2020	2019-07-28 04:14:39	You understand better than all climate change deniers.	0	Tweet
1155245241198268416	@clebeau	2019-07-28 04:05:03	Don't listen to the trolls, or waste your precious time on them. Just understand that they feel threatened by your powerful voice. You've done so much already to wake the world up to the critical nature of climate change. More power to you, and to the millions who are with you!	0	Tweet
1155226998542950401	@rocken1844	2019-07-28 02:52:34	Presumably the argument is that, if you're too naive to know of the link between your T-shirt and violence, then you're not wise enough to know about climate change.	0	Tweet
1155210729076772869	@Jharrison22	2019-07-28 01:47:55	You're such an inspiration that I have put together a climate change event in your name. 'What would Greta do?'. Stockton on tees. UK.	1	Tweet
1155209263117193218	@Jeromesh68	2019-07-28 01:42:05	The people that appreciate what you are doing respect you and understand. The people that deny climate change will try to bring you down at every opportunity. You're much more savvy than they ever will be. They won't change, so are best ignored.	0	Tweet
1155202188953751558	@ArtMarius2	2019-07-28 01:13:59	1/ Who attack you now, they will always do it, under any pretext. They are the same who claim that the climate change does not exist, but they are behind of the great interests That affect your actions. The unfounded criticisms It is a sign that you are moving forward.	1	Tweet
1155195348769562627	@ElliotJPOP	2019-07-28 00:46:48	E C O F A S C I S M Is pretty good Save us doggies from Pollution and Climate change pic.twitter.com/R3WvgIh7ny	0	Tweet
1155191618921738240	@luvsallwomen	2019-07-28 00:31:59	All these idiots out there trying to distract from your message about the Climate Change by making a big deal out of a T-shirt Really smart to remove their idiotic talking point and bring the focus back to making changes in our daily lives to reduce our effect on the environment	0	Tweet
1155188953760313349	@zettberlin	2019-07-28 00:21:23	Ignore these "some" its safe to ignore them. They are the same who deny anthropogenic climate change.	0	Tweet
1155188603770851330	@moe_180	2019-07-28 00:20:00	Im not denying climate change is happening, I am however questioning the use of children as a prop.	0	Tweet
1155188435512111108	@mrharrycason	2019-07-28 00:19:20	Climate Change Is a $26 Trillion Growth Opportunity, says business The lies you tell on behalf of big corporations , who are manipulating you to do their dirty work for them is only going to hurt and make family’s poor.	0	Tweet
1155186588382638086	@hcpizzi	2019-07-28 00:11:59	don’t apologise. the ones criticising the t-shirt are the ones that have turned climate change into a political issue, instead of a scientific one	0	Tweet
1155185551907201024	@sheisartmoney	2019-07-28 00:07:52	Greta, they will find an excuse to come at you any way they can, because you’re so formidable. You and to some extent @ AOC have nearly singlehandedly made climate change a regular topic in media & our homes. It’s an incredible power you wield & you needn’t defend yourself. ty <3	1	Tweet
1155184792901685254	@DaniBget	2019-07-28 00:04:51	Idk the weather’s been off lately. It’s been for a while, few years now but I mean it’s super hot one day then super cool the next with showers the whole day. If this ain’t climate change then what is? Yet deforestation is still ongoing.	0	Tweet
1155184480191156232	@MarvelAngel13	2019-07-28 00:03:37	I just did an interview with someone yesterday about climate change for my new film with @ RealGDT @ chrisrock and @ GwynethPaltrow from # AvengersEngame and the person being interviewed mentioned you # GretaThunberg	0	Tweet
1155183155600646145	@gilsafe	2019-07-27 23:58:21	People who complained about your t-shirt are from a far-right (climate change deniers) party in Spain,VOX. The motto "No pasaran" just means "They shall not pass" ,and was used by anti-fascists during Spanish Civil war. Do not let these people tell you what you can or cannot wear	2	Tweet
1155179405305688064	@DominicAPrice7	2019-07-27 23:43:27	@ GretaThunberg talks about the stark reality facing our home - planet earth - in facing the extreme pace of climate change: TED RADIO HOUR http://www.newstalk.com/shows/ted-radio-hour-234916?utm_source=twitter&utm_campaign=article&utm_medium=web … via @ newstalkfm	0	Tweet
1155154410080821248	@gazArty146	2019-07-27 22:04:07	Look at these morons taking advice from a child is she a climate change expert?	0	Tweet
1155153408946556929	@charles_hancock	2019-07-27 22:00:09	Remind me. How do you classify the climate change thugs? Those causing dangerous, expensive disruption solely out of naivity or worse.	2	Tweet
1155135828651364358	@andyblueskyz	2019-07-27 20:50:17	You are 16. You don't understand street lights let alone climate change.	0	Tweet
1155113266399592448	@jeminus	2019-07-27 19:20:38	Is it any wonder we have rapid climate change when the trees that provide oxygen to our polluted atmosphere are becoming extinct! Continuously Killing trees is like removing your oxygen mask when your having a severe asthma attack!	0	Tweet
1155099146635894784	@recyclablehuman	2019-07-27 18:24:31	is climate change denial a thing in Brazil as much as in the US? because bolsonaro promised he'd do this and everyone voted for him. I'm fucking scared	0	Tweet
1155097094325264385	@jessecohn	2019-07-27 18:16:22	Greta, I don't like violence either -- even when used for the noblest purposes, it brutalizes in ways that are hard to resist. But there are already fascists, across the globe, who are visiting violence on people fleeing regions bearing the brunt of climate change.	0	Tweet
1155089397966155776	@TheCleaner13	2019-07-27 17:45:47	Bzzzzz bzzzzzz bzzzzzz waffle bzzzzz bzzzzzz bollocks bzzzzz bzzzzz bzzzzz bzzzzzz bzzzzzz climate change crap bzzzzzzz bzzzzzz bzzzzz cry bzzzzzzz bzzz bzzzzz more waffle bzzzzzz bzzzzz need to be heard bzzzzz bzzzzz bzzzzz	0	Tweet
1155083898050744320	@2ndCitySaint85	2019-07-27 17:23:56	When you going to head to China and cry about Climate Change?	0	Tweet
1155083041984929792	@seal_1988	2019-07-27 17:20:32	sad the UN have resorted to using a special needs child as a pawn to guilt adults into climate change	0	Tweet
1155082178755289088	@Afayaiva	2019-07-27 17:17:06	Violence is "fighting against climate change" and having a breakfast with plastic everywhere and you didn't delete that post. You appeared on newspapers instead.	1	Tweet
1155068769728978944	@garyp1958	2019-07-27 16:23:49	This is the result of brain washing, someone is responsible for child abuse. Educating children that climate change is not nature doing what it as done since the beginning of time is desperately false. Governments funding for future tax revenue.	1	Tweet
1155066107943718913	@_LukeCSkywalker	2019-07-27 16:13:14	Every decade or so, they come up with a new "climate change point of no return" -- then it comes and goes, but Doomsday never materializes. Your generation hasn't seen them do this before. Give it a few years, and you'll see what I mean. It's a con. https://twitter.com/_LukeCSkywalker/status/1155049541244084224?s=20 …	7	Retweet
