Tweet id	Poster username	Tweet post Date	Tweet text	Number of retweets	Tweet type
1105413478477643781	@StephaneTretz	2019-03-12 15:51:25	This is our chance to show that we care about climate change and the future of our children. Whatever happens, go on strike on march 15th ! pic.twitter.com/hEJmm6IG6M	4	Tweet
1105404214564585473	@PaoloPanareo	2019-03-12 15:14:36	Hi everyone,i launched this petition on http://Change.org : Milano Cop26. I presented the candidacy of Milan to host the United Nations Climate Change Conference.	1	Tweet
1105368079834374144	@CircellaG	2019-03-12 12:51:01	We need people like you to raise awareness and fight climate change! We at @ ucdavis host the US National Center for Sustainable Transportation @ NCST_Research on Friday March 15 we'll host our new class of incoming students: I'll introduce them to your fight in the welcome seminar	0	Tweet
1105362216965025792	@DSSchmeller	2019-03-12 12:27:43	Not sure we were millions, but many 10th of thousands. The work of the # IPCC has been outstanding in that regard and also the new reports from # IPBES deal with the impact of climate change and the risks for humans.	0	Tweet
1105342588888858625	@natalie_vogl	2019-03-12 11:09:44	@ GretaThunberg you will come to Austria at the end of May and I want to invite you to our TV-Show Café Puls at PULS 4 for an interview. Do you want to talk with us about your passion about climate change? All the best, Natalie Vogl (my email: Natalie.vogl@puls4.com)	0	Tweet
1105298662173888512	@CrimsonBoomer	2019-03-12 08:15:11	Since an American politician believes we only have 12 years to live with climate change why go back to school? You know that India and China will never change from coal or other carbon based fuels.....So why not live life while you have a chance and skip school?	0	Tweet
1105264322488532992	@senseabilityUK	2019-03-12 05:58:43	Who says Asperger’s is a disability? This article really hones in on those qualities that have made you the most effective individual global climate change activist in the world. You’ve convinced me.	0	Tweet
1105259195237052416	@Goffinet10	2019-03-12 05:38:21	We adults must support Greta. It is our only chance to save the planet from Climate Change. Otherwise we are finished. I would love to know a Greta for plastic pollution. It might be the only way that we can turn off the tap!!	0	Tweet
1105244327192670208	@NoneSoVile	2019-03-12 04:39:16	She is right, Corporations and their lacky Governments will not change attitudes towards climate change, we will. We will bring it about, you don't need pin striped suits and banksters for a better world.	0	Tweet
1105232810271535104	@BarryJWoods	2019-03-12 03:53:30	@ GretaThunberg Talk to the EU!! For an EU obsessed by climate change and its possible effects, more embarrassing is the report’s admission that “10,200 tonnes of CO2 per/yr would be saved if Strasbourg were no longer used as a place of work” = to 12,000 cars driving around world.	0	Tweet
1105218498073120768	@Aaisha_Opel	2019-03-12 02:56:38	@ GretaThunberg Perspectives of a 6 year old who thinks you are fab ‘Ppl should stop saying ‘stop climate change’(pretending to brandish placard) and DO. Buy electric cars, have more stands for them, decrease petrol pumps and buy solar panels.’	0	Tweet
1105216772913938444	@BOSFonline	2019-03-12 02:49:47	@ GretaThunberg, schoolgirl climate change warrior: "Some people can let things go. I can’t" An inspiration to both the younger and older generations of this planet! https://twitter.com/MeadowInGarden/status/1105089614698725376 …	0	Retweet
1105207021870170112	@HansEri99334181	2019-03-12 02:11:02	I guess that about 75% of youngsters 16 or younger are on Gretas side here. So all of you adult people who are question the climate change, belive me. Our (we old people) power is going to end, this is an avalanche you can’t stop. Ha ha too bad.	0	Tweet
1105193772982231041	@2dayswork	2019-03-12 01:18:23	@ GretaThunberg, the activist who at the age of 16 surprised the world, tells us why we must act against climate change. https://twitter.com/TEDenEspanol/status/1105183862563459073 …	0	Retweet
1105186928146538496	@shep135	2019-03-12 00:51:11	I agree. Australia has been in denial about Climate Change for over 10 years. Afraid of implications to lifestyle & enployment. Next Federal election is about 3 months away "Climate" will be a major issue. The party promoting it as a hoax will be decimated. # climate # Auspol	1	Tweet
1105165727185682432	@RamoneJonah	2019-03-11 23:26:57	Climate Change is not a "thing." It redefines all other things. We can't let it go like a breakup or car accident. I am glad you are saying thi, but sad it has to be said.	0	Tweet
1105159217818808320	@robwreeves	2019-03-11 23:01:05	@ GretaThunberg schoolgirl climate change warrior: ‘Some people can let things go. I can’t’ # ClimateChange # ClimateStrikehttps://www.theguardian.com/world/2019/mar/11/greta-thunberg-schoolgirl-climate-change-warrior-some-people-can-let-things-go-i-cant?CMP=Share_iOSApp_Other …	0	Tweet
1105133225138143232	@CestPasDuVent	2019-03-11 21:17:47	A lot of young people in Western countries and that's great ! A little less in Asia and South America but hardly anyone in Africa.... How to mobilize people from the continent in the world that may be hit hardest by climate change ?	1	Tweet
1105117207820988416	@nunoptorres	2019-03-11 20:14:09	@ GretaThunberg is truly inspiring. Hope means immediate action. We need a revolution (structural changes not band-aids) in the way we live today and how we organize our societies. Time is of essence if we really want to do something about climate change. Clock is ticking... https://twitter.com/GretaThunberg/status/1104389322407665664 …	0	Retweet
1105047461242916864	@Phoeba_Tron	2019-03-11 15:37:00	@ GretaThunberg, Superhero schoolgirl climate change warrior: ‘Some people can let things go. I can’t’ https://www.theguardian.com/world/2019/mar/11/greta-thunberg-schoolgirl-climate-change-warrior-some-people-can-let-things-go-i-cant?CMP=Share_AndroidApp_Copy_to_clipboard …	0	Tweet
1105029940993540096	@JeromeOLLIER	2019-03-11 14:27:23	@ GretaThunberg, schoolgirl climate change warrior: 'Some people can let things go. I can't' - @ guardianeco https://ift.tt/2CcDAWa	0	Tweet
1105012312778440705	@Faisal_al_hadad	2019-03-11 13:17:20	# StopLondonUnderWaterBy2035 distracting the youth with climate change prevention better for those in charge Instead of the youth demanding $€£ 4 preparation for climate changes. Let them waste their time trying to stop it That way it will be too late to do anything.	0	Tweet
1105002657289101313	@Hufox513	2019-03-11 12:38:58	Strategically, MAR (Mitigation, Adaptation & Reversal) are all needed to fight the climate change. We hear lots of M but not too much about A & R. For example, We need to build many dams to replace the water from the disappearing glaciers. My Fintech projects can provide funding.	0	Tweet
1104997356179779584	@thepaulbernard	2019-03-11 12:17:54	@ GretaThunberg You need to research, then campaign for population control, the planet's population growth must be stemmed if climate change can ever successfully be addressed. More people = more carbon footprints to exacerbate the problem # population @ PopMatters	0	Tweet
1104876959400636416	@susanamuhamad	2019-03-11 04:19:29	@ GretaThunberg Hi Greta! thanks for your work and opening space for the children of the world to fight for their future. We have been blocked by dinosour politicians in Bogotá, that don´t think Climate Change is an issue. We will fight them in the next election.	2	Tweet
1104862945232723968	@watters_nrgsuk	2019-03-11 03:23:48	World already has the answer to climate change...a technology invented in 1947....but we need the will as we have the way....but the industry that could make the difference place profit before anything else so we are doomed without it.....who going to put head above the parapet?	0	Tweet
1104822629549199360	@KyokanOtoko	2019-03-11 00:43:36	@ GretaThunberg Because of her, I still have hope for the future of mankind. I'm sure we can work all together in order to build a better society. And when I see people like her or everyone else who strike against climate change, I know that we can work this out. https://twitter.com/jonnoxrevanche/status/1104203551314591745 …	0	Retweet
1104755634254372864	@lfigueras	2019-03-10 20:17:23	Got some students who would join not to come to Friday classes to skip them but saying they support that climate change strike.... what should I tell them from you Greta? Thanks.	0	Tweet
1104748552549351429	@AnneODo66576398	2019-03-10 19:49:14	Thank you for your passion and dedication to fighting climate change !	0	Tweet
1104746168456761344	@rover223	2019-03-10 19:39:46	@ GretaThunberg @ postcarbon With equal parts humor and in-depth analysis, Asher, Rob, and Jason safeguard their sanity while probing crazy-making topics like climate change, overshoot, runaway capitalism, and why we’re all deluding ourselves. https://www.postcarbon.org/crazytown/	0	Tweet
1104739626957393921	@muntzer_thomas	2019-03-10 19:13:46	Climate change depends (maybe) only marginally on human CO2 emission.	0	Tweet
1104704754645721088	@starkdangerous	2019-03-10 16:55:12	@ GretaThunberg Hey Greta!! Our artist Charlie Stark has made a dance track with your UN Climate Change speech. Would you like to hear it? We don't just want to publicise it without your approval.	0	Tweet
1104648240052477952	@RedPill007	2019-03-10 13:10:38	@ GretaThunberg what do you know about geo-engineering being the cause of climate change? Max Bliss and Terry Lawton on Facebook and YouTube is a good place to start your research.	0	Tweet
1104514529722073089	@Grenhartgamer	2019-03-10 04:19:19	8 years old, really, when you first heard of climate change and you were so intelligent and worldly you were able make a choice? Able to read and interpret all the scientific papers on it?	0	Tweet
1104508703741542401	@MaxGoldrush	2019-03-10 03:56:10	Your Ted talk was so truthful and so well presented, I thought it was very moving. I also hope people don't only feel in awe of how great you are, but that they actually listen and do something to combat climate change, whoever they are.	0	Tweet
1104493921122476032	@greenkeizai	2019-03-10 02:57:25	true strike! demand sustainable economic activity & principle! climate change is result of economic activity until now! sdg's is not sustainable economy! this is core!	0	Tweet
1104487435474362368	@jlheelan	2019-03-10 02:31:39	Just watched your 2018 UN speech on climate change, Greta. Absolutely perfect. Wiser words have yet to be uttered by so-called adults. So proud of you and your mission. Stay strong and know you have an ally in me. 💜💙💚	0	Tweet
1104473943539412993	@jamesbhan	2019-03-10 01:38:02	@ GretaThunberg has already started an awakening in Europe, Asia, Africa and sparking a fire in the USA. Climate change and environment needs to be the priority. https://twitter.com/GretaThunberg/status/1104389322407665664 …	0	Retweet
1104471271700602880	@Carlitosmeola1	2019-03-10 01:27:25	Climate change is now http://www.bamboogreenlife.it	0	Tweet
1104459973826736128	@h2opower_	2019-03-10 00:42:32	I am doing what I can to address the issues of climate change but I do need the help and support of the people. This technology has the power to totally reverse the damage done by fossil fuels to our air: https://www.gofundme.com/energytothepeople …	0	Tweet
1104459751130320896	@carlitosmeola	2019-03-10 00:41:39	Climate change is now http://www.bamboogreenlife.it	0	Tweet
1104331999156862977	@DOckerby1	2019-03-09 16:14:00	Greta, What an amazing honour, how old are you, 15, this award is testament to your active campaigning for climate change and other ecological issues, you will go far in your life, no doubt in a political arena, well done, and the best of luck.	0	Tweet
1104281855535300610	@inspoweredby	2019-03-09 12:54:45	yep, a great example for why we need to think x-sectorial and holisitc when tackling climate change and other global challenges as part of the larger SDG roadmap... women are a central part of the solutions!	0	Tweet
1104275008749256704	@SatyriconPics	2019-03-09 12:27:33	Climate change is not your fault. Is not your fault. No. Listen to me. Is not your fault.	0	Tweet
1104261923556646913	@DebWinkleblack	2019-03-09 11:35:33	We’re honored you have been instrumental in energizing climate change awareness 🙏🏼	0	Tweet
1104204855927746561	@costasmaniatis1	2019-03-09 07:48:47	Well done Greta . keep up the fight in helping raise awareness globally. We fully understand and support todays children climate change movement. what is currently a global crisis Best wishes from Costas and Andrea. Australia . Melbourne.	0	Tweet
1104174966386307073	@dan_psyd	2019-03-09 05:50:01	I’m a clinical psychologist interested in helping people become more involved in climate change activism. Here is my article about 1) how to become an activist, & 2) if you are already active, how to increase your impact. https://medium.com/@danrubinpsyd/everyone-an-activist-25f68fe6d448 …	0	Tweet
1104139467294683136	@Jonathan_Cloke	2019-03-09 03:28:57	Not being rude and 100% in support of your views, but they do this to pretend they care and to avoid having to do anything meaningful about climate change..	0	Tweet
1104138962979950593	@d63228428	2019-03-09 03:26:57	We must stop the global abusive lie to the children. It’s not climate change, it’s communist implementation. Together we can hand in hand stop the global spread of communism starting with the transclimate fake changers. We can make a difference. Stop communists globalists. Resist	0	Tweet
1104109842514526208	@RainerLoveiam	2019-03-09 01:31:14	Sorry. But I cannot buy the end of climate change with this bribe.	0	Tweet
1104109380637769734	@DOckerby1	2019-03-09 01:29:24	(3) and Bella Lack, two people who not only champion their specific concerns, but actively campaign for awareness and support, Greta concentrates on Climate Change, and Bella campaigns for conservation and the protection of animals, I am thankful that in a number of years....	0	Tweet
1104102926086221824	@DOckerby1	2019-03-09 01:03:45	Greta, I have followed Bella for a while, but I am also aware of your fabulous campaigns for Climate change, and other ecological issues, both you young ladies are a credit to your generation, and it fills me with hope for the future of this wonderful planet with people like you.	1	Tweet
1104086121120784384	@HenriR_JJ	2019-03-08 23:56:58	Wonderful! No hate, no nothing, just the appreciation you deserve for your courage and assertiveness to stop the climate change. Congratulations 🎉😊	0	Tweet
1104083601304494081	@SheviDraws	2019-03-08 23:46:58	I wouldn't recommend giving a mixed message. People are already making climate change a political color, and tying it to sides and politicians. It's hard enough to win people over, especially if you promote their idea that saving our future is a liberalistic view, not existential	0	Tweet
1104048546142138368	@finlikeashark	2019-03-08 21:27:40	@ GretaThunberg I'm striking in front of the capitol today and a woman stopped to have a short conversation with me. She talked about how you changed her perspective on climate change. Then, before walking away, she said "You and Greta are changing the world". Love from Denver 💞	0	Tweet
1103994381747609600	@TPRUDD	2019-03-08 17:52:26	@ GretaThunberg You may be interested in this free resource (poster) to challenge and support teachers and schools who want to promote learning about the environment and climate change. I hope you find it useful. Please share via social media if so. http://www.pupilpledge.org	0	Tweet
1103963383290839040	@Dashni_Morad	2019-03-08 15:49:15	Climate change is real and feminists have to join efforts to push corporations and governments to act on it. # IWD19 should also be about highlighting the necessity of saving our planet.... Read my article here... http://www.kurdistan24.net/en/opinion/ca299b75-f52b-4827-a1c6-cb082d9374bb … @ GretaThunberg @ K24English	4	Tweet
1103951323731496961	@inquisitioneu	2019-03-08 15:01:20	I have two sons and they are worried about climate change and are going to protest. They also don't want to go to a boys only school. They have seen your example and are inspired.	1	Tweet
1103944733309788162	@DavidWJacobs2	2019-03-08 14:35:09	Greta Thunberg is a miracle worker for climate change awareness! Thanks Greta! Greta Thunberg är en mirakelarbetare för medvetenhet om klimatförändring! Tack Greta!	1	Tweet
1103936788098297856	@hartwig_kupfer	2019-03-08 14:03:35	It's too late for stopping climate-change! Ghosts have been awoken by humen! You can't stop them yet! But you awake the governments and this is good thanks Greta! Hartwig	0	Tweet
1103929771161870337	@the_ecofeminist	2019-03-08 13:35:42	Today on my 15th # Fridays4Future i want to celebrate women all over the world that are inspiring us and taking bold steps against climate change. # climateStrike # March8th	9	Tweet
1103914785886822401	@sjcarjo1	2019-03-08 12:36:09	I'm in my 40s. Always been worried about climate change but you have changed my worry into action. Thank you and bless you.	1	Tweet
1103909676054327296	@onequeeralien	2019-03-08 12:15:51	Thank you for standing up on these matters as well, we need to fight climate change but we also have to make sure to support each other while fighting!	3	Tweet
1103908510520139776	@BeingElenaLA	2019-03-08 12:11:13	As a scientist and a woman I applaud you, @ GretaThunberg Thank you for inspiring many and thank you for your strength and courage on combating climate change. # InternationalWomansDay # womeninSTEM	15	Tweet
1103885382033104896	@WHO761	2019-03-08 10:39:18	@ GretaThunberg the equator is the first to be hit with climate change. https://twitter.com/NakabuyeHildaF/status/1103669816341204993 …	0	Retweet
1103844088682442752	@loneseawolf	2019-03-08 07:55:13	@ GretaThunberg I'm from New Zealand,I designed a vertical wind turbine,I'm Maori,I based my design on a old Maori carving,I call it Uenuku, no one wants to help me refine,develop my idea,project. No one care's about climate change,here in N. Z. email: josephshaw@hotmail.co.nz pic.twitter.com/sV57N72Dds	0	Tweet
1103791914518757376	@standup_the	2019-03-08 04:27:54	Wow. This is why a child shouldnt lead this kind of movement. It sounds as easy as you say but the world is far to more complex than that. Indusrys actully making money on climate change. They have more power than you can imagine. Thats why I keep refering to this as a saga.	0	Tweet
1103774222952906753	@yota_berlin	2019-03-08 03:17:36	Man-made climate change is not scientific – it is a political scheme designed to transfer the wealth of industrialized nations, to non-industrialized nations. https://drrichswier.com/2019/02/22/the-riddle-of-climate-change/ …	3	Tweet
1103755136688640001	@nandoodles	2019-03-08 02:01:46	Great profile! You’re right - everytime they write about your they have to talk about climate change too. 👏🏼	1	Tweet
1103744159985197056	@dan_psyd	2019-03-08 01:18:08	I'm a psychologist concerned that many people don't know how to talk about climate change, so I wrote something about how to have a useful conversation about climate change. Here it is if anyone's interested https://medium.com/@danrubinpsyd/how-to-have-a-useful-conversation-about-climate-change-in-11-steps-d4bbd4135e35 …	3	Tweet
1103742018063400961	@mk19942	2019-03-08 01:09:38	I TOTALLY AGREE WITH YOU, GRETA! :) The climate change IS 100% a black&white-issue. I am sure that we need a green democratic socialistic world, at least a social-liberal partly socialistic that most people can accept! The ecology and social equity MUST go before the economy!	8	Tweet
1103706399677341696	@richard35609781	2019-03-07 22:48:06	@ GretaThunberg @ ProjectDrawdown @ DrKWilkinson Women hold the key to curbing climate change # hope7cc https://www-m.cnn.com/2019/03/07/opinions/international-womens-day-climate-change-wilkinson/index.html …	0	Tweet
1103623114787717122	@Shantan60786029	2019-03-07 17:17:09	Workshop on "Youth Action for Climate Change" # ClimateStrike Organized by @CarfreeCitiesAllianceBangladesh & @ InstOfWellbeing . Date: 2/03/2019pic.twitter.com/iXDJQGmShM	0	Tweet
1103597230131421184	@CoDesRes	2019-03-07 15:34:18	@ GretaThunberg is a Swedish political activist working to stop global warming & climate change. In August 2018, she initiated the first school strike for climate outside the Swedish parliament building # InternationalWomensDay # bethechangeyouwanttosee # sdg13 # climateactionpic.twitter.com/zAHuOJKltw	1	Tweet
1103552026963857408	@rationalgroup	2019-03-07 12:34:40	Unfortunately, knowing will not be enough. That is because acting on climate change, pollution, fossil deposit depletion, is an exercise in inter generational equity, and until we have universal equity among the living, people will have other priorities and concerns about change	0	Tweet
1103439380226678784	@Gnataswa	2019-03-07 05:07:03	@ GretaThunberg When we talked about climate change at university we focused so much on adaptation. Why did they not show us this data? I knew it was an important issue but didn't know until recently the trend was so clear and predictable!!!!! https://twitter.com/GretaThunberg/status/1103193739546320896 …	0	Retweet
1103428022428938242	@sarahpiano	2019-03-07 04:21:55	@ GretaThunberg Please can I have your permission to use your words (fully referenced) to end my piano recital about climate change? Your words are powerful, inspiring & easy to understand & you sum up what I want to say. I can send the track (have sent to your media email).Thanks	0	Tweet
1103363793701068800	@dan_psyd	2019-03-07 00:06:42	I'm a psychologist concerned that many people don't know how to talk about climate change, so I wrote something about how to have a useful conversation about climate change. Here it is if anyone's interested https://medium.com/@danrubinpsyd/how-to-have-a-useful-conversation-about-climate-change-in-11-steps-d4bbd4135e35 …	0	Tweet
1103342255539187713	@khights02	2019-03-06 22:41:07	@ GretaThunberg 13s and you will be the most important person delivering a climate change solution on this earth. this is a non carbon machine, before it uses the hydrogen it will make cheaply for many of the worlds poorest people. we must change humanity as well as civilization	0	Tweet
1103332913423224832	@yourFELA	2019-03-06 22:04:00	.. because if they knew they would.. act. Teach adults how exactly to act about climate change.	0	Tweet
1103316775435948032	@Dewey23z	2019-03-06 20:59:52	Politicians who pay lip service to the problem of climate breakdown but who do not make it the priority, are de facto climate change DENIERS, because IF they really accepted the reality of it, they would HAVE to make it the priority.	0	Tweet
1103312849449992192	@MarkHen070393	2019-03-06 20:44:16	Gotta look at animal agriculture as another contributor to climate change as well as other environmental consequences.	0	Tweet
1103276988876222464	@fahidhuss	2019-03-06 18:21:46	There are people who believe it's only a natural cycle so there is nothing you can do about it. there are people who believe climate change is a scam/fake news/conspiracy.	0	Tweet
1103268049837281280	@13Americans	2019-03-06 17:46:15	To be honest, I’m concerned about climate change but don’t know what this means.	0	Tweet
1103205235798040576	@RamoneJonah	2019-03-06 13:36:39	Sadly, for many Americans, knowledge isn't enough. They need to know and feel and have it hit their house. Our news will broadcast the unprecedented winter California wildfires and climate change deniers in the same show. Americans lack the capacity for empathic knowledge.	0	Tweet
1103203911740010496	@DevaRaja2018	2019-03-06 13:31:23	Mass ignorance has been the reason for this general apathy to Climate change.People all over world are feeling the rising heat and complaining but think it is all http://NATURAL.Prime task for climate strikers is to MAKE PEOPLE AWARE.	0	Tweet
1103194640788930561	@AntiForGood	2019-03-06 12:54:33	People don‘t want to know about climate change, because otherwise they would have to act...	1	Tweet
1103186450164731904	@khights02	2019-03-06 12:22:00	13s If we had non carbon machines like this Climate Change would not h 13s Non carbon machines like this would stop Climate Change pic.twitter.com/A38FTqjQyd	0	Tweet
1103058709264195584	@EmmaAspinall	2019-03-06 03:54:24	My 13 year old daughter sketched this using that photo as inspiration. She is doing a school project on climate change and last year did a project on plastic pollution. Thanks for inspiring her. pic.twitter.com/p1Jsq8Q7t5	6	Tweet
1103058595946602497	@FraserMacLeod5	2019-03-06 03:53:57	The Gov of Washington State is the first presidential candidate to make battling climate change the top priority in his political platform. https://mobile.twitter.com/JayInslee/status/1103041017475817472 …	1	Retweet
1103043073473503232	@antonio_oro_mur	2019-03-06 02:52:16	You are an excelent person. And I think all people around the world must to make aware your ideas at climate change.	0	Tweet
1103019799804731392	@samanth_lanka	2019-03-06 01:19:48	As I mentioned earlier, Can I interview you regarding climate change?	0	Tweet
1103018312504496129	@RickMcmanus	2019-03-06 01:13:53	@ GretaThunberg @ AlexandriaV2005 I have a book on Amazon - Empty Earth by Rick McManus. It is a fictional look at our future world devastated by climate change. It might help you in your efforts by illustrating what could be the fate of us all if we don't change soon@RickMcmanus	0	Tweet
