Tweet id	Poster username	Tweet post Date	Tweet text	Number of retweets	Tweet type
1112142202644455425	@0776430Clare	2019-03-31 05:28:58	Is there an icon to show our united force? A local protest environmental group wants to attend local council meetings wearing green.If we all had the same global badge it would have more impact.Too many people in UK have no interest in saving Nature- climate change worries more?	0	Tweet
1112090848064401409	@SusanneGill	2019-03-31 02:04:54	@ GretaThunberg Why is being vegan useful in stopping climate Change?	0	Tweet
1112082513403539462	@carlitosmeola	2019-03-31 01:31:47	Climate change is now http://www.bamboogreenlife.it	0	Tweet
1112077525973262336	@UmeshPansari1	2019-03-31 01:11:58	Respected dear, I am Umesh from India, a Young Leader. I want to know your views. How can we a stop the Climate Change? Just tell me one and possible way. Do you think SDGs are good working?	0	Tweet
1112048885034377216	@reospartners	2019-03-30 23:18:09	@ GretaThunberg via @ TEDTalks on the case to act right now on climate change http://bit.ly/2XN1VuW pic.twitter.com/uZKyJJnszQ	0	Tweet
1112022078918582272	@Mionder	2019-03-30 21:31:38	@ GretaThunberg and the # fridaysforfuture protests have my support! Lowering climate change is a top priority!	0	Tweet
1111983029361217538	@ACambiz	2019-03-30 18:56:28	As you are well aware, fighting climate change is also fighting for economic justice. This economy, we live under is a cancer that is destroying our planet! Keep fighting the good fight! Thanks 🙏	0	Tweet
1111955438562611200	@carlitosmeola	2019-03-30 17:06:50	Climate change is now http://www.bamboogreenlife.it	0	Tweet
1111766260566642690	@mcbugin	2019-03-30 04:35:06	would change more quickly if every day instead of watching "News, weather and sports" we had "our planet, climate change,and species extinctions" Would we then understand that our house really is on fire ?	0	Tweet
1111746719350513664	@ThomasPaine5	2019-03-30 03:17:27	The 'Climate Change' fearmongering is a Hoax! It is Watermelon policy -- green on the outside and red on the inside. https://youtu.be/J2u_TIWPupw	0	Tweet
1111743379061305344	@maverick4pa	2019-03-30 03:04:11	Way 2 Go Greta+Students+Friends 💚 Solve the Cancer Mystery--Cancer+Fungal Tumors can look identical! AB abuse+PESTICIDES+SUGAR+ALCOHOL+MOLD (house-grains) = CANCER+CHRONIC DISEASE! There's over 100 Autoimmune Diseases Going Organic is the 💚 of fighting Climate Change.	0	Tweet
1111733797215703040	@MalcolmMacKinn2	2019-03-30 02:26:06	You are a goon and a buffoon, getting carried away with your own self importance and inflated ego, neither you or other children are knowledgeable or experts on climate change, even scientists do not fully understand the complexities and complications involved.	0	Tweet
1111731311654391811	@ChrisHorns	2019-03-30 02:16:14	Climate change awareness is OK but you girl are annoying as hell	0	Tweet
1111730702654021633	@SeverinKlarname	2019-03-30 02:13:49	One day you will die anyway - like all of us. The sun causing the climate change doesn't care about you.	0	Tweet
1111705126467788801	@RicardoTrapero	2019-03-30 00:32:11	Don't forget the relation between wars and climate change.	0	Tweet
1111701197533138944	@VihrenMitev	2019-03-30 00:16:34	@ GretaThunberg # Climate # change # future # friday # strike # youth # Madrid # climatestrike # klimatstrejk # FridaysForFuture # bravegreeneupic.twitter.com/rLeevy5uWS	0	Tweet
1111684894810210304	@NishiMaheshwar1	2019-03-29 23:11:47	I bet if someone asks them what’s climate change they won’t be able to tell. They just want to run away from studying 📖	2	Tweet
1111653730464817153	@Karla54251197	2019-03-29 21:07:57	Climate change is not about elitism it's about our life's ! It's a reality and I thank you for your support and dedication. Creating awareness is a powerful tool.	0	Tweet
1111653162321104896	@ImaPatriot3	2019-03-29 21:05:42	Still trying to call attention to the real “elephant in the sky”. Please investigate!! The largest contributors of “Climate Change” are Climate Engineering Programs. Go to http://Geoengineeringwatch.org for the truth and credible data/sources. Look up and speak up!!!	0	Tweet
1111432944088825857	@JessicaJ_345	2019-03-29 06:30:37	@ GretaThunberg thank you for raising the alarm and speaking truth to power. We must treat climate change like the crisis it is and work together to make our communities more resilient and sustainable. https://www.youtube.com/watch?v=zrF1THd4bUM …	0	Tweet
1111342546746130432	@newtonharrison8	2019-03-29 00:31:25	@ GretaThunberg is courageously leading a new youth movement to combat the apathy of global governments around climate change and the 6th extinction. What follows is my response to her: https://www.youtube.com/watch?v=N06P-_XCWoQ … # ClimateStrike # FridaysForFurture # ClimateActionNowpic.twitter.com/JLJjrqZ5Le	1	Tweet
1111332845048483840	@IMobilitat	2019-03-28 23:52:52	Of course you are right. We are taking prehistoric measurements, which do not correspond to reality, climate change and added to that all the pain and destruction that our way of life causes. Stop. Thank you for the voice.	0	Tweet
1111078663762731008	@debaptiste_john	2019-03-28 07:02:50	https://youtu.be/Tkr13WoVHws @ TRNshow on @ AOC s response to the GOP. https://youtu.be/3ESLfxUiNRQ The new world war is our climate crisis, with Robert Green Vid by @ TRNshow . https://youtu.be/x_IAKNtgvxw GOP mayor in Texas uses facts on logic when talking climate change Vid by @ TRNshow .	0	Tweet
1111050437954666496	@susanelove7	2019-03-28 05:10:41	@ GretaThunberg how about a register of how elected officials are voting on climate change for young people who will be voting soon? it might make them think further than their own pocketbooks.	0	Tweet
1111027906208243713	@Carbotopia	2019-03-28 03:41:09	. @ GretaThunberg Climate Change is a matter of how we deal with Carbon, irrespevtive where it's from, as Climate can't differentiate that! pic.twitter.com/HexamlnPds	0	Tweet
1110860168781139968	@WesleyGripes	2019-03-27 16:34:37	Greta - C02 emissions do not change the climate. Please do some more research and engage some common sense. C02 has never been a driver of climate change. It's all a big hoax to redistribute wealth.	0	Tweet
1110816458702053376	@roseandblue	2019-03-27 13:40:56	this is the attitude of strong powers towards climate change. But each of us has the strength to break this wall of ice, through our daily choices and by combining our energies we can the impossible, always remembering that everything is connected. pic.twitter.com/hLIOaJCG4F	0	Tweet
1110763314068492288	@barrister_mehdi	2019-03-27 10:09:45	You guys are worry about climate change while the stupid world leaders are fueling a global crisis of hate occupation forced conversion war threats serving their selfish agendas sled centered war mongers who aren't capable to love and peace. If their is 1 WMD mistake adios earth.	0	Tweet
1110719892695773184	@MomRovin	2019-03-27 07:17:13	@ GretaThunberg @ EmmaWatson @ jk_rowling @ ArianaGrande @IMKristenBell @ JustinTrudeau @ halsey @ EmmanuelMacron @ chrissyteigen @ OfficialJLD @ giseleofficial the @ gop’s solution to climate change- have babies. No, I’m not kidding. God help us. https://twitter.com/SenMikeLee/status/1110588300614610945 …	0	Retweet
1110707460447395840	@QuantumGlamping	2019-03-27 06:27:49	The most dangerous misconception is that we have to do anything other than adapt to climate change and sea level rises as and when they happen.	0	Tweet
1110697932909613056	@CjMurph97437699	2019-03-27 05:49:57	The most threatening thing to are climate(existence) is the chemtrails that are being purposely sprayed to control the weather and mess with the growth of natural foods. The use of the farce of climate change which is natural, is to sell you products.	0	Tweet
1110695554818994176	@sphcatt	2019-03-27 05:40:30	💘💘thank you so much for caring and raising awareness around climate change	0	Tweet
1110675097411477505	@edgarknows	2019-03-27 04:19:13	The levels of pollution we have right now are unacceptable. Air, land, & water are the most toxic in human history. Even if climate change doesn’t happen, to leave earth in worse condition then we found is a crime especially when he solutions do exist.	0	Tweet
1110666470223159296	@VihrenMitev	2019-03-27 03:44:56	Did you know that there is also the Create A New Nobel Prize For The Fight Against Climate Change Petition? Lets support also this action! https://www.change.org/p/petition-for-the-creation-of-a-new-nobel-prize-for-the-fight-against-climate-change …	0	Tweet
1110630144878788608	@vrijspreker	2019-03-27 01:20:35	The so called climate change is the biggest scam and most expensive hoax ever. Designed to keep the taxsheep frightened. Luckily thanks to President Trump, populist partys and awakened part of the population this fear- and moneymaking scheme will end soon.	0	Tweet
1110611411825233920	@TheAutenticOz	2019-03-27 00:06:09	@ GretaThunberg I have more amount of evidence on climate change, but this is not the time to say it. I'm working on it. There's much more than what is being said. All of the planets in the system are changing according to these same climate changes.	0	Tweet
1110573734354653184	@MangaForFuture	2019-03-26 21:36:26	Amazing information... and no one is talking about that. They don't have the right to destroy the planet. You will be in germany on Friday. Can I offer you a copy of my book on climate change?	0	Tweet
1110558606825533441	@sreyapatri	2019-03-26 20:36:19	@ GretaThunberg You are such an inspirational person! Do you have any advice for someone who wants help take climate change action even though there aren't very many opportunities/events happening about it where they live? Thanks!	0	Tweet
1110540495179182080	@deemillerdenver	2019-03-26 19:24:21	I sat in the dunes on Dollymount beach in # Dublin yesterday and wondered would how many more years this would be possible before # climate-change d it forever. pic.twitter.com/dolg0gW85q	0	Tweet
1110534355204608006	@Totalrecoverys1	2019-03-26 18:59:57	Hey Greta I'm thinking about starting a rant YouTube channel about climate change.	0	Tweet
1110469349746315264	@SaschaParchmann	2019-03-26 14:41:39	Climate change is just an invention of darkness! The truth comes to light! World in change - 21.12.2021! 😊	0	Tweet
1110467357493903361	@Garama3CLtd	2019-03-26 14:33:44	@ GretaThunberg again demonstrates that she understands the science better than many non-clinate scientists working professionally on climate change. https://twitter.com/GretaThunberg/status/1110441025305227264 …	0	Retweet
1110455588188643328	@puffypuff4	2019-03-26 13:46:58	hope new technology will bring good news. before that we still need climate change mitigation	0	Tweet
1110450051933974528	@SteB777	2019-03-26 13:24:58	Thank you for saying it straight. I have been fed up with those supposedly advocating for action on climate change, watering down what they say, so they don't upset governments pandering to fossil fuel interests.	1	Tweet
1110444507785420802	@iceagereentry	2019-03-26 13:02:56	We must act with urgency to mitigate natural climate change risks during this grand solar minimum & move to living sustainably. Global temps are in decline, IPCC 4casts are inaccurate. You are being used to manipulate the world. Please read this FREEBOOK https://www.amazon.com/dp/B07JZL4QWM	0	Tweet
1110440289028792320	@_InThisTogether	2019-03-26 12:46:10	Greta you need to know a couple of things. 1. The IPCC is a political organisation. 2. The 97% consensus is a myth. 3. The IPCC was started by oil tycoon Maurice Strong who tightly defined it's remit so it can only look at AGW. 4. The Sun could be involved in climate change.	1	Tweet
1110255626511372293	@AlanLee1701	2019-03-26 00:32:23	World War 2, National EMERGENCY. Companies RETOOLED from cars to make TANKS. CLIMATE CHANGE - PLANETARY Emergency. Oil Companies can Retool to SOLAR PANELS, WIND TURBINES, WAVE MACHINES, NUCLEAR, GEOTHERMAL Alan Lee. Honest, REAL, and poor guy4president https://www.crowdpac.com/campaigns/388954/alan-lee …	0	Tweet
1110240463234068480	@wmnsmarchla	2019-03-25 23:32:08	@ GretaThunberg - You're making a big splash - as we needed to get soaked. "Skipping School Around The World To Push For Action On Climate Change https://n.pr/2CibfOs	0	Tweet
1110068633827528704	@josesvieira	2019-03-25 12:09:21	@ GretaThunberg deserves recognition for her grand stand on climate change by our lifestyle options. The disarming case to act right now on climate change (Greta Thunberg | TEDxStockholm) https://www.ted.com/talks/greta_thunberg_the_disarming_case_to_act_right_now_on_climate?utm_source=twitter.com&utm_medium=social&utm_campaign=tedspread … via @ TEDTalks	0	Tweet
1110021081660837888	@Penalosa_G	2019-03-25 09:00:23	Greta, you are smart and bold and have generated much awareness around Climate Change. Millions of people of all ages agree with you. This video that you posted is # ageist and dumb. You are better than that. Construct do not destruct; be different, urgent positive change.	1	Tweet
1109990236350763010	@manuelcch77	2019-03-25 06:57:49	You can't blame older generations for climate change. Is like future generations blame yours for disconnecting humanity from real life. It is not the regular people to blame.	0	Tweet
1109917887978967041	@climate_all	2019-03-25 02:10:20	If you do so against the planet earth kicking on it, then you understand that climate change is happening .... ”Michael Jackson - Earth Song (Official Video)”: https://youtu.be/XAi3VTSdTxU	0	Tweet
1109917280924774402	@climate_all	2019-03-25 02:07:55	If you do so against the planet earth kicking on it, then you understand that climate change is happening....	0	Tweet
1109887221186916357	@AxelSthlbom	2019-03-25 00:08:28	I agree that we should try to prevent climate change, but you should probably keep in mind that most of us would never have existed if the older generations had done things differently.	0	Tweet
1109883697128308736	@loneseawolf	2019-03-24 23:54:28	I care about climate change. Rich people no !	0	Tweet
1109873526725472257	@MesslerMario	2019-03-24 23:14:03	The climate change hoax was invented by the same people who just tried and failed to frame President Trump for working with Russia 🤔 hmm Let that sink in!	0	Tweet
1109872533354876930	@SNagakumaran	2019-03-24 23:10:07	Congrats and keep up the good work. It is important that climate change be taken seriously worldwide. # FridaysForFuture	0	Tweet
1109819843702935552	@LinsoFre	2019-03-24 19:40:44	They care more about short-term value than long-term climate change	0	Tweet
1109710426323996674	@HRHSubhabrata	2019-03-24 12:25:57	I am anxious when you stand against bankers, you know all wars, and greatest crimes against humanities always funded by both sides like same bankers funded both Allience power and Axis in WW2, like that same bankers fund fossil fuel compnies & climate change programs, be catious	0	Tweet
1109641389707591680	@CamEcolivingFes	2019-03-24 07:51:38	US banking giant JPMorgan Chase is also highlighted in the report as “very clearly the world’s worst banker of climate change,” having funneled $196 billion into the fossil fuel industry between 2016 and 2018 “is nearly a third higher than the second-worst bank, Wells Fargo”	1	Tweet
1109604314409066501	@mobileal2017	2019-03-24 05:24:18	You have been lied to. Please stop following stupid people and believing climate change lies. If you will not read the scientific data, please stay in your bubble and do not procreate.	0	Tweet
1109515794310795264	@Shantan60786029	2019-03-23 23:32:33	Today we call a meeting for creating a event of climate change. so our event willbe held on 29 march at National Shaid Minar. # Bangladesh # CCABpic.twitter.com/iYaOBCUnCW	0	Tweet
1109486016614690817	@MicheleElys	2019-03-23 21:34:14	@ GretaThunberg they still are in # Denial climate change will affect them. Even when they have asthma, chronic bronchitis or pneumonia, they will live forever in # Denialhttps://twitter.com/GretaThunberg/status/1109394068902170627 …	0	Retweet
1109433747240296448	@AlejandroSig	2019-03-23 18:06:32	@ GretaThunberg Uncertainty and hotspots in 21st century projections of Agricultural Drought "The disaster that climate change will produce" https://www.nature.com/articles/s41598-019-41196-z …	0	Tweet
1109433542977691648	@RyRo77	2019-03-23 18:05:43	Watched JPMorgans Dimon talk about economic disaster by not investing in fossils, it became clear why governments (run by bankers) are not backing climate change. No money in climate change. If someone can make money from it, then it may be possible to care	0	Tweet
1109431141562531841	@RichardHollaba1	2019-03-23 17:56:11	You need to understand that these people get a paycheck for doing their little parts in this. They have a lifestyle to which is maintained by the paycheck. They may know what they are doing is wrong and hurts people by causing climate change.	0	Tweet
1109420363295977472	@noonefromCanada	2019-03-23 17:13:21	Push in the next elections to vote for only younger members of government to get government away from the current state of corruption. Younger candidates understand climate change and the public should stop voting for long term members of government to get a change in direction	0	Tweet
1109414208297406464	@RaffaelHuber7	2019-03-23 16:48:53	@ GretaThunberg You only talk about the climate change.There are worse problems than the climate change,such problem is illegal imigration.We should continue to invest more in the econemy,because climate change is a problem that affects the generation after you.	0	Tweet
1109404372214181888	@myfirstsatellit	2019-03-23 16:09:48	Top oil firms spending millions lobbying to block climate change policies https://www.theguardian.com/business/2019/mar/22/top-oil-firms-spending-millions-lobbying-to-block-climate-change-policies-says-report … “The successful lobbying and direct opposition to policy measures to tackle global warming have hindered governments globally in their efforts to implement policies after Paris agr”	1	Tweet
1109395706949844993	@drchosaludEyQS	2019-03-23 15:35:22	@ GretaThunberg Hi Greta! Would U please have a look at this and consider the importance of this factor for climate change. Lobbies keep it under rated-valued and it's already affecting so much nature and people. Congrats for your mission and achievments! https://www.5gspaceappeal.org/the-appeal/	0	Tweet
1109390090420346880	@mk19942	2019-03-23 15:13:03	In my opinion we have passed the tipping point long, long ago. With the climate change and the SICK capitalism.💲💲💲💲💲💲💲💲💲💲💲💲💲💲💲💲💲💲💲💲💲💲💲💲🌎🌍🌏😡😡😡😡😡😡😡😡😡😡😡😡😡😡😡	0	Tweet
1109376383132860416	@AdamSrigley	2019-03-23 14:18:35	@ GretaThunberg Äntligen: "Sir David Attenborough is to present an "urgent" new documentary about climate change for BBC One. The one-off film will focus on the potential threats to our planet and the possible solutions." https://bbc.in/2JvAQcA	1	Tweet
1109343055058862080	@hanamninh	2019-03-23 12:06:09	@ GretaThunberg Fighting with world leaders to combat climate change is difficult but it should be done.	0	Tweet
1109339126745178112	@DavideSorgato	2019-03-23 11:50:32	@ GretaThunberg We have to act in order to LIMITATE the Climate Change' consequences. 1. Change of the Atmospheric Global Circulation 2. 🔝Extreme events: highest power cyclones 3. Multiple lifeform extinction 4. Feedforward effect on Earth system homeostasys (*to go on)	0	Tweet
1109250031083675649	@alileigh203	2019-03-23 05:56:30	@ GretaThunberg Look who I found at a climate change exhibit at the Ontario Science Center! pic.twitter.com/MOH6I5xy8T	0	Tweet
1109185030264446980	@MarineKlilib	2019-03-23 01:38:13	@ GretaThunberg just some readings about inaction... Go to school I think! Your country is working on some subjects for concrete climate change action! # Read meaning go to school!pic.twitter.com/dJ0KRL1Pw5	0	Tweet
1109123191493066754	@eujune23	2019-03-22 21:32:30	@ gretathunberg says it without hesitation in The disarming case to act right now on climate change https://www.ted.com/talks/greta_thunberg_the_disarming_case_to_act_right_now_on_climate …	0	Tweet
1109110365634334721	@SeifidinR	2019-03-22 20:41:32	God bless your mission to raise awareness of Climate Change. May you always remember the Earth and climate crisis are in the hands of God.	0	Tweet
1109076175102640130	@AlePonzoni18	2019-03-22 18:25:40	@ GretaThunberg 1/2 hello greta I am an Italian boy. I come from bergamo italy. I agree with your opinion on climate change. I appreciate what you are doing. I will be in Stockholm next week for holidays.	0	Tweet
1109074015090552834	@ShreshRamsout	2019-03-22 18:17:05	@ GretaThunberg is such an inspiring child. Climate change is real and if we do nothing then we're condemning future generations to a life we can't imagine. # ClimateStrikehttps://youtu.be/EAmmUIEsN9A	0	Tweet
1109022029494267904	@ewtec2019	2019-03-22 14:50:31	Climate change is analogous to Lincoln and slavery or Churchill and Nazism: it's not the kind of thing where you can compromise. (James Hansen) # FridaysForFuture # ClimateStrike # cleantech # cleanenergy # protectourplanet # ReduceReuseRecycle # WeAreAble # ReNewAble # Ewtec2019	0	Tweet
1109012555823898624	@ba_smithy	2019-03-22 14:12:52	"There is no healing for one who hides an illness". I dare any adult to look any kid in the eye and tell them your views on climate change and appropriate action.	1	Tweet
1108988189836861440	@khan_server	2019-03-22 12:36:03	Climate change is real and these kids are fighting for the biggest cause of this planet. We need to spread the voice and fight against climate change. Worldwide protest # ClimateChangeStrike	1	Tweet
1108954324669861889	@arturo_k1	2019-03-22 10:21:29	suggestion: you should participate as evaluator in UN Climate Change agencies to have a realistic idea what really efficient or inefficient is working its bureaucracy, surely you learn and have a more realistic idea of the problem and ideas how to solve	0	Tweet
1108937573752160257	@rustydrummer74	2019-03-22 09:14:55	@ GretaThunberg Climate change in Sweden means more rain in the winter, dryer summers, glacial melting, increased forest fires. A worst case 100 ft rise in sea level just pushes cities deeper inland. In no possible scenario does that mean you all die. Get a grip.	1	Tweet
1108933214469410821	@rustydrummer74	2019-03-22 08:57:35	@ GretaThunberg How do you think they got rich? Because we all depend on the energy they provide. Before you continue scaring the shit out of naive children you should learn what fossil fuels actually give us. And that we can adapt to climate change. That we wont all die.	0	Tweet
1108929512237080576	@rustydrummer74	2019-03-22 08:42:53	@ GretaThunberg Climate change doesnt mean we all die. It means we adapt. Fossil fuels bring us food & clothing & medicine & transportation & computers & warmth & AC. Ending fossil fuel usage without a replacement would do FAR more damage than climate change. Educate yourself.	0	Tweet
1108905750854696960	@dhammikawee	2019-03-22 07:08:28	@ GretaThunberg and @ RepAOC have become the catalysts for a 3rd Horizon by re-framing the Climate Change debate to spark a new world order to save the planet for the generations to come. Both have a consciousness that is very different from those who created the climate problem. pic.twitter.com/fEaVLbZONL	0	Tweet
1108819362490650624	@VertDuFerk	2019-03-22 01:25:11	@ GretaThunberg As influential as you are, I hope you'll endorse a candidate in the US Democratic primaries. The president we choose in 2020 will be critical for climate change. Only @ BernieSanders has been consistently talking about it for decades.https://www.reddit.com/r/SandersForPresident/comments/atvw9d/bernie_sanders_talking_to_kids_about_climate/ …	0	Tweet
1108810022816043009	@OlivierRoubaix	2019-03-22 00:48:04	We need asap to find a new way to protest about climate change coz politicians are notre listening 😣	0	Tweet
1108807038711279616	@HenryK_B_	2019-03-22 00:36:13	@ GretaThunberg @ AOC @ Greenpeace @ UN_Women Listen to Science. Listen to Climate Change's Father. In a world of limited Hydro, carbon-free nuclear is the only scalable way to stop # ClimateChange.pic.twitter.com/3j18a7bDkz	1	Tweet
1108806817931542530	@HenryK_B_	2019-03-22 00:35:20	@ GretaThunberg @ AOC @ Greenpeace @ UN_Women Listen to Science. Listen to Climate Change's Father. In a world of limited Hydro, carbon-free nuclear is the only scalable way to stop # ClimateChange.pic.twitter.com/wlkbV4YLrF	1	Tweet
1108806186151890947	@HenryK_B_	2019-03-22 00:32:50	@ GretaThunberg @ AOC @ Greenpeace @ UN_Women Listen to Science. Listen to Climate Change's Father. In a world of limited Hydro, carbon-free nuclear is the only way to stop # ClimateChange.pic.twitter.com/Aij79955tN	1	Tweet
1108771808059101196	@CapnSasquatch	2019-03-21 22:16:13	@ GretaThunberg "Keep it in the ground" MUST be part of mitigating climate change. https://twitter.com/YEARSofLIVING/status/1108770261220892672 …	0	Retweet
1108767406204309506	@SeifidinR	2019-03-21 21:58:44	Even as you are deeply concerned about climate change may you clinging to true salvation found in Jesus Christ.	0	Tweet
1108767018029928448	@WonderAstia	2019-03-21 21:57:11	Imagine locking up stubborn leaders and profit organizations in boxes for taking climate change for granted (just kidding)😁. I'm proud of you dear 😍	0	Tweet
1108687604554170368	@St92017232	2019-03-21 16:41:38	@ GretaThunberg @ GretaThunberg kindly create awareness among indian students about climate change... Change is killing people all over	0	Tweet
