Tweet id	Poster username	Tweet post Date	Tweet text	Number of retweets	Tweet type
1108639327305654272	@RoShamBoProds	2019-03-21 13:29:47	Lot's of flooding going on right now. Extreme weather events are amplifying and accelerating rapidly because of human-made climate change. We want a Green New Deal in the USA w jobs transforming our country into a clean energy economy! Otherwise...it doesn't look good for us!	0	Tweet
1108570923450302465	@Erickardiyanto_	2019-03-21 08:57:59	@ GretaThunberg she activist climate change, she looks smart women and strong women with amazing movements , she inspirations generation Z in the world to leave and actions to climate change. ✊🏻🌹	0	Tweet
1108475891473174528	@kol_josef	2019-03-21 02:40:21	People believe since 30 years that the climate change was made from humans. Who made the climate change the last 4,6 billion years b4?	0	Tweet
1108372597606092800	@ItsNaamfest	2019-03-20 19:49:54	@ GretaThunberg Hi Greta. We love what you are doing about climate change. Our founder Dave Ojay tried to reach you about the arts advocacy program on # JusticeforLakeVictoria and # MyLakeMyFuture	0	Tweet
1108281032724238336	@greenkeizai	2019-03-20 13:46:03	climate change is result of economic activity! but,SDG's don't have sustainable economic activity & principle! now,there is only sustainable development,and going on continue all over the world! first, UN need to tackle this problem immediately!	0	Tweet
1108229587459178496	@St92017232	2019-03-20 10:21:38	@ GretaThunberg kindly create awareness among indian students about climate change... Change is killing people all over	0	Tweet
1108169993605263360	@Bymst2Bymst	2019-03-20 06:24:49	Campaign continue s when power is resto in my android I have been on PowrrSaversince!Congrats Greta on your most timely strike on Climate change Act	0	Tweet
1108146673853911041	@xiyebastida	2019-03-20 04:52:10	@ GretaThunberg is raising awareness, we need a new way of thinking!! In which we address Climate Change in a fast enough manner that is also sustainable and mindful. # OurFuture # YouthWayOfThinkinghttps://twitter.com/NaomiAKlein/status/1108034324589395974 …	1	Retweet
1108122970604666880	@BattleCatTexas	2019-03-20 03:17:58	@ GretaThunberg, what steps should I take as a consumer to reduce my carbon footprint and help climate change?	0	Tweet
1108105775363305472	@CarpeDiemHealth	2019-03-20 02:09:39	Whatever it takes can be going plant based because of the destructive climate change related environmental impact animal agriculture is linked to	0	Tweet
1108105231303430144	@777_festus	2019-03-20 02:07:29	@ GretaThunberg the sound of thunder approaching, no more mistakes on climate change.. the generation is having their tired of boardrooms conferences conversations. By passing the middle and gatekeepers, makes sense https://twitter.com/wef/status/1107688320639922176 …	0	Retweet
1108082414784405504	@Nautilus916	2019-03-20 00:36:49	Please start encouraging people to have fewer children. No one seems to be talking about population reduction as a means to fight climate change:https://www.youtube.com/watch?v=OoqDiwvzcHE …	1	Tweet
1108081226701778944	@justbeeforest	2019-03-20 00:32:06	I would like to see a real time interactive world map listing what each country is doing for climate change what they pledge to do and also their carbon emissions. Does this exist?	0	Tweet
1108066589272928257	@DietmarAnders	2019-03-19 23:33:56	@ GretaThunberg The Swiss People's Party (German: Schweizerische Volkspartei, SVP) is a national-conservative and right-wing populist political party in Switzerland. SVP is the largest party in the Federal Assembly. And this party denies climate change !!! pic.twitter.com/eMYsCJLEZM	0	Tweet
1108044595542274051	@CMHR_News	2019-03-19 22:06:32	@ GretaThunberg addressed the 24th @ UN climate summit, condemning global inaction in the face of catastrophic climate change. She has garnered global attention for carrying out a weekly school strike for climate in Sweden. 1/2 pic.twitter.com/l6nr1jmaaL	0	Tweet
1107981705493839872	@JeromeOLLIER	2019-03-19 17:56:38	@ GretaThunberg - Study shows IPCC is underselling climate change - @ UniofAdelaide https://ift.tt/2JjUbgD	0	Tweet
1107960231894663168	@Silverbullet130	2019-03-19 16:31:18	How about solar panels on all schools,colleges & universities? Also Climate Change must be part of a schools curriculum!	0	Tweet
1107940203631730690	@nicothenu	2019-03-19 15:11:43	Maybe the biggest goal isn't finding a solutions against climate change,but to regain public support to fight it.Many citizens have lost their faith in politics & struggle to pay their bills.We need them to regain support to reach our goals & must put bills to biggest polluters. pic.twitter.com/EX531KC9SU	0	Tweet
1107937066401366018	@nicothenu	2019-03-19 14:59:15	I think the biggest goals we must bridge to find enough public support for a transition is making sure the cost's of reducing climate change isn't put only on the lower & middle incomes.And fixate also on the healthcare issue of pollution & find ways to make transition profitable pic.twitter.com/3WRVWl0iU7	0	Tweet
1107915888035053569	@GermANI2u	2019-03-19 13:35:06	@ GretaThunberg how honest are you ⁉don't you want let our world know who you are and what the real aim is behind "your aim to make a CHANGE" ⁉... Svante August Arrhenius 》》your great grandpa 》recovered the climate change and for a Nobel prize 😉 .. befriended with Nobel❗..pic.twitter.com/Fx1gcyQDnk	0	Tweet
1107907128801419266	@AlexPascoe5	2019-03-19 13:00:18	# blacklivesmatter"> #changecantwait # stopthetrain We, the inhabitants are rich. We do not need to work at all. Work and growth is a fallacy. Debt is the rope around our neck. Climate change is one of the issues. Inequality is another. One Planet, One Nation, One Race.	0	Tweet
1107847261114064896	@RORYMELDRUM	2019-03-19 09:02:24	With the state of the @ UKParliament currently regarding CLIMATE CHANGE policies,someone needs to speak out! As an expert on Climate Change,instigating WIND POWER WORLDWIDE @ LivUni the @ Conservatives are a complete disaster+disgrace policy wise,epitomized by the recent turn out!	0	Tweet
1107846875858628608	@nav7d	2019-03-19 09:00:52	I am super proud of what you're doing. Climate change and its effects are devastating and the people of my country (the whole southwestern region) of Bangladesh are already suffering. I invite you to come visit sometime so that you can see the effects of climate change first hand	0	Tweet
1107782370160185345	@AugeAabye	2019-03-19 04:44:33	@ GretaThunberg With the calcium carbonate contained in the shells of the 1.1 trillion eggs we eat in a year we could produce micronised dust weighting 3.000 million kg that dropped in the atmosphere by the 38 millions commercial flights a year could stop climate change.	0	Tweet
1107751582987362304	@NarecDE	2019-03-19 02:42:13	You are amazing. You, and everyone like you, inspire us to work harder on fighting climate change	0	Tweet
1107750921180794887	@AlbionUnitedAFC	2019-03-19 02:39:35	The school I work at said we're not taking part...even though we're discussing and studying climate change right now...	0	Tweet
1107741270775160832	@SveaElske	2019-03-19 02:01:14	Hi Greta, you’ve inspired my 6th grade son! He gave his first Social Studies current events speech on the Svalbard islands & how they’re warming almost faster than anyplace on earth due to climate change. His 2nd speech was last Monday & he spoke about your global # ClimateStrike	0	Tweet
1107720489257062401	@the_ecofeminist	2019-03-19 00:38:39	Wow!!! This is a break-through in the fight against climate change. # FridaysForFuture Nigeria.	1	Tweet
1107715947706621953	@Corinne4Hillary	2019-03-19 00:20:36	Great work, I just don’t care about climate change .	0	Tweet
1107711934181318657	@kcldav43	2019-03-19 00:04:40	Such a shame that the EU is one of the worst contributors to Climate change though. https://corporateeurope.org/power-lobbies	1	Tweet
1107696484898750464	@solar_4schools	2019-03-18 23:03:16	Well done! We have been trying to help more schools go solar so we can help the next generation fight climate change. We are now raising funds for 20-25 more UK schools at http://www.ethex.org.uk/sfs2019	0	Tweet
1107660878264991751	@dan_psyd	2019-03-18 20:41:47	I’m a psychologist interested in helping more people become climate change activists. Here are my ideas about 1) how to become an activist, & 2) if you are already active, how to increase your impact. https://medium.com/@danrubinpsyd/everyone-an-activist-25f68fe6d448 …	0	Tweet
1107656460249587713	@lart90154581	2019-03-18 20:24:14	@ GretaThunberg Dear Greta, you dont accept the denials of adults about climate change but you do unfortunately accept the diagnosis of OCD or Asperger's. Sadly, most physicians are NOT scientists, strongly suggest you go to Karolinska or Mayo clinic for expert diagnosis.. best LM	0	Tweet
1107643387501576193	@Arabianmau	2019-03-18 19:32:17	You are my hero! 💝💝💝 Let us all fight for planet earth and protect it. I am writing my fourth book about climate change and it's for children so every child learns about it and joins in the reforms.	0	Tweet
1107628115310841856	@PaoloPanareo	2019-03-18 18:31:36	Hi everyone,i launched this petition on http://Change.org : Milano Cop26. I presented the candidacy of Milan to host the United Nations Climate Change Conference. Click here:http://chng.it/wRgk96Dr8c	0	Tweet
1107626080595296256	@SarahSlefebvre	2019-03-18 18:23:30	Keep doing what your doing! There are more climate change believers than deniers. ❤️❤️	0	Tweet
1107622175329189888	@mariahvalsr	2019-03-18 18:07:59	@ GretaThunberg hi Greta:) we are four girls from the Faroe Islands. We've heard your story, and think it's very inspiring. We're doing an exam right now about climate change, and wondered if you have time for an interview. We can do it on the phone or whatever is available to you	2	Tweet
1107606662918127617	@alxwlsdn	2019-03-18 17:06:21	There's a simple solution to climate change that WTO could implement: any country who's emissions per capita are above the mean figure should have tariffs imposed on their exports. All countries below the mean trade tariff free. Change will happen as all try to be below the mean	0	Tweet
1107593725948108801	@Elsie_Mandel	2019-03-18 16:14:57	Greta, My daughter is studying Climate Change policy in grad school. You are a great hero to her and her classmates. You are a beacon of hope.	0	Tweet
1107583722554036224	@AG_Bou	2019-03-18 15:35:12	@ GretaThunberg Hey Greta ! We are a group of students from the Paris School of Economics organizing a conference on climate change and we would be honored to receive you as a speaker. Please send me a message if you are interested. Hope to have some news from you 🌏 Best regards	0	Tweet
1107579313275195392	@grottyscotty	2019-03-18 15:17:40	Isn’t it the height of irony and hypocrisy, that those that have presided over half a century of doing pretty much nothing about climate change, then expect young teenagers to have all the answers when they are being called out! Even so, the answers are surprisingly simple.	0	Tweet
1107501535334813696	@JeanMichelFleur	2019-03-18 10:08:37	@ GretaThunberg is right about the danger we all face. The UN reports humanity is failing its climate change goals https://www.salon.com/2019/03/16/the-un-reports-humanity-is-failing-its-climate-change-goals_partner/ …	0	Tweet
1107422724106928133	@HenryK_B_	2019-03-18 04:55:27	"Good intentions" & Sunshine&Breeze unicorn🦄🦄🦄 energy will not stop Climate Change. Biomass, wind & solar, are a trillion-dollar fiasco at reducing emissions. In a world of limited hydro, carbon-free nuclear is the only scalable way to stop # ClimateChange # schoolstrike4climatepic.twitter.com/RmOOGQuz3j	1	Tweet
1107390413323800576	@whirleduprules	2019-03-18 02:47:03	Greta! You must call me! I have a global sustainable socioeconomic building endeavor all set up for charity. I need the kids to get behind something like this first. I need an outlet. It’s an answer to your problem. It can globally impact climate change very quickly. # 12weekspic.twitter.com/3DzavbiCEq	0	Tweet
1107389905628479493	@laigle_noir	2019-03-18 02:45:02	messing with a system, the earth, by our actions, when we don't know what the results will be is very unwise, especially when we depend on that system. Regardless of your view on climate change this fact should give us all pause and make us hurry to lessen out impact on the earth	0	Tweet
1107386880012767232	@FraserMacLeod5	2019-03-18 02:33:01	We must never let down our guard against the pest that is far right/Nazi ideology. On short timescales it can be more dangerous than climate change itself. Please bear this in mind when acting decisively. https://www.thelocal.se/20190315/a-xenophobic-and-radical-nationalist-current-is-on-the-rise-in-sweden-sapo/amp?__twitter_impression=true …	3	Tweet
1107379582292905984	@soda_kenny	2019-03-18 02:04:01	Please seek help for your aspergers, it can be a massive developmental obstacle especially for a teenager living in today's world. You are clearly obsessed with climate change, most likely this unhealthy obsession is caused by your aspergers	0	Tweet
1107371796465176577	@RobertSRedfern	2019-03-18 01:33:04	Climate change is caused by cutting down 3 trillion trees for animal farming. 1. They take too much of the planets precious resources including water and land for growing feed cereals.	0	Tweet
1107326981090234368	@Globalines	2019-03-17 22:35:00	There's no heaven or hell, this planet is all we have. 🌎 # PaleBlueDot ♻️ Reduce, Reuse, Recycle 🌎 # FridaysForFuture # TheTideIsTurning # NewGreenDeal # ScientistsForFuture Thousands of scientists are backing the kids striking for climate change. https://www.nature.com/articles/d41586-019-00861-z …	1	Tweet
1107295768761823233	@LizzDurann	2019-03-17 20:30:58	Greta: Beyond demonstrations, you must have some actions to mitigate climate change, at your youth level. What concrete actions are you taking, to show us that there can be a change? These followers will able to replicate actions, There is no small.	0	Tweet
1107292514078191617	@RaeesMir8	2019-03-17 20:18:02	Commendable job by these kids. You showed the world that One person alone also can make a difference. We the common people have seen the bad of climate change, it's time to act before we may see the worst. # ClimateActionNow	0	Tweet
1107290013094563841	@weowntheplanet	2019-03-17 20:08:06	That is amazing so now are we joining the kids to protest against climate change until measures are taken or are we leaving the kids alone to protest...	1	Tweet
1107288059526164480	@DoloXdolo	2019-03-17 20:00:20	Who denies the reality of climate change is not a scientist, is corrupt, example, the air has about 17 components "Gases" its composition changed in the last 20 years and is irreversible, migraines, cancer, infertility, stress are derived from that air. Only Data	0	Tweet
1107265188254937088	@EthicalBrandAZ	2019-03-17 18:29:27	@ GretaThunberg, the Swedish schoolgirl who has inspired an international movement to fight climate change # YouthStrike4Climate, has been nominated as a candidate to receive this year's Nobel Peace Prize! 🏆 # FridaysForFuturehttps://www.bbc.co.uk/news/world-europe-47568227 …	0	Tweet
1107252764273528834	@MbaarakA	2019-03-17 17:40:05	@ GretaThunberg Mbaarak Abdalla @ MbaarakA Forest Restoration Agency has decided to take urgent action to combat climate change and its impacts by planting 3.5billion trees. Feel free to reach us if you're interested. Thank you!	0	Tweet
1107239276784349185	@LucyFeliciano7	2019-03-17 16:46:29	There in lies our power!! Together we can make CLIMATE CHANGE a reality....	0	Tweet
1107236950015119360	@snipper_z	2019-03-17 16:37:15	Do you know that the climate change is due to capitalism politics? Why don't you assume that? # climatestrike # klimatstrejk # FridaysForFuture	0	Tweet
1107235650787516416	@J_Eine	2019-03-17 16:32:05	What these climate change deniers is writing is on the same page as flat earth in my book... do they believe what they are writing or are they lying?	0	Tweet
1107216781662396416	@ttdwsn	2019-03-17 15:17:06	Scottish BBC did the same packing news with climate change deniers. 😠	2	Tweet
1107211313091145731	@ttiaat	2019-03-17 14:55:22	.but Sweden have more renewable energy than anyone else so what are you saying? The Swedish govt don't believe in climate change??	0	Tweet
1107203747573313536	@stemomt	2019-03-17 14:25:18	@ GretaThunberg what should young people do now for climate change apart from not going to school on Friday? Should they stop: flying, being driven on non electric cars, buying new cloths, eating meat and dairy products? Should they become vegane? What about use of smartphones?	0	Tweet
1107196294299181056	@pall336	2019-03-17 13:55:41	Do you understand climate change? They may not know the truth. Since February 2016, CO2 has increased. However, the average temperature dropped sharply until December 2018. This is stronger than the influence of CO2. # ClimateJustice NASA Data graph↓pic.twitter.com/0U7AuEyOgn	5	Tweet
1107196103877779456	@pall336	2019-03-17 13:54:56	Do you understand climate change? They may not know the truth. Since February 2016, CO2 has increased. However, the average temperature dropped sharply until December 2018. This is stronger than the influence of CO2. # ClimateJustice NASA Data graph↓pic.twitter.com/uaFb9oGhTL	0	Tweet
1107185460114272257	@robheus	2019-03-17 13:12:38	and b/ one of the best solutions to climate change to help those already suffering from it for decades (droughts/soil-erosion/desertification) is to plant trees? https://www.youtube.com/playlist?list=PLONmDr-bQAAC6xXBfhZhSDDFk8hq66qSu …	0	Tweet
1107185363947274240	@robheus	2019-03-17 13:12:15	Greta, have the youth considered that: a/ in the past decades 'the world' spent around 5 trillion to fight wars, we had better invested in combating climate change?	0	Tweet
1107177498951983104	@Humandignityan1	2019-03-17 12:41:00	climate change has no age @ GretaThunberg Tanzania we are in....	0	Tweet
1107105706182934534	@amit7794	2019-03-17 07:55:44	@ GretaThunberg, A 16 year old child is giving a very clear message that if we do not talk about Climate Change today then there will not be any future. World leaders must listen. @ realDonaldTrump @ narendramodi @UNEnvironment @ UN @ UNFCCC @ NASAClimate @ isro # ClimateActionhttps://twitter.com/TEDTalks/status/1106628056289103872 …	0	Retweet
1107066942890917888	@Boroughman	2019-03-17 05:21:42	@ GretaThunberg Please ask for all 450 nuclear reactors to be closed down. Humanity can cope with climate change but if society breaks down due to loss of food and water, unmanned reactors will melt down & radioactivity will kill off all Earth's life forms. https://www.youtube.com/watch?v=m44MB2Guy08 …	0	Tweet
1107036749157396480	@dan_psyd	2019-03-17 03:21:43	I'm a psychologist concerned that many people don't talk about climate change because they simply don’t know how to, so I wrote something about how to have a useful conversation about climate change. Here it is https://medium.com/s/story/how-to-have-a-useful-conversation-about-climate-change-in-11-steps-d4bbd4135e35?source=friends_link&sk=d3e04ff4603296f3af02a7a0e718c58c …	0	Tweet
1107036568991207435	@CelaenoM45	2019-03-17 03:21:00	Brilliant that children are standing up for the future of our planet. Absolutely awful that they are having to do so. Children should not have to compromise their education for governments to take climate change etc seriously.	1	Tweet
1107035480464355328	@Nautilus916	2019-03-17 03:16:40	I hope this will happen in Asia one day as well. Without the cooperation of countries like China, Korea, Japan, and Indonesia, climate change will never be beaten.	0	Tweet
1107031350354284544	@pdMd_livin	2019-03-17 03:00:16	So what can we as a people, do to help make the planet 🌎 a better place to live in and “defeat” climate change? Other than taking to the streets and protesting with a sign.	0	Tweet
1107029627107717120	@GSawision	2019-03-17 02:53:25	Yet those protests contributed to worsening climate change! ROFLMAO # cdnpoli	0	Tweet
1106983721272520708	@PaoloPanareo	2019-03-16 23:51:00	Hi everyone,i launched this petition on http://Change.org : Milano Cop26. I presented the candidacy of Milan to host the United Nations Climate Change Conference. Click here:http://chng.it/wRgk96Dr8c	1	Tweet
1106962477764337664	@robinmonk	2019-03-16 22:26:35	@ GretaThunberg Thank you for being a leader we of all ages can look up to. Climate change has been a major concern for me for decades, and a huge frustration ever since Al Gore "lost" the presidency. My generation has been failing you. You give me hope. Never ever quit!	0	Tweet
1106931145231515649	@JoongWu	2019-03-16 20:22:05	Fantastic Day!Common Sense for Climate Change and your Terrible Conseguence! # FridaysForFuture # ClimateStrike # ActToClimate	0	Tweet
1106921321303326724	@MarieDeRoy1	2019-03-16 19:43:03	Congratulations, Greta, for this success. May it provide fruit - may all adults act as you all have demanded to address climate change. Good luck in future endeavours.	0	Tweet
1106919947446427653	@StefanoEspejo	2019-03-16 19:37:35	In Voghera(Italy) 2000 students leave their classes to march against Climate Change. Let’s change the world @ GretaThunberg # ClimateStrikes # Frydaysforfuture # MarchePourClimat # FridaysForFurturepic.twitter.com/Z1SBxgBlZj	3	Tweet
1106913345192542208	@ChristianSchme9	2019-03-16 19:11:21	The message from # FridaysForFurture is now more than clear and there is no single reason to ignore it and delay urgent measures against climate change! This is not a petition anymore but rather an explicit demand to all governments and authorities worldwide TO ACT RIGHT NOW!	0	Tweet
1106904321873113089	@agrawal_virat	2019-03-16 18:35:30	@ GretaThunberg you personify the words of Mahatma Gandhi -“Be the change you wish to see” The crisis “Climate change” is real and is happening right now. We need to Act faster and stronger. # ClimateStrike # FridaysForFurture # FightforFuturehttps://twitter.com/GretaThunberg/status/1041369960436703232 …	0	Retweet
1106903705423613952	@leafsnivy	2019-03-16 18:33:03	@ GretaThunberg I support anyone fighting for climate change as well as those with asperger's syndrome too.	0	Tweet
1106859498206085120	@globalwarning_	2019-03-16 15:37:23	Amazing work by all the young people around the world! It is ridiculous to think that it has come to young people (who can’t even vote!) to have to come together to make stand on climate change. We will be the change🌎🌎	0	Tweet
1106857626988621824	@RossBaxterArt	2019-03-16 15:29:57	@ GretaThunberg - is the most incredible teenager I've ever heard of. What she's doing for climate change is amazing. All these school marches has happened because of her and its incredible seeing everyone support the cause.	0	Tweet
1106844949704777733	@AmySherr1	2019-03-16 14:39:34	@ GretaThunberg I saw your video about climate change.i want to join forces with you to help our planet. i live in isreal and i was wondering if i could use your video and do a hebrew voice over. here in isreal we don't go to school on fridays but i was thinking if we could do-	0	Tweet
1106842018150518786	@the_ecofeminist	2019-03-16 14:27:55	And we will continue to climate strike until our leaders take actions against climate change. Expect another more turn up on # ClimateStrike # FridaysForFuture in Nigeria.	12	Tweet
1106840834916286464	@edward_horejs	2019-03-16 14:23:13	@ GretaThunberg you’re an amazing girl, Greta. You May want to follow my governor, @ JayInslee , of the State of Washington. He is running for President of the United States of America, and his central campaign issue is combating climate change by building a Green Economy!	0	Tweet
1106840306408980483	@NicholasWerren	2019-03-16 14:21:07	Incredible and empowering for so many people - only collective action can fight climate change! Everyone who was out on the streets should be proud.	1	Tweet
1106827642576224256	@danlayaq	2019-03-16 13:30:48	@ GretaThunberg on climate change. You're really inspiring. Leadership has no age. https://youtu.be/HzeekxtyFOY	0	Tweet
1106826072379850752	@TheGoldenLight4	2019-03-16 13:24:34	@ GretaThunberg You did an Amazing speach about the climate change Beacuse we need to do somenthing Now Congratulations!!!!! # FridayForFuture	0	Tweet
1106815610858688512	@Eimo66	2019-03-16 12:42:59	Congratulations, Greta, March 15, 2009 will enter history books as first truely worldwide protest against the lack of serious political action against climate change! We first have to convince the voters, then the politicians will follow! The Board of # ISES_Solar supports you!	0	Tweet
1106804429385154560	@Nautilus916	2019-03-16 11:58:34	I support you but the fact remains that the vast majority of these students will still drive cars, take flights, and eat meat and dairy. If you are truly serious about fighting climate change, you will fight for population control as well.	0	Tweet
1106803919529771009	@zitherbelll	2019-03-16 11:56:32	Though equator shifts might be a large part of climate change as Egypt pyramids once marked the old lines and things were shaky then in climate to ...it may not be all of Our climate needed help as things are shifting agian ....and thank You so much	0	Tweet
1106788084723654658	@269lifeSACT4eva	2019-03-16 10:53:37	Greta! I am a high school teacher in South Africa and I am so impressed with your work for the planet! Can I please beg you to look into the effects of the meat and dairy industries on climate change? Please! It is the only way to secure our future. Thank you so much. Keep it up! pic.twitter.com/vx73NLIzWL	0	Tweet
