Tweet id	Poster username	Tweet post Date	Tweet text	Number of retweets	Tweet type
1106756168657960960	@Carol_Thom	2019-03-16 08:46:47	You changed the conversation and forced climate change to the front and center. And you got people across the entire globe on board. Amazing!	0	Tweet
1106748173593174016	@allan1830	2019-03-16 08:15:01	@ GretaThunberg One child talked about how your generation believes in science that’s why they believe in climate change. Science says the brain does not develop until between 25 and 30. Maybe you’re believing the wrong people? Propaganda is normally Clothed in flowery language.	0	Tweet
1106747336573620226	@mv_cal	2019-03-16 08:11:42	Stop using climate change as an excuse to communize us. I'm so sick of this con job.	0	Tweet
1106740172828430337	@MillionSolStars	2019-03-16 07:43:14	Way to go Greta & students around the world. Your leadership is helping us rise to the challenge of climate change. Keep up the good work & let us know how we can work with you to solar power 100% of schools globally. # TakeAction @ GretaThunberg @ 350 @ TSCDubai @ FairgreenDubai	2	Tweet
1106720606802886659	@DanielLaraman	2019-03-16 06:25:29	Obviously more pressure is needed how about organising events every Friday and get politicians attention, get them worried about your education so they take action on climate change I only wish when I was in school we had events like this.	0	Tweet
1106701724843048960	@htmowlet	2019-03-16 05:10:27	Hi!! I did my first walkout today and it was amazing. I’m glad that I can do something that actually makes a change in the world. Thank you so much for inspiring this climate change climate action action across the world!	0	Tweet
1106698195575308288	@jennybcsilly	2019-03-16 04:56:25	Student strike for climate change. ❤	0	Tweet
1106697176741265408	@fernand83380491	2019-03-16 04:52:23	@ GretaThunberg I'm Mexican, I'm concerned about the growing temperatures in my city, I am even more concerned about the disinterest of many for climate change. We must raise awareness that the planet is our only home and to learn take care it # ClimateStrike # FridaysForFutureMx	0	Tweet
1106692392541978624	@MoehneseeSchule	2019-03-16 04:33:22	Fridaysforfuture 15.3. in Soest/Germany: small town - great spirit! 350 students side by side with scientists4future Dr. Udo Engelhardt, through wind and storm, in their free time after school! Students fight against climate change. Banner "Climate Alarm" by Moehnesee-School pic.twitter.com/kMqcrrU11V	1	Tweet
1106691819176448000	@VisavisInvest	2019-03-16 04:31:05	- now a 125 country phenomenon? Naaaaa! It is a EVERY country, continental phenomenon, showcased by the darling of climate change and our prescient progeny. Thank you! https://twitter.com/gretathunberg/status/1106638130290049024?s=12 …	1	Retweet
1106687721295118336	@ChuckKutscher	2019-03-16 04:14:48	Congratulations, Greta! I loved your unflinching response to the charge that climate change is not a black-and-white issue.	0	Tweet
1106685201621680128	@kcfla1	2019-03-16 04:04:47	First it was "global warming" until it was proved to be fake science. Then it changed to "climate change". And yes climate change is real. The fake part is that the use of fossil fuels has any significant impact. First fake news now fake science.	0	Tweet
1106677544261218306	@kellathornton	2019-03-16 03:34:22	@ GretaThunberg is incredible. What she and other youth are fighting for on # FridaysForFuture is inspiring and, hopefully, galvanizing. "Seeing Climate Change in Black and White" via @ TCRWUSTL :https://commonreader.wustl.edu/greta-thunberg/	0	Tweet
1106676505797640193	@lovedbyGod79	2019-03-16 03:30:14	It would be useful if you all would spend time studying the electric(plasma) universe model, previous climate change events in the past...Dalton, Maunder minimums...and realized SCIENTIFICALLY these better match todays patters than the co2 models that havent predicted anything	0	Tweet
1106671281896898560	@MarineKlilib	2019-03-16 03:09:29	@ GretaThunberg yes you should be at school because if you want to become a great leader and act the world you need an education! Look in poor countries and see that in your country @🇸🇪 people can fight for climate change because they dont live with 2$ per day! https://twitter.com/GretaThunberg/status/1106468558945599488 …	0	Retweet
1106668851440300033	@Chrisullivan210	2019-03-16 02:59:49	We have 12 years to cut damn emissions in half or face global crisis, not hyperbole either that's @ UNFCCC panel on climate change! With horrible jerk in White House allowing grifters from coal lobby in the EPA it's bleak Bold action fast, we must vote like our lives depend on it!	2	Tweet
1106667419693731840	@louise_arnott	2019-03-16 02:54:08	Greta good for you for standing up for climate change! It’s your generation that has the most effect, the governments are hearing you! You are the future voters!	0	Tweet
1106655776083460099	@dantegiuliano	2019-03-16 02:07:52	Stop eating meat right now. Especially beef! Then stop using electricity that comes from coal burning power plants. Then stop driving a car, taking the bus or riding a train. That’s the fastest way to make an immediate impact on climate change.	0	Tweet
1106652643282173952	@TeresaPaxton	2019-03-16 01:55:25	Students striking for Climate Change in Sebastopol, CA # FridayForFuture # SchoolsStrike4Climatepic.twitter.com/eyn1GaRRio	0	Tweet
1106650915904385024	@Al87712457	2019-03-16 01:48:33	How many of them understand the facts not just the rhetoric put out by people making a fortune off of rabble rousing using junk science? Climate change is real & natural. Our climate is a dynamic constantly changing. It will never stagnate and stay the same.	0	Tweet
1106650098090409984	@jkgood1	2019-03-16 01:45:18	Thank you for being such a strong leader at such a young age! Your generation brings me hope! Sorry our generation is pretending climate change isn’t real. Not all of us feel that way 😢 You are inspiring! # ClimateAction # ClimateChangeIsReal # ClimateActionNow # ClimateStrike	0	Tweet
1106648784828719104	@soyvnasa	2019-03-16 01:40:05	striking for Climate Change 🌍 # Sacramento # CA # SchoolsStrike4Climate # FridayForFuturepic.twitter.com/5lfiYsMIO2	3	Tweet
1106646539483570176	@greenkeizai	2019-03-16 01:31:10	climate change = result of economic activity & principle! this planet need to open conference at un immediately! tis planet need to rethink economic activity & principle!	0	Tweet
1106644125342986242	@Loftyransom	2019-03-16 01:21:34	@ GretaThunberg is the Martin Luther King of Climate change. A massive outrage of students matched in 2000 locations of 125 countries in all Continents today # Fridayforfuture. No more silence we # ActOnClimate.	0	Tweet
1106641051249332225	@loneseawolf	2019-03-16 01:09:21	I care about climate change. Me too.	0	Tweet
1106640490890313728	@greenkeizai	2019-03-16 01:07:08	climate change is result of economic activity! this planet need to rethink conventional economic activity & principle! this planet need to create sustainable economic activity & principle! un need to open conference immediately! SDG’s don't have sustainable economy!	1	Tweet
1106638655609810944	@TraleeAnneMarie	2019-03-16 00:59:50	Here here!! I've even put myself up for election so people in # Tralee in # Kerry # Ireland have someone to vote for who really cares and wants to do something urgently about climate change	1	Tweet
1106638047913754629	@RedSoxMVP	2019-03-16 00:57:25	Why are they not teaching the right thing at school? What is this climate change based on? More polar bears than ever on this earth. Al Gore just bought a summer home where the water is just going to rise and kill him! We need truth. https://www.youtube.com/watch?time_continue=314&v=K56fms2VZTc …	1	Tweet
1106634599579426817	@BeaveMachine	2019-03-16 00:43:43	Don't let the left control you and lie to you! Global climate change has been going on prior to men and women ever showing up on earth. Man made climate change is the BIG lie from the globalist that have infiltrated school systems to promote their own agenda. They are lying to u	0	Tweet
1106633623334281217	@HmmmmmmIthink	2019-03-16 00:39:50	Get the facts about Climate Change https://youtu.be/59bHCuJuYJw	0	Tweet
1106631306010681345	@FreshXSpritz	2019-03-16 00:30:38	@ GretaThunberg said it best "on climate change, we have to acknowledge that we have failed" - but that doesn't have to mean this is the end - global collaboration like the # climatestrike will make a difference 🌍http://ow.ly/Uz2350ncUIa	0	Tweet
1106627935778287616	@HmmmmmmIthink	2019-03-16 00:17:14	Get the facts about Climate Change Reality - https://youtu.be/59bHCuJuYJw	0	Tweet
1106626844441350146	@npjackson123	2019-03-16 00:12:54	I don't think the politicians have quite worked out that this isn't going to stop. It's going to get much bigger. They have warm words but until they take climate change seriously they on the losing side. If they win, we all lose.	0	Tweet
1106625241156063232	@marcioisensee	2019-03-16 00:06:32	@ GretaThunberg hey Greta, you are influencing youth from all around the world to join the climate change cause! These photos are from Rio de Janeiro, Brazil. Thanks for your inspiration! :-) pic.twitter.com/bKTOk7fbiR	1	Tweet
1106624018776391680	@WallaceCliodhna	2019-03-16 00:01:40	@ GretaThunberg, take a bow! Really really moving to see so many young people rallying today for climate change! 💪🏼🌍🌈	0	Tweet
1106621614248984576	@DianeEv83169096	2019-03-15 23:52:07	@ GretaThunberg You are an inspiration to an entire generation and more! I am humbled by your honesty and your dedication. You give me hope that we will change the way the world is responding to climate change.	0	Tweet
1106614817979195392	@dan_psyd	2019-03-15 23:25:07	I'm a psychologist concerned that many people don't talk about climate change because they simply don’t know how to, so I wrote something about how to have a useful conversation about climate change. Here it is https://medium.com/@danrubinpsyd/how-to-have-a-useful-conversation-about-climate-change-in-11-steps-d4bbd4135e35 …	0	Tweet
1106614785355988993	@rodromgar	2019-03-15 23:24:59	@ GretaThunberg NOT GOING TO CLASS TO AVOID CLIMATE CHANGE IS LIKE TRAVELLING ALONE IN A CAR TO AVOID OVERPOPULATION IN PUBLIC TRANSPORT SYSTEM.	0	Tweet
1106609224635711488	@dukemokoo	2019-03-15 23:02:53	Bahahahaha!!!! Probably the greatest hoax ever is the paranoia of climate change. All to push the one world agenda...sad actually	0	Tweet
1106607093891555330	@WhiteIsAColor2	2019-03-15 22:54:25	IT WASN'T YOU WHO STARTED CLIMATE CHANGE AWARENESS, GRETTA❗ INCITING CHILDREN TO PROTEST IS UNETHICAL❗	0	Tweet
1106606853222531074	@Nuklearia	2019-03-15 22:53:28	Greta, go nuclear! The most effective weapon in the fight against climate change is a nuclear power plant. # FridaysForFuturepic.twitter.com/pXaNeaW7At	0	Tweet
1106605233340203009	@h2opower_	2019-03-15 22:47:02	If a solution to climate change is what you want know that these technologies are real and could have solved this problem many years ago if they got public support: https://www.youtube.com/watch?v=Z5afwEcZ3Ok&t=2s …	0	Tweet
1106602132126359552	@mh987654320	2019-03-15 22:34:42	When I was young the climate alarmists predicted Armageddon in 10 years. 30 years later nothing. It’s a myth. Humans’ impact on climate is negligible. Climate change is real but it is natural. It happened before humans were around. We can’t change it.	0	Tweet
1106591585041596417	@FBPrimary	2019-03-15 21:52:48	@ GretaThunberg @ BBCNewsround On 15th March, me and all of year 3 protested because of climate change. We held up posters that we've made. I like Greta Thunberg :) FA - 3Owls # FridaysForFuture	1	Tweet
1106591179716603910	@FBPrimary	2019-03-15 21:51:11	@ GretaThunberg @ BBCNewsround Year 3 protested about climate change. Greta, you set a good example. We protested about the climate crisis. RI - 3Owls	1	Tweet
1106590656330428416	@FBPrimary	2019-03-15 21:49:06	@ GretaThunberg @ BBCNewsround On 15th March, 3Owls had a protest. They wanted to show how much they care about climate change. We were chanting even with others. YM-3Owls	1	Tweet
1106589397896622081	@RORYMELDRUM	2019-03-15 21:44:06	Congratulations Greta! From Rory and Rosie! @ RosieHW There is still HOPE we can reverse the effects of Climate Change but your inspiration around the world is the catalyst that was needed to speed things up! 100% Renewable Energy WORLDWIDE---And FAST! Plus ELECTRIC CARS! @ afneil	0	Tweet
1106589236633964544	@ChristianSchme9	2019-03-15 21:43:28	More than 23.000 scientists in Germany, Austria and Switzerland already signed a # scientistsforfuture petition to urgently act against climate change and for a better future!	0	Tweet
1106586158031663104	@Cruellaisdevine	2019-03-15 21:31:14	I'm callingl & write my reps to support HR1 (Strengthen our Democracy).... to fight Big Money/Dark $$. If they control elections, campaigns/Reps & our judges...we will never be able to address climate change effectively. Act!. https://indivisible.org/resource/hold-your-republican-representative-accountable-hr1-vote … # HR1	0	Tweet
1106585744766836736	@Dejusticia_en	2019-03-15 21:29:35	@ GretaThunberg Here’s a message for all the youth striking all around the world from the Colombian kids that sued their government to protect them from climate change and WON!! https://twitter.com/dejusticia_en/status/1106581725910654976?s=21 … # fridaysforfuture # climatestrike	1	Retweet
1106577950894424064	@waymac_007	2019-03-15 20:58:37	For Trump who doesn't get it:Common sense should tell us we are causing climate change. For every action there is a reaction. We must ask: what happens when we put 38,000,000,000 tons of CO2 in the atmosphere yearly?Nothing, a positive,or a negative reaction? Isn't it obvious.	1	Tweet
1106577473746190337	@Ralfklein1201	2019-03-15 20:56:43	@ GretaThunberg Today, I would like to invite you to follow this great Colombian leader who is fighting for climate change and social equality is the gustavo petro.	0	Tweet
1106575005880598528	@NineAttributes	2019-03-15 20:46:55	Not one of these students will give up their cell phone for climate change. Not one will hand plow a field for the food they eat. All Sheep.	0	Tweet
1106571931363495940	@GiulioTerzi	2019-03-15 20:34:42	@ GretaThunberg The disarming case to act right now on climate change https://youtu.be/H2QxFM9y0tY di @ YouTube @ GlobalCRL @ fleinaudi	0	Tweet
1106567653718716416	@sabinacolome	2019-03-15 20:17:42	@ GretaThunberg is the Katniss Everdeen of the climate change: the spark that ignited the flame # environmentgamespic.twitter.com/RGAszkqhRI	0	Tweet
1106557528392065024	@jessleas	2019-03-15 19:37:28	I’m with you in spirit! But today I also have to work on a big proposal to help communities adapt for climate change. It is an unfortunate reality. Hopefully people will listen to you!	0	Tweet
1106550384720384000	@dan_psyd	2019-03-15 19:09:05	I'm a psychologist concerned that many people don't talk about climate change because they simply don’t know how to, so I wrote something about how to have a useful conversation about climate change. Here it is. https://medium.com/@danrubinpsyd/how-to-have-a-useful-conversation-about-climate-change-in-11-steps-d4bbd4135e35 …	1	Tweet
1106546876491460614	@sualbalar	2019-03-15 18:55:08	Mi españita! I hope this will continue because Spain is the most endangered country in Europe due to Climate Change, and people here dont give a f***	0	Tweet
1106541761340465152	@its_LDPGaming	2019-03-15 18:34:49	Bruh climate change already got this girl smh pic.twitter.com/FpqeSEg11I	0	Tweet
1106541414710738947	@sandbandit10	2019-03-15 18:33:26	Just curious, are you and the other students who support this cause planning on having children? Overpopulation is the main cause of climate change. "You can't keep putting people in a closed room and not expect the temperature to rise". At today's rate we are adding 80 million.	0	Tweet
1106540131794722819	@TishJennings	2019-03-15 18:28:20	@ GretaThunberg Kudos to you and @ AlexandriaV2005 taking the lead on climate change. Thank you!! # schoolstrike4climate # FridaysForFurture # climatestrike # WhateverItTakeshttps://twitter.com/GretaThunberg/status/1106439309605986305 …	0	Retweet
1106539132497641472	@theoceanlawyers	2019-03-15 18:24:22	I would have thought that given the Pope’s encyclical on climate change, Catholic schools would have gladly participated in this. Extremely disappointing that they aren’t. @ Pontifex # palmbeachcounty # westpalmbeach # wpb	0	Tweet
1106530626662998018	@ITestini	2019-03-15 17:50:34	I think that 10000 people dress, pile, jacket, jeans and caps are made in China, Bangladesh, India and it’s not the best for the climate change 🤔	0	Tweet
1106526399962271747	@david_runions	2019-03-15 17:33:46	So who organized and funded this? Nothing wrong with a climate change protest but these kids are pawns!	0	Tweet
1106519192671580161	@EnergyThinking	2019-03-15 17:05:08	If you want some useful climate change metrics I have collated a full list, it may help. I will update it each year, to show clearly where we are heading. https://www.confusedaboutenergy.co.uk/index.php/global-warming-metrics …pic.twitter.com/DlzNe9vtmM	0	Tweet
1106515505781854208	@Pablo51656989	2019-03-15 16:50:29	A dissident voice about climate change https://soundcloud.com/breitbart/breitbart-news-tonight-patrick-moore-march-6-2019 …	0	Tweet
1106508774897012737	@ChrisBalchin4	2019-03-15 16:23:44	How about going to school to learn and protest over the weekend? But of course you'd have far fewer children marching and fewer headlines. Why not take on the Indian and Chinese embassies? That's where there is no inclination to do anything about "climate change."	0	Tweet
1106506039405494272	@GuyDavies94	2019-03-15 16:12:52	@ GretaThunberg Hi Greta, I'm a journalist from @ ABC. I'm writing about the climate change protests today. Would you like to answer a couple of brief questions? Email me at Guy.X.Davies.-ND@disney.com	0	Tweet
1106496748598505472	@Tramch	2019-03-15 15:35:57	@ GretaThunberg full speech at # UN Climate Change # COP24 Conference https://www.youtube.com/watch?v=VFkQSGyeCWg … # Fridaysforfuture # Klimastreik # YouthStrike4Climate	0	Tweet
1106495945745854466	@abbhatti245	2019-03-15 15:32:45	South Asia region is suffering from Climate Change ,Melting of Himalayan Glaciers cause flooding and Pakistan also observing change in rain patterns.	0	Tweet
1106495744284991488	@Alex4Macedonia	2019-03-15 15:31:57	Dear Greta I admire your wil to fight pollution and climate change and I fully support it. However I do not agree that school strike will solve this global problem We all need you,our kids to study even more and make this planet better place, with higher values and less pollution	0	Tweet
1106495224531042304	@abbhatti245	2019-03-15 15:29:53	Hi @ GretaThunberg i am @ abbhatti245 from Pakistan, Climate Change is hitting Pakistan badly ,I protested with my university classmates in NED @ ned_academy ,making common Pakistani aware of this global issue.	0	Tweet
1106492490197229568	@ThomasONeill82	2019-03-15 15:19:01	Good luck today. We need to take control back from those who are deliberately preventing action on climate change. This movement could be key!	1	Tweet
1106489290203250693	@JeremyMathieu	2019-03-15 15:06:19	Not striking but going to work as usual, teaching journalists and TV execs about climate change so they can bring a more appropriate story to our screens..	3	Tweet
1106487218598825984	@abbhatti245	2019-03-15 14:58:05	Pakistan the 7th most vulnerable to climate change	0	Tweet
1106483286866432001	@timpoliti	2019-03-15 14:42:27	I’m glad to see you’re smiling. You have inspired a worldwide movement, so you should be proud. There is no victory yet, but the voice of the generation that will suffer the most from climate change is being heard loud and clear. # ClimateStrike # SchoolsStrike4Climate	0	Tweet
1106482064717697024	@RoyTroy9j77	2019-03-15 14:37:36	Awesome work Greta. It’s a shame our Government here in the UK is so incredibly backwards when it comes to protecting the environment & delivering on climate change targets. We mustn’t condemn young people for standing up to this madness. Thank you 💕❤️🙏🏽	1	Tweet
1106475184310140929	@Troanand23	2019-03-15 14:10:15	@ GretaThunberg hi !!! thank you for awakening the world on climate change. Do read my blog. https://mydisasterhelp.blogspot.com/2019/03/climate-change-will-earths-resources-be.html … YOu may get more info on how the world is getting affected by climate change.	0	Tweet
1106465255729827840	@GiovannaGrossi1	2019-03-15 13:30:48	Amazing @ GretaThunberg we would be honoured to welcome you at http://www.unibs.it to talk to our students. I am teaching Climate Change Adaptation and Mitigation and looking forward to meeting you.	0	Tweet
1106457028376100864	@toriastweets	2019-03-15 12:58:07	No longer just about acknowledging climate change we need real plans for change as it happens # SevereStorms # Flooding # townplanning . We deserve a certain future for the next generation	0	Tweet
1106456864559194112	@barjhall	2019-03-15 12:57:28	Dear Greta: I am in awe of what you are doing to promote a serious approach to climate change! Too many people in my country and of my generation do not understand how their actions have harmed the planet young people will inherit. Doing what I can to wake them up! Best, Barbara	1	Tweet
1106454273284464641	@WILLISSydney	2019-03-15 12:47:10	I am in support of tomorrow’s generation. Climate Change is one thing we have to fix. See my Facebook page “ Future for Humankind.” pic.twitter.com/6jkZitHZGq	0	Tweet
1106454070846324736	@dogoscar	2019-03-15 12:46:22	Fantastic work by you unfortunately what should have been a great day for climate change in NZ has tragically been overshadowed by racism and extremism. I hope for you the rest of the schoolchildren of the world stand up and let the world know their climate concerns today.	0	Tweet
1106450682498957313	@OnlyMeWaffling	2019-03-15 12:32:54	And what's the betting, here in the UK, the news will STILL talk about Brexit! If we don;t get a grip on Climate Change - it won't really matter whether we're in the EU or not!	0	Tweet
1106450417960042498	@italia_autismo	2019-03-15 12:31:51	@ GretaThunberg Greta Thunberg, schoolgirl climate change warrior: ‘Some people can let things go. I can’t’ https://www.theguardian.com/world/2019/mar/11/greta-thunberg-schoolgirl-climate-change-warrior-some-people-can-let-things-go-i-cant?CMP=share_btn_tw …	2	Tweet
1106439163874668546	@BaxterPeterba	2019-03-15 11:47:07	Go Greta! You have started a truly great movement. Together you will get movement on climate change back on track.	0	Tweet
1106435150328414209	@Piyushkumargar5	2019-03-15 11:31:11	India too much pollution . I live in delhi, here pollution rate very high I not see any politician and any one talk or serious about climate change. Can you also add India in ur list . I think after that some thing possible here . U are doing very very nice and I salute ur work	0	Tweet
1106434885110153216	@PlasticBank	2019-03-15 11:30:07	@ GretaThunberg has challenged world leaders not to waste time pondering about climate change....they must act now! Awesome to see how 1 voice can resonate & activate! Hard to ignore thousands of students standing for change today. # fridaysforfuture # schoolstrike4climatepic.twitter.com/D6YNxrDZQQ	2	Tweet
1106424634323304449	@MyOzFeed	2019-03-15 10:49:23	Wonderful work you are doing Greta highlighting the need to address climate change, but today NZ experienced one of the most horrific terrorist attacks in their history. You may want to post condolences for a nation in shock & in mourning. 🙏🏼🌏❤️	0	Tweet
1106419151013187585	@ingrid4parks	2019-03-15 10:27:36	# Perth supports the global call for action to address climate change # ClimateStrike remember 1.5C and underpic.twitter.com/VXnKopvSdn	0	Tweet
1106416656895610880	@danieltbar	2019-03-15 10:17:41	@ GretaThunberg represents the beginning of an era, rise of the environmental & spiritual conscious generation. 100% support youth in the protest against climate change, i encourage to increase it for more than one day per week. THE WORLD IS AT STAKE!! 🌏🔥😰 👧🏻🧒🏼👧🏿 ⏩🌈💜	0	Tweet
1106409603816779776	@vdharme254	2019-03-15 09:49:40	Please tell that 72 year man,climate change is real thing.	0	Tweet
1106407985025212416	@crunchysid	2019-03-15 09:43:14	@ GretaThunberg @ NaomiAKlein @ mehdirhasan Perth students taking on climate change pic.twitter.com/PLOTjKGqNd	0	Tweet
1106384756328026117	@eightisenuf4us	2019-03-15 08:10:56	Climate change is real. Climate is measured over a 20 year period and has been changing for approximately 4.5 billion years. Humans and the usage of dinosaur fuels have a fraction of the effect the planet itself does. Don’t be a fool, stay in school! Mr. T	0	Tweet
1106367914008035328	@ReeCee22	2019-03-15 07:04:00	You’re being used as a political pawn in this Doomsday Climate Cult religion. Founder of The Weather Channel interviewed on CNN disagrees w climate change hysteria. Politicians confiscating $93 Trillion (more $ than exists) will not change weather/planets https://youtu.be/Lk8SSqc7ekM	0	Tweet
1106365513670656000	@r0ger0driguez	2019-03-15 06:54:28	this is child abuse by her parents, there is no global warming global cooling climate change, it's a hoax just like Russian collusion, it's very simple we only have summer fall winter and spring, wake up papitos amigos snowflakes copitos de nieve...	0	Tweet
1106355741085130752	@Bymst2Bymst	2019-03-15 06:15:38	Campaign continue s when power is resto in my android I have been on PowrrSaversince!Congrats Greta on your most timely strike on Climate change Act	0	Tweet
