Tweet id	Poster username	Tweet post Date	Tweet text	Number of retweets	Tweet type
1128878693311483905	@ganesh_bora	2019-05-16 09:53:48	@ GretaThunberg when # Pune wake up for climate change # climatechange # ClimateActionNow @ thebetterindia	0	Tweet
1128837079247540225	@_cowboy_club	2019-05-16 07:08:27	Hi Greta, I was wondering if you were able to do an interview for a small documentary about climate change that I am creating. Please let me know, thanks!	0	Tweet
1128752203399872513	@GiuvaSkin	2019-05-16 01:31:11	Don't become a tool for capitalist interests: make the people of the world strike against capitalism which is the main reason of the climate change...	0	Tweet
1128642186592100353	@Wamba_I	2019-05-15 18:14:01	You are not doing any good with this, bring politics and put something lime climate change at the politicians service to attack a country, is irresponsible from you and your sponsors, and shows the political agenda behind your campaign...Really big mistake	0	Tweet
1128640267190513666	@BirdingN	2019-05-15 18:06:23	Here's what you're all up against Greta, 3 birdwatchers at Cley watching a Temminck's stint, all driving diesel 4X4's, know all about climate change and, don't really care, as all fairly new cars - not really doing their bit! # everylittlehelpspic.twitter.com/w0ampwyJJ0	0	Tweet
1128635520236556288	@Tschoubie	2019-05-15 17:47:31	@ GretaThunberg @ AmbassadeurSE to think to settle down with the question, what climate change would be, what that one is calling, and what does it all mean??ß it's a song by amish paradise (Quelle: Weird Al Yankovic) to invite people singing songs, like me and you. or other ones?	0	Tweet
1128630553069142016	@ClmenceGeyssen1	2019-05-15 17:27:47	@ GretaThunberg I am in international section of english, I am from France and my name is Clemence. During this period, we are studying climate change and... you!!! ( Grata Thunberg)	0	Tweet
1128579405574549505	@rogerahicks	2019-05-15 14:04:32	@ GretaThunberg If we are to solve the existential problem of climate change, we much understand it in a very much wider context, which I have been working on for decades: https://twitter.com/rogerahicks/status/1128568427877150721 …	0	Retweet
1128563215963697153	@s38lemen	2019-05-15 13:00:13	Are we living the worst climate state since 8 millions years ago ? This is wrong, 75 000 years ago, human kind faced the worst climate change you would never live, it was the Toba eruption than created a dark sky for about 10 years all over the world. https://en.wikipedia.org/wiki/Toba_catastrophe_theory …	0	Tweet
1128497428594819072	@Acme_MindReader	2019-05-15 08:38:48	@ What EXACTLY do you know about Climate Change, Anything...!?!	0	Tweet
1128463592225951744	@LuisBV24	2019-05-15 06:24:20	Please... Can you mention the Mexican government? Here we need the information and the desire that you have to do something to fight climate change @ SENER_mx @ lopezobrador_ @ M_OlgaSCordero	1	Tweet
1128449645913440258	@DanielA45401154	2019-05-15 05:28:55	Trump should really listen to this 16-year old swedish girl Greta Thunberg don’t you think @ sjneedsanap Every friday for över a year she has striked from school because she thinks that the world leaders doesn’t take the climate change serious enough.	1	Tweet
1128437957092937728	@M_BrokenLeg	2019-05-15 04:42:28	It was not as you can understand “Emergency” maybe, but a great collection of measures against climate change. A big step in the good direction. Way ahead of Spain though! Greetings from # Catalonia Greta!	0	Tweet
1128434845577822209	@Dornenkrone3	2019-05-15 04:30:07	God is looking for field staff with network experience. Thorough training and instruction in the matter takes place. Why are you afraid of the future? Why are you afraid of climate change? Take it, it comes from me! God has all the time in the world to teach you everything. pic.twitter.com/TTCzaOG2AG	0	Tweet
1128427946115575808	@CarloG60	2019-05-15 04:02:42	Sad to see children exploited in the climate change scam.	0	Tweet
1128413896648331264	@DL4GO	2019-05-15 03:06:52	First give us some evidence for human made climate change # GoToSchool # Climategate	0	Tweet
1128404154865602560	@Titova10354472	2019-05-15 02:28:09	Catalonia is 100% commited againts climate change! Keep fighting Greta! ❤️	0	Tweet
1128402618273992705	@JordiBou23	2019-05-15 02:22:03	Nice but useless ... as Spanish Govt. banned a few months ago the Climate Change Law that @ parlamentcat has approved. So, we are unable to move forward and put on all effects this law awards because there are many spanish politicians that they don't allow Catalonia to be itself.	5	Tweet
1128390377390657537	@Blackbriar1970	2019-05-15 01:33:25	Russia's policy is that climate change, global warming is great, they can get to resources in areas normally frozen, like the US government, they are more concerned with profits than life on this planet.	0	Tweet
1128362584149823492	@GKursawe	2019-05-14 23:42:58	Carbon dioxide hits a level not seen for 3 million years. Here's what that means for climate change — and humanity. https://www.nbcnews.com/mach/science/carbon-dioxide-hits-level-not-seen-3-million-years-here-ncna1005231 … via @ NBCNewsMACH	1	Tweet
1128359882401427458	@jc_ovando	2019-05-14 23:32:14	@ GretaThunberg please come to Mexico!! We need your support so we can pressure our government to do something about air pollution, strategies to strike climate change, wildfires, government projects that will affect our environment. You can help us on making a change!!	0	Tweet
1128353591427764232	@StephenOld	2019-05-14 23:07:14	I said the same thing at local church meeting last night and was told that "world began through climate change and there has always been climate change." 🤦‍♂️	0	Tweet
1128347618478886914	@phoelscher1	2019-05-14 22:43:30	Russian government has been complicit in spreading climate change denial theories for years now.. anything to disrupt Western democracies.	1	Tweet
1128281563857334272	@Salojoelina	2019-05-14 18:21:01	@ GretaThunberg, I just saw your ted talk on climate change. I love your passion about the issue and I admire your ability to act on it. I have been interested in climate change since fourth grade but I never really get around to helping out. I’ve done some things but I still feel	0	Tweet
1128257662184038406	@AnnaQuarendon	2019-05-14 16:46:03	A boy phoned a friend in Endellion “Let’s join the Extinction Rebellion - Before things get worse We could try to reverse The effects of this climate change hell, Ian.” # Quangleverse # extinctinrebellion # climatechange	0	Tweet
1128167324920438784	@SheThePeople	2019-05-14 10:47:05	@ GretaThunberg Message To PM Modi: Climate Change Serious, Act Now # sheteenshttps://www.shethepeople.tv/news/greta-thunberg-talks-climate-change …	0	Tweet
1128113451119726594	@rocky_12479	2019-05-14 07:13:00	@ GretaThunberg y dnt u ask @ realDonaldTrump to help in climate change y r u blaming @ narendramodi and asking to act on it. V Indian love's nature more than anyone else in the world. India has planted most tree in 2018.u shud check ur stats first b4 saying a word	0	Tweet
1128102627999350786	@DeccanHerald	2019-05-14 06:30:00	@ GretaThunberg, the global teen icon who became famous after her school strike against climate change in # Sweden, asks Indian PM @ narendramodi to act to curb the crisis. # replughttps://www.deccanherald.com/science-and-environment/teenage-activist-asks-modi-to-tackle-climate-change-733638.html …	0	Tweet
1128035795208564736	@ChrisMac1270	2019-05-14 02:04:26	@ GretaThunberg Hello Greta. This is the ad our opposition Australian Labor Party is running for Saturday’s National Election, campaigning for action on climate change. Your work mobilised our young people to make this the number 1 issue in Saturday’s election. Thank you! https://twitter.com/AustralianLabor/status/1127869341045805056 …	0	Retweet
1128022763439046660	@philphun	2019-05-14 01:12:39	@ GretaThunberg Bill Nye had some strong words as he discussed carbon emissions and climate change on @ LastWeekTonight.https://twitter.com/TwitterMoments/status/1127974453206552579 …	0	Retweet
1127981130534146057	@dan_psyd	2019-05-13 22:27:13	I’m a psychologist interested in helping more people become climate change activists. Here are my ideas about 1) how to become an activist, & 2) if you are already active, how to increase your impact. https://medium.com/@danrubinpsyd/everyone-an-activist-25f68fe6d448 …	0	Tweet
1127963531129671680	@mewfan3	2019-05-13 21:17:17	Why not accepting vegan movements into your "agenda" if you really care about climate change # gretathepuppet	0	Tweet
1127946989277024256	@DeccanHerald	2019-05-13 20:11:33	@ GretaThunberg, the global teen icon who became famous after her school strike against climate change in # Sweden, asks Indian PM @ narendramodi to act to curb the crisis. https://www.deccanherald.com/science-and-environment/teenage-activist-asks-modi-to-tackle-climate-change-733638.html …	0	Tweet
1127784706794065920	@PrathyushaCFA18	2019-05-13 09:26:41	@ GretaThunberg a young Climate Change Activist has sent out a message to our current PM @ narendramodi on the obvious. # ClimateCrisis # ClimateStrike https://economictimes.indiatimes.com/news/environment/global-warming/teen-activists-message-to-modi-climate-change-serious-act-now/articleshow/69299643.cms …pic.twitter.com/rqxhFyt2KQ	2	Tweet
1127767086615257088	@ss_aarthi	2019-05-13 08:16:41	@ GretaThunberg I do agree that we need to focus on climate change.But do you know that China and usa are the highest emitter of green house gases.I would appreciate if you turn your focus there first.	0	Tweet
1127698788636942339	@PhilipMGraves	2019-05-13 03:45:17	I've long thought 'climate change' a weak and inadequate term. It gives no indication of cause, type, degree or direction of change. 'Anthropogenic global warming' at least describes the essential phenomenon and attributes it to human activity, but it is of course a crisis too.	0	Tweet
1127698701395419136	@Scotchisyum	2019-05-13 03:44:56	Why does nobody mention China with regards to climate change? Afraid of the elephant in the room???	0	Tweet
1127679312335785985	@ConradKnauer	2019-05-13 02:27:53	This is an important question: https://twitter.com/OskaArcher/status/1127526160131284992 … The more urgent a problem climate change is, the more seriously anti-nuclearism needs to be opposed.	2	Retweet
1127662630557159424	@rogerahicks	2019-05-13 01:21:36	@ GretaThunberg There is a huge obstacle to us dealing with climate change, & other existential threats, in the very nature of the state itself & its academic employees' blindness to it: https://twitter.com/rogerahicks/status/1045233491875713024 …	0	Retweet
1127661487517048832	@Jscott1145	2019-05-13 01:17:04	@ GretaThunberg @ AOC Joe middle ground does not exists said by Greta and AOC. # NoJoe Climate Change is NOW pic.twitter.com/Q9hWWmk88d	2	Tweet
1127654254792073218	@CharlieRobbo789	2019-05-13 00:48:19	Think it's important to understand that although climate change is an important issue to tackle, we can't let the world stand still while we deal with it. Other things must be addressed also.	0	Tweet
1127564241257619457	@joscho1967	2019-05-12 18:50:38	@ GretaThunberg How would do political agendas look like, if we had representative quotation systems of age in parliaments all over the world? Younger citizens, who have to experience the consequences of climate change could much more powerfully influence the political decisions	0	Tweet
1127560344027660288	@RaiMartinsons	2019-05-12 18:35:09	I'm glad we are no longer using the phrase "climate change". The change has already occurred	0	Tweet
1127536677545762821	@BuildTheNursery	2019-05-12 17:01:07	@ GretaThunberg please help us! No one seems to know that our cf&d tariff bill, HR763, is in the House Ways and Means Committee AND they're having a meeting on the effects of climate change on health and the econ	0	Tweet
1127512249545969665	@Edzegthet	2019-05-12 15:24:03	Are you really so arrogant that you think “man” can stop climate change? You can stop an ice age? Man has some influence but it’s marginal. Better focus on real problems like letting a load of idiots into the EU who will never adapt but force their barbaric religion on to us.	0	Tweet
1127447600351916033	@JoRaCaCr	2019-05-12 11:07:09	I am not afraid of the climate change that has always existed, I am afraid of the ignorance and the lies about it spreading and causing people to panic irrationally	0	Tweet
1127445250736312320	@CansfieldJoy	2019-05-12 10:57:49	Yes Greta you are wise beyond your years. You will change the tide of history. You fly where others merely shuffle along blindly. You have lit an inextinguishable spark. I am from the UK & since the protests here the media has not stopped talking about climate change. Onward!	0	Tweet
1127404762029117440	@FredFoxyGuy	2019-05-12 08:16:56	What do ya know...!!!?? It really seems the big end of town does not believe in the climate change hype @ stargrazzer @ luisbaram @ ClimateRealists @ ClimateCatastr1 @ JWSpry @ FireFox_XB9R @ RoyPentland @ GillesnFiopic.twitter.com/DTVaQ7avba	4	Tweet
1127404176005259267	@shannonewells	2019-05-12 08:14:36	Global warming is THE most important issue having humanity. I don't use "climate change" bc that term is for wimps too scared to piss off Republicans	0	Tweet
1127386582548451328	@NVictimology	2019-05-12 07:04:41	Climate change is a billion-dollar industry. How many people would be out of work if man-made climate change we're a hoax? These 22 world-renowned scientists know that it is a hoax. https://youtu.be/oYhCQv5tNsQ The soft intellect of the masses are easily fooled.	0	Tweet
1127326239591628800	@uttley_stephen	2019-05-12 03:04:54	She forgot being there to make sure we work with the EU to tackle climate and ecological breakdown. The leaders of the Brexit campaign contain a large number of climate change deniers	0	Tweet
1127318115468005376	@yginbar	2019-05-12 02:32:37	I'm all for drastic measures to curb climate change but this thinking is dangerous. E.g. should EU let migrants drown in the Mediterranean bc they're not as important as climate change? Issues such as human rights and income inequality mustn't be ignored in the name of emergency.	0	Tweet
1127297669133754369	@MarkBotham2	2019-05-12 01:11:23	Agree and disagree, without a stable elected government the urgent need to address the clamity of climate change will be hard to advance. We cannot afford the arguement to be the fringe, it needs to be in the centre of a stable government.	0	Tweet
1127295045516787712	@CharoAyela	2019-05-12 01:00:57	Here in Spain the climate change affects currently to 32 million people. (There are 47 million). Now,12 per cent of the country looks like a desert.There are terrible droughts or storms and floods. Summer is five weeks longer and hotter than in the 80´ . It´s no joke!	0	Tweet
1127273599583367169	@Gay_Global_News	2019-05-11 23:35:44	Climate change is the single most important issue facing every election.	0	Tweet
1127253974510338050	@chickpea111	2019-05-11 22:17:45	Climate change is being used to scam you. There are pollution problems but CO2 is not it. https://www.cpgb-ml.org/2019/05/04/news/yellow-vests-v-extinction-rebellion/?fbclid=IwAR3pZ539N8qYdupw25TwTcRVxlODOeKg8fvtMazRR7mmG22ZEqBiuflpL-4 …	0	Tweet
1127228362718683141	@Dornenkrone3	2019-05-11 20:35:59	God is looking for field staff with network experience. Thorough training and instruction in the matter takes place. Why are you afraid of the future? Why are you afraid of climate change? Take it, it comes from me! God has all the time in the world to teach you everything. pic.twitter.com/kUqE8GMCTT	0	Tweet
1127224103688126464	@realnatek1	2019-05-11 20:19:03	What a ridiculous statement. You should seek professional help. In fact all climate change people need serious help from mental help professionals.	0	Tweet
1127223854080954368	@jackson93733592	2019-05-11 20:18:04	Climate change is a hoax created by China to reduce U.S. production. Obvious to anyone with a brain	0	Tweet
1127220262720684032	@happyyoungfella	2019-05-11 20:03:48	Begging the question of whether climate change is real, there's absolutely no proof that anything we do now will significantly alter the effects of climate change. It's better to save our resources to mitigate real problems as they occur.	0	Tweet
1127217893110738945	@dan_psyd	2019-05-11 19:54:23	I’m a psychologist interested in helping more people become climate change activists. Here are my ideas about 1) how to become an activist, & 2) if you are already active, how to increase your impact. https://medium.com/@danrubinpsyd/everyone-an-activist-25f68fe6d448 …	1	Tweet
1127206455772422145	@DustinHebecker	2019-05-11 19:08:56	In Germany we @ DieHumanisten are a new political Party hoping to fight climate change with science and reason. pic.twitter.com/sEORuLTlIh	1	Tweet
1127202663756718080	@NIMN2019	2019-05-11 18:53:52	You will never change the world by exhibiting intolerance and contempt. Neither will you change it by orchestrating fear. You change the world by engaging in debate using REASON and EVIDENCE. The science shows that climate change results from multiple naturally occurring factors.	0	Tweet
1127199729794859008	@Cristi_Neagu	2019-05-11 18:42:12	Considering how important climate change is to you, I would expect you to be a huge supporter of nuclear power. Is that correct?	0	Tweet
1127198025569456129	@Halifax_SOS	2019-05-11 18:35:26	The only thing responsible for climate change is the SUN. And to a lesser extent, things like volcanoes.. Man has NOTHING to do with it. YOU HAVE BEEN LIED TO. You say nothing else will matter? The salvation of your soul is what matters. Jesus will be back in less then 10 years	0	Tweet
1127182977107091458	@rkoomans1	2019-05-11 17:35:38	CLIMATE CHANGE: ONLY GOD COULD FIX THAT which Nature from space created and caused a Wobble of the Earth's axis. Only a million NUCLEAR BOMBS could possibly set it straight, but poison all animal and human life on Earth doing it! Ecology can be fixed, not with India and China	0	Tweet
1127181841805467655	@imakisolanki	2019-05-11 17:31:07	Here in India, election is going on and not even a single politician across different parties raises the issue of 'climate change' once.	2	Tweet
1127164521309667329	@lightcraftmine	2019-05-11 16:22:18	Yeah, no. Climate change and ecological break down is important but it’s far from the only issue. Article 13/17 is an extremely important issue to fight because if it’s allowed to stand the future of humanity’s most useful tool in history at risk.	0	Tweet
1127163673083031554	@Drewbles82	2019-05-11 16:18:56	Shame too many idiots in the UK are voting for parties purely for Brexit and all these pro Brexit parties don't even believe in climate change so we're screwed as the far right keep gaining more power	0	Tweet
1127136107869671424	@PeetersErik	2019-05-11 14:29:23	Climate change is a hoax, a farce, a hoot. Worry about 5G, WiFi, nukes instead.	0	Tweet
1127127053885693952	@Justin_DF1	2019-05-11 13:53:25	@ GretaThunberg THIS IS THE MAIN PROBLEM CAUSING CLIMATE CHANGE. https://twitter.com/JustinC_J/status/1126988284138278913 …	0	Retweet
1127085073176649729	@CathOBrian	2019-05-11 11:06:36	Because the crisis encompasses climate change, ecological breakdown, and biodiversity loss, it would be useful to coin a concise term that addresses all dimensions of the looming catastrophe to encourage development of holistic solutions. I suggest the term "biosphere crisis"	0	Tweet
1127066240621502464	@Paudy_mac	2019-05-11 09:51:46	Climate change is no excuse for truancy.	0	Tweet
1127035208539299840	@GeorgP18	2019-05-11 07:48:27	Well said. Climate breakdown. Crisis is too much concerned to economics or politics. And climate change is really belittlement. For me, it's most important topic in world, like atomic war in 60s. Personally, it results in health and financial breakdown for me.	0	Tweet
1126950988567404544	@GeethaPN70	2019-05-11 02:13:48	All the best for your activities against climate change. 💐💐💐💐Be strong and positive.👍	1	Tweet
1126948586011398144	@Abdulaziz_Ada	2019-05-11 02:04:15	@ GretaThunberg You are a gift to this broken world that leaded by politicians who have deliberately ignored or cover their eyes from two things (Climate change & refugees ) this broken world need more young ppl like yourself. Thank you for your courage & inspiration God bless you https://twitter.com/GretaThunberg/status/1126730673950056448 …	5	Retweet
1126897595719323648	@yadaftcunt	2019-05-10 22:41:38	Kids marching about climate change yet they all get a lift to school etc won't walk anywhere lazy shits.Until China n India 3billion people change there habits won't matter what Irish do??	0	Tweet
1126897038438936577	@Keegan1Andrew	2019-05-10 22:39:25	So now the # fg minister and Irish government will stop issuing off shore prospecting licences, fracking plant in Kerry and keep fossil fuel in the ground? Or is this just spin before a local election. # ClimateEmergency # KeepItInTheGround and support climate change bill @ pb4p	5	Tweet
1126856869014851584	@SeifidinR	2019-05-10 19:59:48	@ GretaThunberg Thank you for raising awareness of the important issue of Climate Change. # FridaysForFuturehttps://twitter.com/GretaThunberg/status/1126730673950056448 …	0	Retweet
1126772731976998913	@Duncan_E_Carter	2019-05-10 14:25:28	@ GretaThunberg @ ExtinctionR & David Attenborough are moving public opinion in UK. @ beisgovuk stats: 80% of public are now fairly concerned (45%) or very concerned (35%) about climate change https://assets.publishing.service.gov.uk/government/uploads/system/uploads/attachment_data/file/800429/BEIS_Public_Attitudes_Tracker_-_Wave_29_-_key_findings.pdf …	0	Tweet
1126672639500660737	@kurtbberry	2019-05-10 07:47:44	It's ironic that the reaction from the children who have yet to study enough science and mathematics to either support or refute their climate change hysteria is to sit-out their education.	0	Tweet
1126605243461120000	@theradardude	2019-05-10 03:19:56	Hmm, you know, everyone is saying there's a climate emergency Greta, particularly here in the UK Parliament. If that's true, then why are critical science facilities studying climate change being closed? Case in point and do RT: https://www.gofundme.com/dundee-satellite-receiving-station …	0	Tweet
1126568398266068992	@oxfordsolarpv	2019-05-10 00:53:31	Super stuff but with UK government now trying raise the VAT rate for domestic solar and storage, their actions speak louder than their words on climate change! Shame on them. # ExtinctionRebellion	2	Tweet
1126563578968862721	@morphizm	2019-05-10 00:34:22	Have you moved on from “climate change” as a scientific term @ GretaThunberg? Do you feel the terms “breakdown” and “emergency” which you have used here are more appropriate, even as scientific terms for educational and policy purposes? 🔥🌎🔥	0	Tweet
1126553752830394368	@gboscherini	2019-05-09 23:55:19	Shocking. Will a large EU climate change funding help, Greta?	0	Tweet
1126553327469236226	@FabioORibeiro	2019-05-09 23:53:38	In Brazil, the owner of a dirty big store ( @ havan) is a kind of spokesperson for @ jairbolsonaro. He often says that "environmentalism is a cancer". If EU did not help to overthrow Bolsonaro the European measures against climate change will be useless @ not3bad @ ExtinctionR.	0	Tweet
1126531590195220482	@PbOcean	2019-05-09 22:27:15	Dear Greta, here in the UK we see the sense in the keeping an EU unified effort to fight climate change, the first step being to get MEPs who agree, unfortunately the Labour Party here are not. We need unity, we need the green parties to talk. Will you ask them to unite?	0	Tweet
1126503255159140353	@jlbowyer	2019-05-09 20:34:40	We got here because of all the nonsense about non existent climate change and now your juvenile hysterical nonsense. Persuading vulnerable people to do stupid things like this is a disgrace, you should be ashamed!	0	Tweet
1126502318755782656	@bomac_macbo	2019-05-09 20:30:56	Simple question for climate change alarmists: Would you rather have global warming or global cooling? B/c you can't make it stay the same temperature forever. "Stopping climate change" is the greatest act of futility ever proposed by supposedly intelligent people. # ClimateScam	0	Tweet
1126475284180553729	@poynton_j	2019-05-09 18:43:31	Climate change is the least of people's worries, Greta. See below. This is what happens when you shout at people for too long. They switch off. pic.twitter.com/YZygB1SYJD	0	Tweet
1126475014860156929	@SJJB55	2019-05-09 18:42:27	I think you are suffering ‘last weeks news’ syndrome. How is Mummy’s climate Change book doing? pic.twitter.com/CMznl6o1Y1	0	Tweet
1126464989261385729	@Amy_Johnston__	2019-05-09 18:02:36	@ GretaThunberg this could be the answer! Queen guitarist Brian May wants a Live Aid for climate change https://www.altpress.com/news/queen-brian-may-live-aid/#.XNQdL9UbO1Y.twitter …	2	Tweet
1126441418128527360	@robertjoseph	2019-05-09 16:28:57	@ GretaThunberg asks us to stop saying “climate change” and instead call it what it is: climate breakdown, climate crisis, climate emergency, ecological breakdown, ecological crisis and ecological emergency? # ClimateBreakdown # EcologicalBreakdown Which would you choose?pic.twitter.com/3mpUH10Tlj	0	Tweet
1126439798875406336	@RobMeekel	2019-05-09 16:22:30	greta who is writing your tweets? there is no climate change/emergency/breakdown. money/time/effort spent on AGW scam could/should be used on real environmental protection. Also infrastructure to deal with real (normally occuring) weather events.	0	Tweet
