Tweet id	Poster username	Tweet post Date	Tweet text	Number of retweets	Tweet type
1130974088380293121	@Lifeworxgreen	2019-05-22 04:40:09	Climate change would cost the US around $500bn a year in lost economic output, and risk trillions of dollars damage to infrastructure. # greennewdeal # greennewdealla # greennewdeal🌍✌🏼💚 # greennewdealart # greennewdealcanada # greennewdealsucks # greennewdeal4nyc # greennew2019	0	Tweet
1130969182198272000	@LeadRight20	2019-05-22 04:20:40	@ GretaThunberg Just a question. Why again should countries like the US remain in the Paris Climate Accord when 1) It does nothing to stop climate change and does not even lower global temperatures to stop climate change and 2) wastes money and resources for nothing?	0	Tweet
1130896032416632832	@jatoll15	2019-05-21 23:29:59	@ GretaThunberg I’m glad to see your generation getting serious about Climate Change (CC). Don’t expect Govt. business, or religion to help, it’s not in their interest. Nothing they propose will really accomplish anything. The solution is simple but harsh.	0	Tweet
1130891150200594435	@Bcap54	2019-05-21 23:10:35	Climate change / climate crisis / climate emergency - what we do about it is critical. Nuclear has huge potential to help solve this yet too many discount it without giving it a fair hearing. Either this is an emergency or not?? pic.twitter.com/4Dfqobjxhw	0	Tweet
1130848388604280838	@UDHRforAll	2019-05-21 20:20:40	@ GretaThunberg in case you missed it, new report in top journal indicates that the climate change scenario may be bleaker than previously imagined. Thanks! Ice sheet contributions to future sea-level rise from structured expert judgment | PNAS, May 20 https://www.pnas.org/content/early/2019/05/14/1817205116 …	0	Tweet
1130601518980317185	@lola35271200	2019-05-21 03:59:42	@ GretaThunberg I’m writing an article about climate change and found we have the same bday, jan 3, 03 when I wrote about you. I admire how you’re doing so much, but I feel useless cuz my newspaper advisor doesn’t “believe” in climate change so we’re not publishing it. Any advice?	0	Tweet
1130525791438168065	@RawlinsRoberts2	2019-05-20 22:58:47	YOU GO GIRL......The springs are drying up. When it should raining in some parts of the world ,there is no rain. Due mainly to climate change....The ozone layer is depleting , no one cares.	0	Tweet
1130516870547816449	@alulvangsky	2019-05-20 22:23:20	First of all, and most obvious of all, exploiting children for political gain is per definition amoral. Secondly; I have the utmost respect for climate change - that is the Weather. Thirdly, You should really be at School. https://www.youtube.com/watch?v=MTPNhNZSWFs …	0	Tweet
1130507197106929664	@Wayne28433120	2019-05-20 21:44:54	Excellent! In the U.S. I’m particular which has now disregarded the recommendations for saving our planet, this is a great idea. It infuriates me that Trump is pushing fuels that increase Climate Change and that he makes fun of a very serious issue.	0	Tweet
1130482793748807682	@SimisterJ	2019-05-20 20:07:56	@ GretaThunberg and other climate strikers: as this political leader says, you school pupils are educating adults about climate change. You are brilliant. Thank you for climate striking. Please keep finding more ways to get people to hear what climate scientists warn us about. https://twitter.com/jeremycorbyn/status/1123914544240386048 …	0	Retweet
1130383294091202560	@ThirdOilCrisis	2019-05-20 13:32:33	You used the term global warming, rhen climate change and now you want to abandon again towards climate crisis. It seems that evidence of data corruption, solar cycles and global greening makes you uncomfortable!	0	Tweet
1130346323658661888	@jones0120180	2019-05-20 11:05:39	Couple months back 12 people frozed to death in Chicago under a frigid -70 degrees and people are scared that the arctic is melting because of the climate change? Somebody got these teenagers so messed up in thier head.	0	Tweet
1130212786213138433	@AlessandroDane1	2019-05-20 02:15:01	8) THE MOST COMMUNITY AFFECTED BY CLIMATE CHANGE HAVE NOT BEEN ABLE TO GET NO COMPENSATION OF DAMAGES, SEVERAL PENALTIES INCLUDING THE REVOCATION OF THE CONCESSIONS WOULD BE THE MINIMUM WE CAN DO TO STOP THESE ENVIRONMENTAL CRIMES.	0	Tweet
1130205246154838017	@BeoWulfinho	2019-05-20 01:45:03	What crisis? There is nothing man has done to create an iota of climate change/crisis and there’s nothing man can do to change any natural patterns in weather. To think we have and can is the height of human arrogance.	0	Tweet
1130168646146383872	@RonnyLK3	2019-05-19 23:19:37	Radical and pressing issues such as the climate crisis call for radical and innovative journalism. The Guardian’s choice to change the way they cover climate change is one of many important steps in realizing and conveying the full scope of environmental risk.	0	Tweet
1130158137254797313	@pigreen1	2019-05-19 22:37:51	when will people focus on pollution - the cause of so many aspects of environmental emergency including but not only climate change???	0	Tweet
1130126515025457153	@Villabolo	2019-05-19 20:32:12	@ GretaThunberg This is an interesting website on the subject of climate change: http://globalwarmingbasics.org	0	Tweet
1130082999872163841	@CamEcolivingFes	2019-05-19 17:39:17	🙌🏽 Of course! And where are the countries in which climate change is most felt? Mostly European countries listed/represented. Our planet is bigger and more diverse than this!! CUDOS also to the girl from UGANDA who is making waves across Africa - she’s not given enough attention	0	Tweet
1130077626494869505	@rogernorris42	2019-05-19 17:17:56	Excellent! Be good if @ BBCNews changed their website and App heading from 'Climate Change' to 'Climate Crisis'. One small word, one big attitude change.	0	Tweet
1130030260152676352	@Decolonise	2019-05-19 14:09:43	That do make sense since climate change in itself is not a bad thing and is going on all the time with or without human present.	0	Tweet
1130029187589443584	@ikaneti	2019-05-19 14:05:27	Meanwhile in the US, Fox News has also stopped using the same misleading phrase “climate change,” opting to tone down to “that whole fuss about the weather.”	0	Tweet
1130013252287651841	@MiriamA_turismo	2019-05-19 13:02:08	Algunos medios empiezan a tomar conciencia del valor de las palabras. The @ guardian decide dejar de utilizar la palabra “climate change” para pasar a hablar de “climate crisis”. # CambioClimatico # CrisisClimaticahttps://www.theguardian.com/environment/2019/may/17/why-the-guardian-is-changing-the-language-it-uses-about-the-environment …	1	Tweet
1130009557181374464	@Oren_Medicks	2019-05-19 12:47:27	Could it be that huge, and very cynical financial agendas are behind well meaning, yet naive, people like @ GretaThunberg? Critical thinking is really Critical when applied to issues that "EVERYBODY" seems to agree on, like Climate Change.	0	Tweet
1129997061515108352	@ana_captures	2019-05-19 11:57:48	@ GretaThunberg You are the future. I am sorry for what we are witnessing around the world. Climate Change is important. @ zalisteggall Someone once said to me: ‘under the storm cloud a skylark sings, louder than thunder.’ Please, continue to progress. This is our home 🌍	0	Tweet
1129994303428812801	@IsabelleFCM	2019-05-19 11:46:50	My 14 year old daughter corrected herself and started to use ‘climate crisis’, instead of climate change not because of conversations at home but thanks to awareness raised by you! Thank you!	0	Tweet
1129943440626769920	@art_reinhardt	2019-05-19 08:24:44	@ GretaThunberg is right. Clear thoughts require clear language! " # Guardian stopped using the misleading phrase “climate change” and will as from now call it “climate crisis”. Who will be first to follow? # ClimateCrisis # ClimateBreakdown # ClimateEmergency" https://www.theguardian.com/environment/2019/may/17/why-the-guardian-is-changing-the-language-it-uses-about-the-environment …https://twitter.com/GretaThunberg/status/1129644641014489088 …	0	Retweet
1129934881004380160	@PeterJrgen12	2019-05-19 07:50:43	Physics Nobel Prize winner Dr.Ivar Griaever denouncing the climate change fraud: https://www.youtube.com/watch?v=Dk60CUkf3Kw …	0	Tweet
1129931366228025347	@PeterJrgen12	2019-05-19 07:36:45	Nothing dies faster than a FAKE CRISES! That Guardian article shows polar bears that supposedly suffer from "climate change", but THEIR POPULATION HAS BEEN INCREASING THE WHOLE TIME!!! There is no crises! https://nationalpost.com/news/canada/despite-vanishing-sea-ice-canadas-polar-bears-appear-to-be-hanging-on-in-the-arctic-study-says …	0	Tweet
1129930168427077632	@PeterJrgen12	2019-05-19 07:31:59	Thanks to your completely deranged lobbying, you are finally bringing this climate HOAX to an end by going totally overboard. They first tried the GLOBAL COOLING. When that failed, they tried GLOBAL WARMING. When that failed, it was CLIMATE CHANGE. pic.twitter.com/QJKEBW94Mm	0	Tweet
1129890550407057409	@jamesforpeace	2019-05-19 04:54:34	Hi Greta. Have you spoken out about militarism yet? It’s one of the greatest contributors to climate change/environmental devastation. Please do. https://www.commondreams.org/views/2018/07/31/climate-worst-casualty-war …	5	Tweet
1129883108650754050	@NebrasAnam	2019-05-19 04:24:59	I'm so happy to listen to such good news! This is the 1st step to a confession for climate change's troubles are getting leads to a violent conflict outbreak.	0	Tweet
1129878382290849793	@Blubdha	2019-05-19 04:06:13	@ GretaThunberg Wales' tide bells chime out a climate change warning https://www.dailypost.co.uk/news/local-news/llanw-tide-bells-s4c-cemaes-16294079?utm_source=twitter.com&utm_medium=social&utm_campaign=sharebar …	0	Tweet
1129863202857263110	@inishfad	2019-05-19 03:05:54	Globalism vs populism. Pick a side. The climate change THEORY is globalism to its very core.	0	Tweet
1129862115458723841	@beethgogh	2019-05-19 03:01:34	http://Vox.com : Climate change: 12 excuses for inaction and how to refute them. https://www.vox.com/energy-and-environment/2019/5/17/18626825/alexandria-ocasio-cortez-greta-thunberg-climate-change …	0	Tweet
1129860854684561409	@Cris_Paunescu	2019-05-19 02:56:34	And the imbecility continues. Despicable fear mongering. Global warming didn't work. Climate change didn't work. You're becoming hysterical.	0	Tweet
1129857735493685248	@kineshanko	2019-05-19 02:44:10	Hell yes @ GretaThunberg! By the way, do learn about web 3. It’s key to your mission. I fought climate change in the carbon markets for 6 years before realizing the existing system won’t change fast enough. We need a new money/power system for the people.	0	Tweet
1129850522217803777	@cruicerod	2019-05-19 02:15:30	It seems Australia is not to be counted given it prefers tax cuts to climate change	1	Tweet
1129813697776488451	@Tobalilla	2019-05-18 23:49:11	We, ME pattients, also need your help to fight for # climatestrike Climate change, contamination, xenobiotics, etc are the guilties. Our lives have been hidden 4 decades # millonsmissing # FridaysForFurture # SchoolStrike4Climate # GlobalRecyclingDay # GlobalWarming # globalhealth	0	Tweet
1129800531168321536	@vaato5455	2019-05-18 22:56:51	To see these earth giants of the north feeding on the human footprint that contribute to climate change climate shifts & global warming, pollution & contamination in the name of fossil fuel & plastic products for profit not the future is a shocking catastrophe before our eyes 👀 pic.twitter.com/BZSquiY6Kh	0	Tweet
1129799924038684673	@MaryCummins1	2019-05-18 22:54:27	"Climate change" is just a euphemism for what's happening.	0	Tweet
1129777604603441153	@Maple_Hyperion	2019-05-18 21:25:45	We call it climate change because “global warming” was confusing for Fox News viewers. Now we’re calling it climate crisis? Let’s just call it “stuff.” Stuff is happening, which will lead to more stuff happening. We must do stuff to stop the stuff from happening.	0	Tweet
1129763143712989185	@EinsteinKaleath	2019-05-18 20:28:18	@ GretaThunberg Speak4the Master Creator2resolve all weather crisis's individually not no greennewdeal/generating electricity with solarpanels&insinuating that generating electricity shall solve climate change/world flooding,overheating&remove pollutions from air&breakage in ozone	0	Tweet
1129762486121582593	@nova6k0	2019-05-18 20:25:41	The world has been in crisis for decades, at the moment that a minority of people are allowed to concentrate most of the total generated and generated annual wealth (the problem is that among these people are artists and athletes that we idolize). Climate change is another crisis	0	Tweet
1129761735144017921	@_InThisTogether	2019-05-18 20:22:42	Can you provide just one peer reviewed empirical paper which proves C02 is the primary driver or even a significant contributor to climate change? Not one based upon modeled projection but one based upon real measurable data. If you can great, if not what are you talking about?	1	Tweet
1129759641167159298	@chimneechatter	2019-05-18 20:14:23	# ClimatoCalypse We humans, the ‘best & the brightest’ of creation, are outdoing ourselves in our self serving greed & apathy towards climate change. And we call ourselves EVOLVED?!! Criminal & shocking!	0	Tweet
1129741488374652928	@ilikrmla	2019-05-18 19:02:15	Heyy come and watch this video which explains about climate change ☺️ https://youtu.be/I3hsxxrGPOc	0	Tweet
1129727558256345090	@DarioMorMal	2019-05-18 18:06:53	@ GretaThunberg Hi, Who do you think is the best Swedish party to vote for in the European elections regarding to climate change issues	0	Tweet
1129716427928342529	@griffiths_mm	2019-05-18 17:22:40	All we can do in GB is to improve our environment and seek to persuade other countries to copy good practice. Achieving Climate Change requires a global approach.	0	Tweet
1129715050833432576	@RaVitalSpark	2019-05-18 17:17:11	Excellent , climate change is what happens naturally but we need to address what humankind has done to accelerate the “change” so turning it into a crisis, which WILL, if stringent steps are not taken NOW & by ALL to avert this destruction, annihilate life on Planet Earth.	0	Tweet
1129706877099696128	@twitsterup	2019-05-18 16:44:43	CLIMATE CHANGE Safety Valve~Tesla Towers ~ Antimagnetic at Pole’s Cusp ~send CO2➡️ space 🛰Satellites 🛰 interrupt Earth's magnetic field temporarily~let Sun erode CO2 at Cusp~| http://climatecolab.org/contests/2015/geoengineering-workspace/c/proposal/1331515 … https://www.nasa.gov/feature/goddard/2018/to-image-leaky-atmosphere-nasa-rocket-team-heads-north … http://www.esa.int/Our_Activities/Space_Science/ESA_gives_gohahead_for_Smile_mission_with_Chinahttps:// … https://twitter.com/nasasun/status/1121090130201186307?s=12 …pic.twitter.com/KodeyW8QE8	0	Tweet
1129683526381649920	@JoongWu	2019-05-18 15:11:55	The Rapid Glaciers Melt and Hot Tempereature from Sea By Climate Change! # SaveTheAntartic # AntarticThaw	0	Tweet
1129679704317976576	@Nbb26414033x	2019-05-18 14:56:44	Great News! They've change the name yet again! Ice age, global cooling, acid rain, global warming, climate change now climate crisis!	0	Tweet
1129629465431150592	@PreetiDyan	2019-05-18 11:37:06	SRIKES wont change anything , US needs to understand that if they dont join the climate change will be horrorific	0	Tweet
1129629435043491840	@Brianstandgas	2019-05-18 11:36:59	@ GretaThunberg I love the work you are doing. If we organised a crowd funding site we could build plants to reverse climate change. And lots of fast and really make a difference. Can we talk about how? Not for profit for change	0	Tweet
1129583852857389056	@aurantiacoXI	2019-05-18 08:35:51	Thanks Greta for your tireless work in bringing climate change to the fore. As an Australian I have voted with climate change in my mind. Fingers crossed we elect a government who puts this urgent issue first!	0	Tweet
1129559916715413504	@hugosac	2019-05-18 07:00:45	The same year you were born I was presenting my initiative for environmental awareness in my country. It didn't have a lot of eco. But despite personal actions, you get me back on the track to ask Governments and Sociaties to stop practices that lead to Climate Change!!	0	Tweet
1129428552422645766	@ilikrmla	2019-05-17 22:18:45	Heyy you should watch this climate change video ☺️ https://youtu.be/I3hsxxrGPOc	0	Tweet
1129426580009148416	@alt_control	2019-05-17 22:10:55	Thank you for your untiring activism that has increased the sense of urgency of climate change action. You've helped more than most would realise to make climate change an important issue in our current election. I hope tomorrow delivers the result we need & the ecosystem needs🤞	1	Tweet
1129424198630297602	@JoongWu	2019-05-17 22:01:27	The Inesorable Decline of Antartic Phole and your Glaciers by Climate Change and Ocean Temperature! # SaveTheArtartic	0	Tweet
1129392082093658112	@JustBreathe2019	2019-05-17 19:53:50	Climate change hoax	0	Tweet
1129375962301444096	@LauraLeeRichey1	2019-05-17 18:49:46	Greta, you do not speak for me and others who know global warming/climate change is a lie. The Sun controls and commands our climate. The Sun is moving through its normal 11year cycle. It affect our climate, our weather, and our atmosphere. Knowledge is power.	1	Tweet
1129368861046915073	@MatteoMedia	2019-05-17 18:21:33	Thank you for leading the call for climate change awareness. I hope you know, not all adults are weak and shills for the donor class like @ realDonaldTrump @ senatemajldr @ GOP who lie and pretend there isn't a problem because they are doing the bidding of their fossil fuel donors.	0	Tweet
1129348055868874752	@helmuqz	2019-05-17 16:58:53	Awesome! You r one of the reasons climate change is such a big theme in the EU elections as well, as it should be. Just voted today and dare all the people allowed to do so, and think about what's rly important. Love from Finland!	0	Tweet
1129347423812423683	@NeilCrompton4	2019-05-17 16:56:22	@ GretaThunberg You are doing an amazing job of bringing climate change to the masses. Thank you x	0	Tweet
1129344973126553600	@13Papaji	2019-05-17 16:46:38	I dont know what have you done But if something related to good effort for climate change Then you rock	0	Tweet
1129289385432748033	@AdityaSahadevan	2019-05-17 13:05:45	I think it's time for India to declare # ClimateEmergency (to curb the emissions, to create climate change awareness & to combat it collectively with other nations). # ClimateChangebills must find the top priority in election agendas.	0	Tweet
1129273509363027970	@JohnAggelakos	2019-05-17 12:02:40	🤣... You country is screwed anyway. The hedonism promited by the EU combined with the flooding of your society with refugees will get you long before climate change.	0	Tweet
1129250310470262785	@daeley1967	2019-05-17 10:30:29	@ GretaThunberg Here is what we are trying to do in the USA for climate change :) https://www.newsweek.com/watch-alexandria-ocasio-cortez-bernie-sanders-live-stream-1424445 …	0	Tweet
1129158928313532416	@the230i	2019-05-17 04:27:21	They need to hear you in GUELPH ONTARIO THE MAYOR IS PUSHUNG FOR SPRAWL AND HAS RE PAVED OVER WETLANDS ON NISKA ROAD AND WILL CONTINUE!!! WE NEED YOUR VOICE IN GUELPH they are denying climate change!!!	0	Tweet
1129148709516795904	@sinisissi1	2019-05-17 03:46:45	Thank you for sharing, can you help me to answer this question: Do you have any ideas to accomplish climate change?	0	Tweet
1129138807029133312	@SalesyNewy	2019-05-17 03:07:24	This young lady gives me so much hope for the future, even at a time when Australians remain bitterly divided over climate change action, due to the ineptness and ignorance of many right-wing politicians and their cheerleading sycophants in the media.	0	Tweet
1129116953652543488	@SamuelJohnPras1	2019-05-17 01:40:34	congratulations...climate change is alarming issue, Ihave never seen anyone fighting for it before..stay strong	0	Tweet
1129108816895913984	@CPOM_news	2019-05-17 01:08:14	Thank you @ GretaThunberg for speaking out about climate change. Your voice has been heard, and you are welcome @ UniversityLeeds any time to learn about how we observe ice loss using @ esa # satellites!pic.twitter.com/2emeoVRJG2	7	Tweet
1129107851123810305	@chirpingbirds3	2019-05-17 01:04:24	@ GretaThunberg Very important. Plastic contributes to climate change. https://www.theguardian.com/environment/2019/may/15/single-use-plastics-a-serious-climate-change-hazard-study-warns?fbclid=IwAR3JZ0-JEZkP9TbjLffuubKlnMMF8LApupvevHwUZt682lnRntpidedgxXM …	0	Tweet
1129100686191398912	@chirpingbirds3	2019-05-17 00:35:55	@ GretaThunberg Please read Greta. It is very important to climate change. https://www.ciel.org/reports/plastic-health-the-hidden-costs-of-a-plastic-planet-may-2019/ …	0	Tweet
1129097772441972737	@jasonpaisley	2019-05-17 00:24:21	@ GretaThunberg I say we call Climate Change. Climageddon!	0	Tweet
1129077416431775744	@DraperGaper	2019-05-16 23:03:27	Thank You Greta, for doing more than literally every international leader alive on climate change education and advocacy. You are an inspiration!	4	Tweet
1129065556357914627	@ndefinelicht	2019-05-16 22:16:20	@ GretaThunberg - now be careful they don't suck you up! The powers behind Time Magazine are interweaved with the powers causing climate change, and they all want to silence you. They know they can't just kill you so they try to smear you. Please be careful!	0	Tweet
1129063197141622784	@NELALA1	2019-05-16 22:06:57	@ GretaThunberg we’d like to show you our Daina-Isard School's solidarity book that raises awareness on the effects of climate change pic.twitter.com/9vAiwVaBuM	0	Tweet
1129049942155251714	@joel_horton5	2019-05-16 21:14:17	You do know that every 10 years for the last 30,years the Climate Change folks have said in 10 years the sky will fall. I am still waiting. You are smart , talented, but young and naive. College professors are all liberals. Ask a liberal to support something to be green= yes. pic.twitter.com/S9mVl4BlJr	0	Tweet
1129048230346539008	@DOckerby1	2019-05-16 21:07:29	The cover of TIME magazine is an honour usually reserved for people who have had an effect on the world, Greta Thunberg, you are one such person, an inspiration to not just your own generation, but to people like myself who are awed by your heroic campaign for climate change.	1	Tweet
1129045337027620864	@ShaunaChapmanUK	2019-05-16 20:55:59	I’m glad you chose to style yourself in your iconic pigtails. Totally support you and your action inspires us all to focus on climate change 🌱🌎🐝🦍	1	Tweet
1129037460862844928	@Bitcoinpalmer	2019-05-16 20:24:41	@ GretaThunberg is a boss. Leading the way to climate change action while grown men play whose got the bigger dick https://twitter.com/Benioff/status/1129022422555009024 …	0	Retweet
1129032832205115394	@foster_lisa_mil	2019-05-16 20:06:18	@ GretaThunberg So thankful for you. For my part I'll write a letter to editor. Keep climate change in front of people until governments act!	0	Tweet
1129031653492502529	@JanetHealth	2019-05-16 20:01:37	It is every single persons responsibility to help reverse climate change. Small things like turning heat down abit or CA up a notch, eating more veg protein but most important demanding government to take strong actions NOW. They work for the people. Make your vote count!	1	Tweet
1129028086564052992	@RORYMELDRUM	2019-05-16 19:47:26	Phenomenal! Not only your inspiration but for a 16year old too! I told my father a 16year old named Greta tweeted me from a bunk on her train! She is changing the world regarding CLIMATE CHANGE! He said "Who!" "How can a 16year old be changing the world regarding CLIMATE CHANGE!"	0	Tweet
1129022516197023744	@Dornenkrone3	2019-05-16 19:25:18	# FridaysForFuture # SchoolStrike4Climate # ClimateStrike I came to tell you: God is dead! Long live God! I am the Alpha + Omega The beginning and the end The last will be the first and the first will be the last Forget dinosaurs climate change this generation is the first and last pic.twitter.com/gIiCfQrn8a	0	Tweet
1128996323787563009	@deidrerbird1	2019-05-16 17:41:13	A national weather person just referred to CLIMATE CHANGE as a contributor to weather changes with reference to rainfall levels. It’s the first time I’ve heard it in this context in the USA. I have to believe that this will push everyone to see the truth. 🌏❤️	0	Tweet
1128989275998040064	@natisilverio1	2019-05-16 17:13:13	Greta, do you think Brazil could be the next? Our Minister of Environment doesn't believe in climate change. He cuted more than 90% resources to climate change sector in his ministry. If you have opportunity, what would you say to our minister that not belive in # climatechange?	0	Tweet
1128961330000596992	@sbogni	2019-05-16 15:22:10	@ GretaThunberg Dear Greta, We are 5th graders and we are working on our PYP exhibition on Climate Change and we would like to contact you. We would be very happy to get talk to you because it will really help our project to improve. Thank you, Nathan, Sofia, Cristina & Olivia.	0	Tweet
1128924849773174784	@R_tradingG6	2019-05-16 12:57:13	the pro-independence Catalan people contributing as much as possible to climate change.... @ thetimes @ DerSPIEGEL @ nytimespic.twitter.com/tSha4qdz3l	0	Tweet
1128924250088329216	@R_tradingG6	2019-05-16 12:54:50	the pro-independence Catalan people contributing as much as possible to climate change.... pic.twitter.com/OCQrgXeltD	0	Tweet
1128923897263472640	@R_tradingG6	2019-05-16 12:53:26	the pro-independence Catalan people contribute as much as possible to climate change pic.twitter.com/l9OATCupu1	0	Tweet
1128893184174481408	@BryanWinsAgain	2019-05-16 10:51:23	States are still fighting against climate change here in the United States, even though our president thinks it’s fake😡	0	Tweet
