Tweet id	Poster username	Tweet post Date	Tweet text	Number of retweets	Tweet type
1125026235309072385	@tusenfem	2019-05-05 18:45:31	no climate change is just fine, thank you	0	Tweet
1125022052359049217	@wellandvalley19	2019-05-05 18:28:53	Climate Change is surely the most appropriate scientifically descriptive term. Climate Crisis is appropriate to describe the potential effects. Both have a value in different contexts.	0	Tweet
1125000479661076480	@SebBuecker	2019-05-05 17:03:10	But do not raise fear among the people. Humans who feel fear cannot always think logically. That is a threat to good measure against climate change.	0	Tweet
1124996792506961920	@NavyBlue10	2019-05-05 16:48:31	Pls Greta - give it a break - the climate has been changing for millions of years so climate change it is....🧐🧐🧐	0	Tweet
1124984713934827521	@JimmyVo37700923	2019-05-05 16:00:31	Climate change is fake Greta its not really happening like they have told you.	0	Tweet
1124979615829770240	@NW3whippet	2019-05-05 15:40:16	You're right. Change is a bit limp. We met some Americans in Costa Rica who called it "so-called" climate change. They had the cheek to correct our tour guide who said that the rainforest has changed radically in the last 10 -15 years as a result of man-made climate influence.	0	Tweet
1124974968511631360	@RaVitalSpark	2019-05-05 15:21:48	Absolutely Greta. Yes, Nature has effected “climate change” in its evolutionary ways but what we’re facing 2day has nothing to do with Nature’s ways. This is OUR doing. So simply cal it Humankind’s destruction of the environment as part of their destruction of the planet.	0	Tweet
1124962851716771840	@Alrekr	2019-05-05 14:33:39	That'll give three terms; the obsolete 'global warming', the present 'climate change' and whatever we go for next (climate collapse perhaps?). I'm afraid all the old professional politicians would be unable to keep up.	0	Tweet
1124962130791489536	@atverm	2019-05-05 14:30:47	Well I can't agree with that. The alternatives you give are the consequences of climate change but they are not the equivalent. Due to human emissions climate will change, it will not break down. If we indeed manage to keep warming below 1.5 degree, crises might be even avoided.	0	Tweet
1124961509103362048	@CropleyPreston	2019-05-05 14:28:19	But, that’s what it is. Climate change. Natural climate change. What you’re referring to is just a governments misconception to creating money making regulations.	0	Tweet
1124960806393847808	@lordylord55	2019-05-05 14:25:31	The climate has always "changed" as long as the planet has been here so im guessing climate change is the correct word to use	0	Tweet
1124959787026874368	@palbergstrom	2019-05-05 14:21:28	No. Climate change is due to natural causes. Ecological crisis yes but that requires full democracy and awareness not a Paris Agreement or a new world order under the rule of "experts" that only can be fascist.	1	Tweet
1124958768926810112	@aindriurm	2019-05-05 14:17:25	You mean the Climate Change that’s been happening for millennia, that Climate Change? # ClimateChange # MotherNatureKnowsBest	1	Tweet
1124954124926242817	@_yolst	2019-05-05 13:58:58	Well "climate change" is much shorter than "climate breakdown, climate crisis, climate emergency, ecological breakdown, ecological crisis and ecological emergency"	0	Tweet
1124951123213811712	@BenoitMantel	2019-05-05 13:47:03	Biodiversity collapse may accelerate quicker than climate change and hit us badly earlier...	0	Tweet
1124949764720812034	@rimanari_	2019-05-05 13:41:39	Climate change is still a scientific topic. Politicians have to act based on scientific findings. But the findings are provided by scientists, and they call it climate change. If the problem in our superficial society really is how we call it, we are doomed anyway.	0	Tweet
1124947388811100160	@Waynehirst6	2019-05-05 13:32:12	Climate change.	0	Tweet
1124946477837500416	@Michael01996367	2019-05-05 13:28:35	I agree. Some people might hear “climate change” and think: warmer winters, sounds like a good thing. Not the way we should be describing an existential threat.	0	Tweet
1124946086139965440	@dlinchenko	2019-05-05 13:27:02	Are you willing to give up on consumerism, drop world economy and greatly reduce quality of your life to resolve this climate change issue?	0	Tweet
1124942469160947713	@Richard56	2019-05-05 13:12:39	Or climate catastrophe. (Dick Cheney and his right wing cronies changed "global warming" to the more benign "climate change.")	0	Tweet
1124938921442410497	@CircusEU	2019-05-05 12:58:33	Except that people have sharted themselves over the same thing you are sharting yourself to since the late 70's. And nothing happens because climate change is something natural and would have occured even without mankind.	0	Tweet
1124934805420822528	@Nynaeve5	2019-05-05 12:42:12	Or how about we stop you being brainwashed. Climate change is natural. Its not caused by us and we cannot change it. You are too young to remember but ever since last century scaremongers have been claiming an enviromental disaster ending life	0	Tweet
1124928811869646848	@KarinKajman	2019-05-05 12:18:23	Climate change has occurred in the past: ”During periods in Europe's history, the climate has been both whimsical and difficult. But also vice versa, unusually warm and favorable”. https://popularhistoria.se/vetenskap/klimatets-roll-i-historien …	0	Tweet
1124925150988767232	@PramodGujral2	2019-05-05 12:03:50	Love this. Climate Change was invented by the Scientist’s to get funding when their global warming theories didn’t work out in practice. ECOLOGICAL BREAKDOWN is exactly what it is. Covers burning /wasting fossil fuels, plastic waste, loss of habitats, extinction of species	0	Tweet
1124919140597358592	@tudaz2	2019-05-05 11:39:57	This is because Climate change has its origin in science and so is a neutral term. Crisis and emergency are true for humans, not scientific terms. Unfortunately, climate can change to be unsuitable for humans (still climate); there will possibly also be ecology without us.	0	Tweet
1124916982397198336	@JaakoRonnie	2019-05-05 11:31:23	Lets say natural climate change?	0	Tweet
1124887315074052096	@Jitende02156287	2019-05-05 09:33:29	Climate change is too moderate it should be climate crisis.	0	Tweet
1124881944758505473	@FrederickSjfred	2019-05-05 09:12:09	Yes, yes, yes, Greta. “Climate change” is a meaningless term. People use it because it stirs no fear.	0	Tweet
1124874548845916160	@Corduroyalism	2019-05-05 08:42:46	Activist scientists weren't able to explain several years of cooling with colder than normal winters and milder summers as "GLOBAL WARMING: so they came up with the weasel words "climate change" to replace "anthropogenic global warming"	0	Tweet
1124872512196751362	@msthorpe43	2019-05-05 08:34:40	In Canada, climate change, climate breakdown, ecological breakdown/crisis does not exist as Canadians wish to continue their happy lives sheltered from reality of the rest of the world! # cdnpoli	0	Tweet
1124866999677485056	@ncdave4life	2019-05-05 08:12:46	Actually, the technical term used by scientists is "climate optimum." Google it. Much of the material on climate change is political science, rather than geophysical science. If you'd like to learn about climate change, here are some trustworthy resources: https://tinyurl.com/learnmore4 pic.twitter.com/F9dcnLvQfu	0	Tweet
1124860393648685056	@bfs465	2019-05-05 07:46:31	How about what I've been long referencing.... Human caused catastrophic # climatechange ...because it is climate change which is human facilitated already with catastrophic consequences which will continue to build far, far more	0	Tweet
1124840133402996737	@suser_rolfe	2019-05-05 06:26:00	Climate Chaos. And we made a huge mistake changing the name from global warming, which everyone understands, to climate change, which sounds slow, not that serious and boring. Who's idea was that anyway? Exxons?	0	Tweet
1124838174654652417	@EagleWing369	2019-05-05 06:18:13	Oh no. You are stuck with fake # agw you dont get to change it and pretend you're right. Climate change has always been real and is a constant cyclical natural process. That is not the fake crap the left is holding.	0	Tweet
1124835737948622853	@FredSmith517	2019-05-05 06:08:33	Ah, Greta, you will be so embarrassed when you grow up and find out how much you’ve been hoodwinked. Climate change is natural. Every human generation before us adapted to it, and so will yours. This tweet will age well.	0	Tweet
1124835538010279936	@tweet_mehole	2019-05-05 06:07:45	Shut up kid, you're being used for a global marxist agenda. Climate change is not man made it's a natural phenomenon, it's why your handlers never prime you on solar maximer/minimer, solar flares & space ice.	0	Tweet
1124834943819870208	@DjRaison	2019-05-05 06:05:23	Climate change sounds like Mother Earth is going though the menopause	0	Tweet
1124833133214556160	@GautierBenz	2019-05-05 05:58:12	Actually climate change was use instead of global warming to minimize the impact... You're a absolutely right we should change it again to something more appropriate	0	Tweet
1124824612523708416	@NorseValkyrie29	2019-05-05 05:24:20	Fake news, doesn’t matter what you call it, global warming was disproved so now it’s climate change. It’s fake, merely a tax raising measure. And your a prop for the fakes!	0	Tweet
1124810929311449088	@skalamackenzie	2019-05-05 04:29:58	Global warming: that term was ditched for the more neutral innocuous sounding 'climate change'.	0	Tweet
1124807323644583938	@rover223	2019-05-05 04:15:38	@ GretaThunberg Ontario's Green Party has created stickers that gas stations can choose to have at the pumps to show Ontario the true cost of pollution. Climate change costs for Canada could reach as high as $91 billion per year by 2050 if no action is taken to reduce emissions! pic.twitter.com/QwZ7UsWVLN	0	Tweet
1124807081796808705	@whywouldyou_uk	2019-05-05 04:14:40	the biggest influencer of climate change is a yellow blob in the sky above. what are you going to do about it?	0	Tweet
1124804377133215744	@northcyde	2019-05-05 04:03:56	I believe in climate change, but what makes it a "Climate Crisis"? To me, "Climate Crisis" means that a drastic change in the climate is imminent . . like in a few months to a year. Climate Change means that it will slowly change over time, but can be stalled or reversed.	0	Tweet
1124798229776703488	@craighind	2019-05-05 03:39:30	You’re absolutely right. Although I’m still trying to correct people that “Global Warming” is an old term and that “Climate Change” is more encompassing. One guy told me that “they” changed from GW to CC because they admitted that they can’t prove the warming “theory”. Sigh. 😡	0	Tweet
1124791063212888065	@FiendishPenguin	2019-05-05 03:11:01	I support you and think you do amazing work, however here I’ll disagree. It’s called Climate Change because that’s what it is. It’s man accelerated climate change. Sure it will cause an ecological collapse but giving it a name like that will just make more ignore it sadly...	0	Tweet
1124789037519126528	@ProudlyCanadia4	2019-05-05 03:02:58	Yes, neither climate warning or climate change create a sense of urgency. You are 100% correct!	0	Tweet
1124787622646296578	@Laura78703	2019-05-05 02:57:21	Uh oh. Guilty. I'm old. I just got used to climate change instead of global warming. Okay. You're right! It is a crisis, an emergency. We must act now! We've already wasted 50 years of inaction or ineffective action. No time to waste. EEE, Extinction Event Emergency!	0	Tweet
1124779627904368640	@Marc59764247	2019-05-05 02:25:35	4 professors explaining the climate change hoax: Dr Easterbrook https://youtu.be/T2iggJN4Etw Prof Tim Ball: https://youtu.be/Owm25OHGglk Nobel laureate Ivar Giaever: https://youtu.be/SXxHfb66ZgM MIT prof Richard Lindzen:https://youtu.be/-sHg3ZztDAw	3	Tweet
1124775817438015491	@11thEarl	2019-05-05 02:10:26	How about "collective psychosis"? Now, we MUST clean up our own act - it makes perfect sense. But if you seriously believe that the human race is in charge of climate change, then you're sadly mistaken. And please, get your handlers to inform you of the facts regarding UK efforts	0	Tweet
1124774776139022337	@tissrand	2019-05-05 02:06:18	Climate Change for Earth, Maybe Climate Breakdown for (wo)mankind. Earth will exist without humans as it already hast millions of years before Evolution of (Wo)mankind. Bei realistic.	0	Tweet
1124769625764446208	@MelissaJPeltier	2019-05-05 01:45:50	Fun fact: “Climate Change” is a term injected into the lexicon by GOP mega-donor funded @ FrankLuntz, whose focus groups found it less scary & urgent-sounding as a term than “Global Warming”. He’s a genius w/words & this is what he does. Proud of yourself still, Frank?	6	Tweet
1124760787283693568	@doctor_bits	2019-05-05 01:10:43	It is really Run-away Global Warming with unknown amplifiers. "Climate Change" is the result of global warming. US President Ford insisted on using "Climate Change" as a way to downplay the emergency. We have known it was becoming an emergency since 1989.	0	Tweet
1124756543352856577	@MuseThis	2019-05-05 00:53:51	Climate change is a reoccurring planet cycle that we can’t control, what we can do is protect our resources, limit pollution and preserve life of animals, amphibians, mammals, insects etc this is totally within our control and absolutely humanities responsibility to do so	0	Tweet
1124752570386407425	@suture_me	2019-05-05 00:38:04	Well, we are only in crisis because we care about living - yet our extinction itself is nothing to be afraid of. This is the course of what history has shown. To be exact, climate change cannot be halted or reversed. As such, climate change and ecological breakdown are connected.	0	Tweet
1124749692196347904	@arbronca	2019-05-05 00:26:38	Climate Change, no: Global Warming: Calentamiento Global.	0	Tweet
1124747966764466176	@Laurie_David	2019-05-05 00:19:46	@ GretaThunberg I remember the moment when the Bush Administration decided to stop saying global warming and started saying climate change because it was “less scary”. TY for your outrage and common sense. https://twitter.com/GretaThunberg/status/1124723891123961856 …	0	Retweet
1124747686605983749	@benson_karras	2019-05-05 00:18:39	Hey Glad u call that out I switched myself too.. Sometimes catching myself typing climate change.. But I see it and say... Wait It not just change It is a crisis! So so scary And still people do nothing I thought XRebellion UK Protest Be copied around world Sad not Very sad	0	Tweet
1124741530122706944	@Helene_SWCP	2019-05-04 23:54:12	Sixth mass extinction. Fish, coral reefs, plankton, insects... and in Sir David Attenborough's documentary, flying foxes. Such a shame... Well done to your family for supporting you, mine are climate change deniers...	2	Tweet
1124732436833693696	@ChzAz	2019-05-04 23:18:04	Thanks for leading, made that mistake just today. Not climate change, climate crisis. # ClimateCrisis # EcologicalBreakdown	0	Tweet
1124732219178700800	@kimy538	2019-05-04 23:17:12	Problem is Greta, when we change the name, it feeds the protesters. Look what happened when we shifted from global warming to climate change. Maybe we should add on to it...	0	Tweet
1124731966950203393	@777_festus	2019-05-04 23:16:12	Climate Change technically is correct, lets not get cynical with 'words' but get the ACT right and straight. This may be diversionary if we delve into definition trajectories	0	Tweet
1124727721991516162	@alexandriaein	2019-05-04 22:59:20	Well Greta...though you mean well, it is however Very Important to Always Have a Simple Message. And be Very Consistent with it. The term Climate Change is Very Practical. It Encompasses All Change to earth's climate.	0	Tweet
1124726407563661313	@pitdroidtech	2019-05-04 22:54:06	I've been becoming increasingly uneasy calling it climate change. This for articulating this and calling it out.	0	Tweet
1124688817129250816	@votejonathan	2019-05-04 20:24:44	@ GretaThunberg: You can’t stop climate change as it is a natural process that has happened many times before. One can simply manage human contributions to global warming that is speeding climate change up.	0	Tweet
1124631756328587264	@Cochis3	2019-05-04 16:38:00	@ GretaThunberg is 16 and has been 'brainwashed' into her fight against climate change, while @ ShamimaBegum was 15 and knew perfectly well what she was doing when she joined ISIS. Notice the difference?https://twitter.com/BBCNews/status/1124441184053735425 …	0	Retweet
1124451636758372352	@EnviroDo	2019-05-04 04:42:16	@ GretaThunberg Why kids possess the power to make climate change action happen…and right at home! # news # climatewarming # globalwarming # climatecontrolpic.twitter.com/sFxP4D0fRp	0	Tweet
1124414421370060802	@Regiemental	2019-05-04 02:14:23	@ GretaThunberg today's Special Shout Out goes out to @ GretaThunberg for her willingness to stand up for her conviction & beliefs about Climate change, her stance on climatology! Everyone follow this account too!	0	Tweet
1124340630858035200	@JanetHealth	2019-05-03 21:21:10	I'd call this the beginning of a WORLD REVOLUTION for climate change action!	1	Tweet
1124327120480690177	@StephenPresley0	2019-05-03 20:27:29	@ GretaThunberg I read a theory that @ GameOfThrones underlying metaphor was about climate change. I think that would make you the real life Arya Stark.	0	Tweet
1124285949922426881	@wordsmeet	2019-05-03 17:43:53	Demanding action to face climate change is a worthy goal. I don't think sacrificing class time and your education is the only or most appropriate step, however. How are you going to make up for lost school days? How about teachers who don't get paid with no students to teach?	0	Tweet
1124279931691835392	@Econ_Foundation	2019-05-03 17:19:58	@ GretaThunberg we would like to get in contact with you about a film we are making for children on climate change. Can you send us a DM with your contact details?	0	Tweet
1124276410997137410	@joigbu	2019-05-03 17:05:59	https://m.youtube.com/watch?feature=share&v=Mprs6KnpB3k … Climate change	0	Tweet
1124272947915567106	@M_Theauvette	2019-05-03 16:52:13	@ GretaThunberg is unrelenting and so is climate change. Why aren’t we? https://twitter.com/GretaThunberg/status/1124199150206234625 …	0	Retweet
1124255190234882049	@johnjweatherall	2019-05-03 15:41:39	and the only thing it will be used for is to allow the elitist politicians to tax hard working families even more. The U.K. isn’t the climate change issue..... china, India, South America all with over 1bn people each all using fossil fuels..... what the hell 64m in the UK do?	0	Tweet
1124252767139319809	@rimijo	2019-05-03 15:32:01	If you were to give up your school strike, you might be able to learn that climate change has nothing to do with CO2 ...	0	Tweet
1124240540860600320	@anniekangers	2019-05-03 14:43:26	@ GretaThunberg #2 Two birds with one stone, so to speak. Have a look into it. Good luck with the climate change rebellion. Viva la rebellion.	0	Tweet
1124214878120493058	@DianaRyall	2019-05-03 13:01:28	@ GretaThunberg I was so inspired by the school climate action rally today outside the office of one of our politicians who still thinks we should ignore climate change.	1	Tweet
1124153648475451392	@Gam88768173	2019-05-03 08:58:10	@ GretaThunberg yes I agree with you about climate change but how are you going to change things in ex-coalmining heartlines like the north of england. You preach about zero carbon yet one of the biggest producers is Norway. How about u try and feed a family on nothing. Fuck off.	0	Tweet
1124127595006545920	@pall336	2019-05-03 07:14:38	Let's try.Learn about climate change. https://twitter.com/pall336/status/1111434295019593731 …	0	Retweet
1124064869408546817	@ceeneegee	2019-05-03 03:05:23	This is how manipulated our youth are today...they think climate change is our greatest threat all the while more people die from heart disease, alcohol & drug related deaths by thousands. Why aren’t they protesting that? So easily manipulated! Sad!	0	Tweet
1124047283325218826	@FielibertNick	2019-05-03 01:55:30	I thought you were the girl that was fighting climate change? How is this related to human rights and democracy? Don’t forget that the biggest producer of greenhouse gasses, and is not willing to do something about it, is a democracy!	0	Tweet
1124035009810190336	@david_bushby	2019-05-03 01:06:44	Hello Greta, man-made climate change does not exist. Climate has changed throughout the ages. Better to campaign against plastics that are really harming our planet. Support you all the way on this	0	Tweet
1124021090366390280	@HooperIth	2019-05-03 00:11:25	You are been used.There is no such thing as man-made climate change.	0	Tweet
1124012280847503361	@JSamoraj	2019-05-02 23:36:25	@ GretaThunberg If you want to affect and implement wider change you must be a champion of it. If you want the change to be successful, you must lead people towards it. Our hope is that climate change can be solved by people who believe there’s no problem we can’t solve together.	0	Tweet
1124010732675321862	@InfoClimatecoin	2019-05-02 23:30:16	@ GretaThunberg, at only 16 years old, has inspired over a million young people to rise up and take action on climate change. https://greatbig.is/2KQ9I8S pic.twitter.com/yITvXsgFgT	0	Tweet
1124010729143767040	@ClimateTrade	2019-05-02 23:30:15	@ GretaThunberg, at only 16 years old, has inspired over a million young people to rise up and take action on climate change. https://greatbig.is/2KQ9I8S pic.twitter.com/y9lBR1eDFo	0	Tweet
1124009541287456768	@hem_of_arga	2019-05-02 23:25:32	My sweet @ GretaThunberg! reducing only CO2 will not be enough I'm afraid; Human population too must severely be reduced; Because WE are the main reason for Climate Change. Less humans, more Future.	0	Tweet
1123995694530990090	@rcfollows	2019-05-02 22:30:31	@ GretaThunberg This is what happens when young people raise their voices! The House just passed the # ClimateActionNow Act ( # HR9), the first climate change legislation in nearly 10 years. Thank you to all the representatives who listened, and decided to # ActOnClimate!	0	Tweet
1123980545074049025	@JackDRipper14	2019-05-02 21:30:19	How nice to be able to concoct a fake,contrived movement of privileged people with favourable,uncritical coverage from their media friends,to push a hollow "climate change emergency" through govt in 5 mins. Most people have much bigger concerns,and no means to get them addressed	0	Tweet
1123974721740201991	@Debbiecalling	2019-05-02 21:07:10	@ GretaThunberg MPs make history by passing Commons motion to declare ‘environment and climate change emergency’ https://www.independent.co.uk/news/uk/politics/climate-change-environment-emergency-commons-motion-mps-vote-latest-a8895456.html …	0	Tweet
1123939732826857478	@gazza632	2019-05-02 18:48:08	When is this climate change going to start?? Next week? Next year? Five years? Go hug a tree.	0	Tweet
1123916642818433025	@Wayne851054	2019-05-02 17:16:23	Climate change is nonsense it is a natural cycle brought about by the Sun	0	Tweet
1123904979033645059	@rknecho	2019-05-02 16:30:02	@ GretaThunberg The truth is that no matter how anyone attacks you, it doesn't alter the truth of climate change. How infantile of adults to fail to that degree that they think "yelling" at you will make that truth stop.	0	Tweet
1123871826994704384	@QKSGeography	2019-05-02 14:18:18	@ GretaThunberg Hi Greta, I appreciate you are very busy, but my students and I were wondering if you would come to our school to discuss the importance of immediate action on climate change. Kind Regards, Sam and all the students @ QKSGeography # longshot	0	Tweet
1123871562631917571	@Amrani120929	2019-05-02 14:17:15	@ GretaThunberg dearest. Thanks so much for taking a stand against climate change and being a fantastic role model for youths and adults worldwide at such a tender age. Please can you consider also encouraging followers to go vegan....cont'd	0	Tweet
1123854035113713664	@freedomfightsuk	2019-05-02 13:07:36	Demonstrates the will of the Commons on the issue but does not legally compel the government to act, was approved without a vote. Tells you all really? Climate change is a myth to control the masses and the gullible.	1	Tweet
1123848274308366336	@SushilBaboo	2019-05-02 12:44:43	Congratulations Greta, you have achieved a major historical victory! Hope other countries realize the importance of climate change and it's impact on the future civilization.	0	Tweet
1123828445459435522	@lorraineSW1	2019-05-02 11:25:55	Climate Change is the biggest con ever.	0	Tweet
1123822590185881600	@viperman17	2019-05-02 11:02:39	Won’t make a difference. Climate change is earths natural cycle and no one can stop it. Planets heat up and then cool down constantly repeating this cycle. Have been doing this for millennia and will continue to do so long after Humans cease to exist. It’s basic science.	0	Tweet
1123801868260585473	@Sandhumanminde3	2019-05-02 09:40:19	Congratulations kids you guys are going to win. Though only one nation yet but it is a huge first step towards your fight against climate change. Keep it up and we are always with you...	0	Tweet
1123740873286725633	@PTurbo67	2019-05-02 05:37:56	GO enjoy your childhood. Maybe work our which irreversible climate change triggered the last iceage and its subsequent melt.	0	Tweet
1123738794073698304	@HookyGolfer	2019-05-02 05:29:41	Anything to fill the newspapers instead of brexit! Just remember the 🇬🇧 government have used you as a pawn in their plan to stop democracy happening! May god have mercy on all your souls! Climate change is about as reliable as Theresa May!	0	Tweet
