Tweet id	Poster username	Tweet post Date	Tweet text	Number of retweets	Tweet type
1185265244332904448	@stampsfan82	2019-10-19 00:13:50	You spout lies and misinformation. The UN IPCC reports contradict majority of what you say. The words you speak have an impact on young children, be responsible. Climate change needs real solutions, probably best to start working on those.	0	Tweet
1185249835126886400	@MTJenner	2019-10-18 23:12:36	@ GretaThunberg welcome to Edmonton. Thank you for coming. Your message is fine. This global cause is valid science & opportunity. We in every industry & home can do more. I’m 51, a guy, lifelong Albertan, Canadian, want free enterprise, profit & global action on climate change.	0	Tweet
1185249317248032769	@Eric_Lepp	2019-10-18 23:10:32	@ GretaThunberg As you strike in Alberta - a hotbed of economic-driven climate change denial - you are likely to be met with an unfortunate voice of unwelcome. In all the noise remember that you aren't just on the right side of science but also the right side of history.	0	Tweet
1185248881564622850	@citizensforale1	2019-10-18 23:08:48	@ GretaThunberg wanna talk about climate change and what hurts the planet. and stealing your childhood. better talk to obama and the democrats. they are in charge of the districts that have the most killings and most trash and human waste on the streets. democrats are killing usa	0	Tweet
1185245402884272128	@Tracyhockeymom	2019-10-18 22:54:59	Welcome to Edmonton Greta! Many of us are for Climate change action and we believe in protecting our Mother Earth. I hope you enjoy your visit. # yeg # climate # love	0	Tweet
1185240935694774272	@domainrecap	2019-10-18 22:37:14	@ GretaThunberg Greta, like most people I believe Climate Change is real and will drastically alter human society, but riddle me this: How are we supposed to lower our carbon footprint when our global population increases by 1 million feet a day? # GretaInAlberta # ClimateChangepic.twitter.com/fApDroi5Bn	0	Tweet
1185227644343742464	@koreaowl89	2019-10-18 21:44:25	@ GretaThunberg Greta. Everyone realizes Climate change. We do need to take actions, but you need to go back to school! Stop protesting and start learn and become the one who actually can take actions on climate change.	0	Tweet
1185219116791193601	@scum_earth	2019-10-18 21:10:32	Sorry little girl. Im not buying your fake climate scam. Your are not old enough to even have 1/2 a chance of knowing what you are talking about. Go to school and learn about volcanos, cycles and the sun. This is your climate change. ITS NATURAL. THEY JUST WANT POWER AND MONEY.	0	Tweet
1185217378340098049	@Robert_Johnston	2019-10-18 21:03:37	Thank you, Greta! For Calgary, all are invited: highschool, university, ages 5 to 105> City Hall, noon-2pm. Albertans all ages, are responding to # ClimateCrisis + will convert integrity to climate change votes on Monday. # yyc # Calgary # ABpoli # Canmore # UCalgary # SAIT # highschool	0	Tweet
1185213841657024514	@taylor7_r	2019-10-18 20:49:34	Your parents should be locked up for not having you in school! You're brainwashed into believing the lefts BS ! CLIMATE CHANGE IS A HOAX!	0	Tweet
1185202467690168320	@Stevenlv1990	2019-10-18 20:04:22	For someone who claims climate change is real you sure are doing a lot of traveling rather fast. What are you using to travel? Those knew state of the art plant planes fueled with vegetable oil?	0	Tweet
1185193091537481729	@SandraDeeT	2019-10-18 19:27:07	@ GretaThunberg welcome to Canada. Please know that not all Canadians are close minded about Climate Change. And please stay safe out there. 🙏🏻❤️	0	Tweet
1185189117807607808	@URNOTDABOSSOFME	2019-10-18 19:11:20	@ GretaThunberg is a paid actress who is using some supposed metal illness as cover for anyone who wants to criticize the fact that she has NO real knowledge about climate change. She is hyperbole incarnate. # GretaGoblin	0	Tweet
1185179694414479360	@resistDems2020	2019-10-18 18:33:53	Are you traveling on foot, by bike, on a horse? How are you properly fighting climate change if you’re putting exhaust from autos & planes into the air? When you hike, you expand your carbon footprint. Seems hypocritical, because it is. # BurnFossilFuels # DebunkClimateChange	0	Tweet
1185174549429719040	@Sheryl35784379	2019-10-18 18:13:26	@ GretaThunberg how can the fight against climate change have a chance until we collectively change our global mindset from using the metrics GDP and GNP? Until then we just keep producing..	0	Tweet
1185151503494975488	@Chip06333618	2019-10-18 16:41:52	Brainwashed little girl . I suggest you study the Vostok core samples if you want to know about climate change ! How dare you interfere with our federal elections !	0	Tweet
1185147327914369024	@GraydonHc	2019-10-18 16:25:16	@ GretaThunberg In my opinion you are not radical enough in fact your thoughts on climate change seem like they where done without altruism, where were you guys in 2010. You are followers not leaders in this area. You are playing catch up.	0	Tweet
1185068175219515393	@lawliss_brian	2019-10-18 11:10:45	@ GretaThunberg I would like to have a simple discussion with you on climate change, Please DM me and I will answer you.	0	Tweet
1185044187982565376	@TifeAnd	2019-10-18 09:35:26	In order to defeat climate change, we need to change the whole system and methodology. Changes need to be made to get the masses attention. We need people going to the school to teach them young, Now🌎 # Goal13 @ SDGoals @ AsstSecStateAF @ SDGaction @ SDG2030 @ GretaThunbergpic.twitter.com/Y65BB9Jan3	0	Tweet
1185043668547362816	@TifeAnd	2019-10-18 09:33:22	In order to defeat climate change, we need to change the whole system and methodology. Changes need to be made to get the masses attention. We need people going to the school to teach them young, Now🌎 # Goal13 @ SDGoals @ AsstSecStateAF @ SDGaction @ SDG2030 @ GretaThunbergpic.twitter.com/6D2UqdgvtM	0	Tweet
1185023072383823872	@SandraHulleman	2019-10-18 08:11:31	@ GretaThunberg welcome to Edmonton. I apologize for some of our people. We never used to be like this. Climate change is real and must be addressed. You are a wonderful young woman!	0	Tweet
1185012958482575360	@oceanslandair	2019-10-18 07:31:20	Hey Greta, Please tell ALL world leaders to # BoycottG7 because our idiot president will not be discussing climate change.	0	Tweet
1184988582416662529	@brianedyer1	2019-10-18 05:54:28	Poor thing climate change is a hoax!	0	Tweet
1184987360355684352	@LoriAlex6	2019-10-18 05:49:37	Greta, concentrate on China, USA, India ... Canada has little impact on climate change in the grand scheme of things.	0	Tweet
1184977291715239937	@R8der316	2019-10-18 05:09:36	I thought your childhood was stolen and all? I guess you ought to see as much of this country before it's under water, frozen, draught ridden or whatever else climate change nut jobs believe.	0	Tweet
1184975142868443137	@ChezV5	2019-10-18 05:01:04	Wouldn’t it just be easier to delete all the humans though? Like, it would solve BOTH climate change and over-population. Nyoh ho ho	0	Tweet
1184972804375998464	@AllyDally101	2019-10-18 04:51:46	@ GretaThunberg is the katniss everdeen of climate change	0	Tweet
1184971581426229249	@BillsMafia10	2019-10-18 04:46:55	I'm pro climate change	0	Tweet
1184971538925326336	@BillsMafia10	2019-10-18 04:46:45	I'm pro climate change	0	Tweet
1184971515554652161	@BillsMafia10	2019-10-18 04:46:39	I'm pro climate change	0	Tweet
1184959047017127936	@ErnestoGabiel	2019-10-18 03:57:06	when will you go to China and India and lecture them to do more to combat climate change ?!!	0	Tweet
1184958321993961477	@flbluesgirl304	2019-10-18 03:54:14	It’s sad to see such a young girl being FED lies about weather. I thought European countries would have taught more about HITLER & his promoting Climate Change aka Ice Age doom. He USED the young & started the Hitler Youth Brown Shirt program. Greta is BUYING into the same Lies!	1	Tweet
1184953535286464514	@kkchinchaladze1	2019-10-18 03:35:12	@ GretaThunberg Hello Greta, I see what you are trying to do with your videos and stuff, but what you say about Climate Change and everything like that, do you have any proof that same thing didn't happned 1000 years ago, or 2000 years ago ?	0	Tweet
1184950621323042822	@EtiennePerkins	2019-10-18 03:23:38	Talk about climate change and you just took an aeroplane to Alberta? How dare you	0	Tweet
1184950001945993216	@NYYNYG2	2019-10-18 03:21:10	@ GretaThunberg @ antonioguterres I’m so glad that you guys are spreading the word on climate change thank you for trying to save the world. Antonio Guterres you are the greatest UN secretary we’ve ever had I wish you could be in for life Greta that we’re close in Age I’m 17	0	Tweet
1184941813225922560	@TheresaMcNee	2019-10-18 02:48:38	Must have been paid a good amount of money for your ACT over climate change!	0	Tweet
1184918168373850112	@CheeCheeLorne	2019-10-18 01:14:40	Welcome to Edmonton Greta! Ignore the loud and ignorant cries from Alberta's ignorant climate change denying provincial government. pic.twitter.com/zi6CoF9T8K	0	Tweet
1184917543426723842	@CheeCheeLorne	2019-10-18 01:12:11	Welcome to Alberta Greta! Don't listen to the many many many morons and climate change deniers in Alberta. pic.twitter.com/MuY2VMJfCR	0	Tweet
1184917331819909120	@ICameronScona	2019-10-18 01:11:21	@ GretaThunberg has raised a significant amount of awareness on the subject and this is admirable! # Respect Frankly, it's disappointing to see the negativity the subject seems to bring up. As stated previously, climate change is here and we need to do our part. https://twitter.com/ryanjespersen/status/1184885185566789633 …	0	Retweet
1184916532133912576	@tripalink11	2019-10-18 01:08:10	I live in alberta and i think its the worst province in canada. So many people dont even think climate change is real	0	Tweet
1184892379393708032	@K99600813	2019-10-17 23:32:12	@ GretaThunberg when will you be going to China and India to help them fight climate change? I’m interested to follow that journey.	0	Tweet
1184872070645243905	@Hillarybloze	2019-10-17 22:11:30	She's Baaack! The little climate change spawn of the devil is baaack! How dare we not listen to her? How dare we take away her future? How can we not believe everything that comes out of her brainwashed mouth? She will put a curse on us! pic.twitter.com/F0sQro9HVN	0	Tweet
1184851638499983366	@jasonwales9	2019-10-17 20:50:18	All you people make me sick. Climate change is a money grab. To take money away from poor families when it is the government and big corporations who do all the polluting. Some kid talks about climate change and she is no better than the politicians who are making the pollution.	0	Tweet
1184841516096937984	@JohnAdversary	2019-10-17 20:10:05	While you have time, it wouldn't hurt to educate yourself on the solar system and how earth's orbit and the different cycles it has through the centuries effects climate change. Truth.	0	Tweet
1184835771632517122	@hdz1966	2019-10-17 19:47:15	I sure hope you are not using any transportation the requires the use of fossil fuels. That would be a little hypocritical don't you think? Unless you subscribe to the same model that all the climate change babies follow. Do as I say not as I do.	0	Tweet
1184834223296798720	@Hiveaclue	2019-10-17 19:41:06	🐝Another climate change hypocrite. How you getting there!?	0	Tweet
1184828438135226369	@wyscrapper	2019-10-17 19:18:07	no climate change in these states...unless you count the planes to nowhere dumping chemicals on Gods country.	1	Tweet
1184825700127301633	@LMFAOatDems	2019-10-17 19:07:14	Nothing like a road trip on someone else's dime. P.S. Climate Change is a hoax	0	Tweet
1184824466662146048	@JWKazmer	2019-10-17 19:02:20	If you were so worried about mother earth and this climate change crap. Why?, arent you sitting behind your computer and a camera and deliver your bull crap? Isn't that more eco friendly than running around the globe spewing all this carbon into the atmosphere? Hypocrite! pic.twitter.com/gIORJiUdiz	1	Tweet
1184821227925442562	@justmejill	2019-10-17 18:49:28	Really? Are you riding your bike to all of these locations? Or are you walking? Climate change you know. # Hypocrisy	0	Tweet
1184820520212058113	@PaulHarrop9	2019-10-17 18:46:39	So you are riding a bike? Or walking? Can't ride a horse. Horse farts cause climate change. Why not go to China or India?	0	Tweet
1184820445436100613	@DannyStricklan7	2019-10-17 18:46:21	If 7.5 million are on the climate change hoax band wagon. That is .00125 of the world population then I think the other 99.99% are smarter. So go and get about 40 more yrs behind you then come back.	0	Tweet
1184817553304178689	@bodesm	2019-10-17 18:34:52	Climate change, global warming, global cooling, etc. is as believable as this guy being a scientist. "Please believe me, I need more attention..." pic.twitter.com/23g4b7ydIa	0	Tweet
1184811532020080640	@retiredcop2014	2019-10-17 18:10:56	When does your itinerary include a speech in China and India regarding their contributions to climate change? Congratulations. You've learned your leftist hypocrisy lessons well. pic.twitter.com/xQTOAzvfsA	0	Tweet
1184810517002620929	@ThomasLRugerJr2	2019-10-17 18:06:54	@ GretaThunberg I have listened to your speech’s about climate change. I have come to one conclusion you have been brainwashed and it deeply saddens me. How can one so young have their views so twisted. You have been drinking the liberal cool-aid to long.I will pray for	0	Tweet
1184801039729463296	@Cherylb	2019-10-17 17:29:15	And I quote “This is all wrong I shouldn’t be up here, I should be back in school on the other side of the ocean.” You were paid well for that fake climate change speech. You said it “You’re one of the lucky ones”! I see you’re enjoying economic growth! 🤔	1	Tweet
1184791013535240193	@spartanfan8892	2019-10-17 16:49:24	Go back to school, learn for yourself that not everyone agrees with the ramifications of climate change	0	Tweet
1184788643061338112	@CindyBarnettUSA	2019-10-17 16:39:59	The earth has experienced climate change since God first made earth. We have climate change in TX right now, summer is changing into Fall and soon winter will follow. Geeezzz, get a life!!!	1	Tweet
1184786732840976386	@BradLoerzel	2019-10-17 16:32:24	I'm confused. If you're making a stand against climate change, why would you want to visit the more densely populated by cow farts area's? Why not the streets of San Francisco or LA?	0	Tweet
1184765504424161280	@NewsForThinkers	2019-10-17 15:08:02	HOW DARE YOU: 10 reasons not to believe climate change criers | Liz Whee... https://youtu.be/i-qBOyrD0-0	0	Tweet
1184756413031178242	@JohnRenzetti	2019-10-17 14:31:55	Best of luck Greta! Alberta has some of the stupidest climate change deniers in Canada. Some still use the old "carbon dioxide is plant food" argument to justify the Alberta tar sands in the same sort of way # Trump spouts his "clean coal" propoganda. # StupidPeople # ClimateStrike	0	Tweet
1184730580900032513	@AethansBusPics	2019-10-17 12:49:16	You need to come to London and I’ll stand beside you and protest against climate Change!	0	Tweet
1184720451907358720	@WongWallis	2019-10-17 12:09:01	@ GretaThunberg I hope you will visit the University of Alberta and the Northern Alberta Institute of Technology both major post secondary schools in Alberta’s Capital city “Edmonton” to see what great things these schools are doing to help reduce climate change in Canada.	0	Tweet
1184715448085970954	@parmissm11	2019-10-17 11:49:08	It’s an honor to have you in Edmonton. You are the beginning of a real fight against climate change. 💜	0	Tweet
1184704040849948672	@JayneEngle	2019-10-17 11:03:48	@ GretaThunberg in # Edmonton this Friday! Strike will be latest in series which have drawn thousands to legislature grounds demanding govt action on climate change: a Canadian Green New Deal — a plan to transition to 100% renewable energy by 2030 & that upholds Indigenous rights. https://twitter.com/edmontonjournal/status/1184607544804827136 …	0	Retweet
1184696259384434688	@Provinzpolitik	2019-10-17 10:32:53	In addition to the fight against climate change, everyone can do something very specific for species protection. Invisible glass walls kill millions of birds every year. Let's make that visible! pic.twitter.com/2zKM0weqYZ	0	Tweet
1184672561147330560	@ltmatthews2	2019-10-17 08:58:43	Nice to see a child being used as a propaganda tool to perpetuate a completely false narrative of climate change, What kind of idiot would actually buy into the idea that humans can affect the climate LOL?	0	Tweet
1184672007142535168	@AzDeplorable	2019-10-17 08:56:31	@ GretaThunberg the god of climate change. 👀 @ AndrewScheer @ MichelleRempel @ jkenney @ SheilaGunnReid @ dkreative1 @ CindylouAB @ MichelleRempel @ manny_ottawapic.twitter.com/6woawQ2xBb	0	Tweet
1184669591189872640	@MahadevPallavi	2019-10-17 08:46:55	Come to India, meet Ms, Saalumarada Thimmakka.. you will know what is actually to be done. Doing protest doesn't stop climate change..	0	Tweet
1184668939558608896	@MahadevPallavi	2019-10-17 08:44:19	Hi, Other than your protest, have you taken any other action on climate change..???	0	Tweet
1184658543292624896	@MihaTaa	2019-10-17 08:03:01	Why not let students who want to actually study and learn about climate change do so on Fridays ... strike on a Saturday or Sunday!	0	Tweet
1184641644403941376	@BillHilly15	2019-10-17 06:55:52	Hope it’s slow cause you’re walking. Wouldn’t want to contribute to you know... climate change.	0	Tweet
1184639809958088704	@Stella_7799	2019-10-17 06:48:34	Stop playing blind and deaf! Go march and protest in China, China’s carbon emission is several times bigger than Canada’s, they don’t have any regulation to control that, and no one in China gives a shit about climate change! Go ask China “How dare you” or you don’t care	0	Tweet
1184614472800821248	@brendon_mckenna	2019-10-17 05:07:54	Hello Greta. Your message might have more direct impact & change if the message was changed from climate change to world peace.	0	Tweet
1184604682888667137	@ToddRemmy	2019-10-17 04:28:59	besides the extinction of dinosaurs what other species has been lost to history thanks to climate change?	0	Tweet
1184591830593220613	@Dr_TomSmith_III	2019-10-17 03:37:55	@ GretaThunberg is a teenager who knows next-to-nothing re: climate change. She should read about the expert-backed, world-ending "Ice Age" of the 1970s, etc. MSM should stop covering her. https://www.bizpacreview.com/2019/10/16/teen-climate-expert-thunberg-encourages-protesters-to-ignore-the-police-and-break-the-rules-840244?utm_campaign=bizpac&utm_content=Newsletter&utm_medium=Newsletter&utm_source=Get+Response&utm_term=EMAIL …	0	Tweet
1184591084841771013	@Laurawashere099	2019-10-17 03:34:57	And because of your false claim and bogus climate change a young child committed suicide, you don’t care about that though.	0	Tweet
1184584707528445958	@Hpdellnec	2019-10-17 03:09:37	The impact of climate change? It often happens in heavy rain. Please give a lecture in Japan. pic.twitter.com/W8LTf4tTFo	0	Tweet
1184573495176359937	@Luke42589009	2019-10-17 02:25:04	climate change isn’t real 🤡🤡	0	Tweet
1184569965241782272	@TerribleSimmy	2019-10-17 02:11:02	@ GretaThunberg Welcome to Calgary! :) I want you to know that my fiancé & I think what you’re doing is amazing. Many Albertans care deeply about climate change and want to see our government actually DO something besides deny, debate or talk.	0	Tweet
1184556996747546625	@Quantum_Quench	2019-10-17 01:19:30	Why not organize monthly (low cost or no cost) concerts around the world?! Could get 10's of thousands to attend! Even better, how about an annual climate change 'Woodstock' (where people would be encouraged to walk, bike, or use other efficient transportation to get there)?!	0	Tweet
1184556658808283137	@TankHistory_YT	2019-10-17 01:18:10	Silly little Girl. You cant do anything against the climate change! Just Go to school instead of interfering in Things you dont understand....... pic.twitter.com/lx9B1ySSwp	0	Tweet
1184553212940050433	@Caps1928	2019-10-17 01:04:28	@ GretaThunberg I’m not in school anymore, but I also don’t have any money to donate towards the climate change cause. What can I do to help out?	0	Tweet
1184546449155067904	@LovejivanS	2019-10-17 00:37:35	@ GretaThunberg Hey! Are you coming to @ cityofcalgary in Alberta? Please let me know when you are coming! I would like to plan an event in our community and/or city regarding Climate Change!	0	Tweet
1184542103222870018	@Redneck43197846	2019-10-17 00:20:19	You want climate change than how do you get around the world do you walk? Get rid of your bed , your house , your toilet paper that is all made of trees . Get rid of your computer , your power to your house no running water . Live like our grandparents did in the thirty’s to 50s	0	Tweet
1184535772139020290	@wellnesscoachNH	2019-10-16 23:55:10	@ GretaThunberg , please convince me the world is going to end, okay? I know the UN will be long gone before the sane people of the world believe this climate change BS. I’m sorry, your life begins when you dump the people feeding you all this BS. Have a great day. 😎⬇️⬇️⬇️⬇️⬇️⬇️ https://twitter.com/BillJoh14440504/status/1184493788674187264 …	0	Retweet
1184527179725627394	@Stuhes70	2019-10-16 23:21:01	Hi Greta. It’s too bad you weren’t in Alberta a few million years ago you could have done your part to save the dinosaurs and raptors so they could still be roaming the prairies today. Now sadly due to climate change all we have is their bones to remember them by. Dress warm i	0	Tweet
1184524564308598785	@RealSmel	2019-10-16 23:10:38	@ GretaThunberg Why can't we weaponize penguins and they'll fight for climate change with us?	1	Tweet
1184523591557304327	@BMFDISKOD	2019-10-16 23:06:46	I think you spelled India, China, Pakistan & Bangladesh wrong Greta... Cuz coming to countries who are actually doing something to fight "climate change" is pointless. Go see how well you do with countries who don't give a fukk about it, who are the REAL polluters!	0	Tweet
1184522544759693313	@thefaaside	2019-10-16 23:02:36	@ GretaThunberg Maria MacSweeney from Drawda says you shouldn't be blaming the people responsible for climate change. pic.twitter.com/By56H5aCDA	0	Tweet
1184512758873649154	@JillEvansjp0077	2019-10-16 22:23:43	Our kids need to be in school, why don't you do your marching for climate change on a Saturday or Sunday! And why when we are having an election!!!	1	Tweet
1184512698790400000	@BrendonLeaman	2019-10-16 22:23:29	@ GretaThunberg Global co2 levels in the jurassic era were 3x higher then they are today. The industrial revolution caused a shift in co2 levels that actually prevented an ice age and our own extinction. Global temperature is based on solar output. Climate change is a lie.	0	Tweet
1184499692132093952	@lwatcdr	2019-10-16 21:31:48	A school strike is dumb, counter productive and childish. Knowledge and education are key to reducing climate change. How about no drive, no social media Saturdays? Save power by not consuming and not traveling unless you have to. Walking and public transportation is fine	0	Tweet
1184490811892699136	@bbqdtunes49	2019-10-16 20:56:30	@ GretaThunberg We, who care deeply about Mother earth, and her peril at the hands of destructive forces, welcome you to Western Canada, and support your cry for protective measures against Climate Change. God bless you, Greta!	0	Tweet
1184489970318184450	@akshaykv	2019-10-16 20:53:10	@ GretaThunberg I agree with everything you've said about climate change. You are an inspiration to me and several young people who are going to create their lives in the 21st century. The way the world leaders reacted to you at the UN is appalling.	0	Tweet
1184481390848610305	@aliceminsoochun	2019-10-16 20:19:04	The greatest weapon against injustice and poverty —fight with the light of your minds and our hearts and never give up I’m proud and honored to be next to you In “The Book of Gutsy Women” by Hillary Clinton # gutsywomen # solight # solarpuff # light warrior # climate change # solar	0	Tweet
1184481118227034112	@brentmcgillis	2019-10-16 20:17:59	Beware of those who only seek you as a political prop for their own profiteering. Like the City of Edmonton, which has done absolutely nothing to combat climate change, just look at all the shiny GLASS towers they built downtown on instructions from their Realtor cronies!	0	Tweet
1184480897321422849	@henrytsangarch	2019-10-16 20:17:07	@ GretaThunberg My name is professor Henry Tsang at @ AthabascaU @ RAIC_IRAC Centre for Architecture. Our department stands with you and we are committed to develop sustainable/regenerative designs to combat climate change. I’d be more than thrilled to host you in # Alberta! # greta	0	Tweet
1184480435054792704	@KateInfidel	2019-10-16 20:15:16	Dear Greta! Wonderful work you are doing spreading the climate change crisis to western countries!!! When you actually get to the worlds biggest polluting countries (China, Venezuela and Saudi Arabia) please please show those leaders their wrong doing!! I’ll watch U at that time!	0	Tweet
1184462518887993345	@RepublicOfMark	2019-10-16 19:04:05	Acknowledging climate change is the realization that humankind is now responsible & must take responsibility for all forms of life. Forms of life that exist as much in & for themselves as they do for us. The task is to liberate ourselves and nature from our own oppression.	0	Tweet
1184462167657123840	@janetbfitzgeral	2019-10-16 19:02:41	You are misinformed. Climate change is natural. Co2 makes the planet green.	0	Tweet
