Tweet id	Poster username	Tweet post Date	Tweet text	Number of retweets	Tweet type
1180673620202311681	@blueroadliner	2019-10-06 08:08:21	@ GretaThunberg Start preaching your climate change crap in China, the big polluter. When you make a difference come back to the US with the news. You will probably die of old age first, but don't give up you moron.	0	Tweet
1180672936820297728	@AunAusti	2019-10-06 08:05:38	So glad to see this i am from Iowa myself and climate change is real and very important if we want to survive and want our kids to survive and so on. Thank you so much for your dedication @ GretaThunberg , and thanks for sharing this photo, thats amazing, great turnout! ♻️☮️💟☯️	0	Tweet
1180670974007660544	@Kakarot61826716	2019-10-06 07:57:50	Climate change is a lie.	0	Tweet
1180670762790711302	@AnnaJuden	2019-10-06 07:57:00	@ GretaThunberg I love your passion for climate change. There are heaps of individuals & businesses who are already doing good, & have been for decades. We have to choose to see the good in the world also, not just the bad otherwise we miss out on so much. https://vimeo.com/362133027	0	Tweet
1180659416254648320	@hanvour	2019-10-06 07:11:55	@ GretaThunberg Go vegetarian! Reduce meals from 3 sessions a day to 2 or even 1! (as monks do in monasteries around the world. ) This is so called two-pronged approach to attack climate change effectively, finding solutions from politicians outside and asking oneself inside.	0	Tweet
1180620911206162432	@CheriinMS	2019-10-06 04:38:54	Perhaps you and other citizens should figure out environment and Climate Change aren't the same thing. How would anyone but God change the weather? Politicians that want to tax you and control you can't even take care of their own municipalities and citizens.	0	Tweet
1180620095124467712	@SsMedicint_Bias	2019-10-06 04:35:40	When you make emotional plites and dont back it up with any facts making climate change this negative issue, where we die in the two seconds, people are gonna respond negativily, pretty simple really. Maybe try keeping calm and not stressing the audience lol.	0	Tweet
1180614425436413953	@kellek45	2019-10-06 04:13:08	@ GretaThunberg you're just a liberal puppet being used by adults false propaganda! Yes their is climate change! Fall Winter, Spring, and summer. Climate change is a hoax for the elites to collect billions of tax dollars from American people. https://m.facebook.com/story.php?story_fbid=2452153908199056&id=153657598048710 …	0	Tweet
1180613049335648256	@TaffyandAimee	2019-10-06 04:07:40	@ GretaThunberg I am behind you 100% on Climate Change.	0	Tweet
1180589811171610626	@TheSenatorCat	2019-10-06 02:35:19	@ GretaThunberg The Mumbai, India Gov. has arrested green activists & climate change protestors who tried to preventing cutting of 2000 trees from the Aarey Forest last night for building a train yard (Aarey is like Central Park of Mumbai), pls highlight this!	0	Tweet
1180582787922845697	@Ashu91765757	2019-10-06 02:07:25	@ GretaThunberg have u listen speech of Honorable PM OF INDIA NARENDRA MODI at @ unGa regarding climate change after that what was happened in Mumbai India 200 trees # AareyForest were cut down during night	0	Tweet
1180573471040065538	@ByronObando89	2019-10-06 01:30:24	This is losing your childhood Greta, you cannot say that when you are living in a mansion and elitist family, the script went wrong for you girl, not everyone eats the story of climate change # GretaGoHomehttps://twitter.com/abcdaee1990/status/1180241561189257217?s=19 …	0	Retweet
1180571741871063045	@imogen_magner	2019-10-06 01:23:31	@ GretaThunberg I admire your work and what you stand for. I am passionate about saving our planet from climate change and I would love to find a way to make ordinary people care more and do their bit in their own lives. Have you got any ideas how I can do this in the UK?	1	Tweet
1180569919567458305	@albertan123	2019-10-06 01:16:17	You are using the current situation in your favor. We all know that climate change is happending, but it is not 100% proven that it could not be from asteroids passing by or other activities outside of earth.	0	Tweet
1180565216289054721	@JillBar37741838	2019-10-06 00:57:36	@ GretaThunberg ok lil one... You scream climate change...when i was lil it was all about 2nd ice age...then global warming....you are young and impaired so ill spell it out for you You are being used You are a pawn You are a magpie for ignorant old folks that use children SAD!!	0	Tweet
1180560667306151936	@NationalGuard5	2019-10-06 00:39:31	@ GretaThunberg Being a 26 year old in San Diego, I'm getting tired of Trump saying that climate change is fake. It's all too real, and if we don't act now, climate change will he irreversible! Keep doing what you're doing, and those who tell you to shut up, ignore them!	0	Tweet
1180560035857997824	@liebzeller	2019-10-06 00:37:00	@ GretaThunberg Hi Greta Thunberg. I appreciate, what you are doing for the climate. Am very happy about this. What you are thinking about eating babies, to stop the climate change?	0	Tweet
1180555072637415425	@urdangabon	2019-10-06 00:17:17	@ GretaThunberg you are not trained and dare to despise many studies that deny climate change? you are a fraud Greta	0	Tweet
1180547579022630915	@blenderpa1	2019-10-05 23:47:31	Could you please provide the study or studies that prove the causal relationship between human actions (ie increased CO2 etc) and climate change.	0	Tweet
1180539332525846529	@greenpefa	2019-10-05 23:14:44	Walk for Climate Emergency organized by students of Punjabi University, Patiala,Punjab (India) to express concern on climate change& stands in solidarity with young activists across world being inspired by Greta. pic.twitter.com/v89DbtjqqZ	0	Tweet
1180536535038468096	@BigBadBuzzSaw	2019-10-05 23:03:37	@ GretaThunberg Are you walking to your next “how dare you” speech? Surely you are not increasing your carbon footprint to lecture on climate change	0	Tweet
1180516964499955714	@KeesBloklandPhD	2019-10-05 21:45:51	Hi Greta, you were sailing when Nature published the result of a study in to the state of forest in the world. Guess what? Forest area declines in tropical areas due to expanding agriculture. But, surprise, it increases in temperate zones thanks to climate change & reforestation	0	Tweet
1180499077236166656	@fortunephoto1	2019-10-05 20:34:47	@ GretaThunberg These scientists want to console you as well as I. Too many has lied to you...read this and learn more. Look outside your circle! ALERT: 500 Scientists Just Dropped A Reality NUKE On The Climate Change ... https://youtu.be/HR7fHXn3sd4 via @ YouTube	0	Tweet
1180465626650951680	@brendan10731674	2019-10-05 18:21:52	@ GretaThunberg ...An Inconvenient Truth: "Climate change industry" now a $1.5 Trillion global business... # ClimateChangeBullshit	0	Tweet
1180463573887119360	@imrajeevk	2019-10-05 18:13:42	@ GretaThunberg Please speak on # AareyForest here government have just massacred 3000 fully grown trees. And have arrested students under non bailable offence. And our PM @ narendramodi is sleeping & got an award for champion of climate change.	0	Tweet
1180460347569913857	@albertinoferre	2019-10-05 18:00:53	By the way, IPCC means: "The Intergovernmental Panel on Climate Change"! You read well, "Intergovernmental"! It's governments, is politics, with a little bit of science in the mix for politics to pass for truth	0	Tweet
1180428168970330113	@froozelumcuckoo	2019-10-05 15:53:01	You know climate change is a lie, don't be a puppet for the elites.	0	Tweet
1180427572951171073	@Shriniv63741464	2019-10-05 15:50:39	@ GretaThunberg you said how dare to world leaders for stolen childhood dreams,but still Indian govt r destroying nature for the shake of their political win,they don't even bother about climate change, Could u raise ur voice to ban lynching of aarey trees. @ un, @ UNESCO, @ RuchiraChttps://twitter.com/RuchiraC/status/1180358440033509376 …	0	Retweet
1180425586893680641	@Scherazad100	2019-10-05 15:42:45	@ GretaThunberg Greta galvanizing the youth to keep climate change in the forefront is commendible. However I have a couple of things I'd like to share with you. #1 Ignore Hump's tweets. Don't waste time reacting to them. It only keeps his Brand before the public which he wants.	0	Tweet
1180407709717319681	@adgujral	2019-10-05 14:31:43	@ GretaThunberg Is promoting # Veganism after an outrage from the vegan community. She’s hyped in my humble opinion. We too are # EthicalVegan and contributing to climate change, we aren’t we hyped. # EndSpeciesism # ClimateChange # ExplointingAChildhttps://twitter.com/TinaGranger8/status/1180403155697188864 …	0	Retweet
1180384751955394561	@Messr91	2019-10-05 13:00:30	Can’t deny climate change propaganda when they don’t have an education to refute it 👉🏾 I see your game	0	Tweet
1180384573319995392	@batmaninfrance	2019-10-05 12:59:47	For Christ's sake go back to school and confine yourself to history lessons on so called climate change over the past 10,000 years or so.	1	Tweet
1180382370572181504	@PhilipBommer	2019-10-05 12:51:02	Thank you to you Greta hopefully thanks to you and the Young generation the world of politics will wake up and will take climate change Seriously.	0	Tweet
1180347580707790851	@itsmeshanman	2019-10-05 10:32:47	@ GretaThunberg . This is the other side of Indian promise on the Climate Change action plans and promises. Sad to see several trees being cut. # AareyForest # AareyColony # UNGA2019 # ClimateActionSummithttps://twitter.com/Shudraism/status/1180329137111588864 …	0	Retweet
1180346595105222657	@KathleenOsmond3	2019-10-05 10:28:52	@ GretaThunberg here is the reality of climate change debunked. I'm sorry you were used by horrible adults who exploited you for their own sick agendas. Enjoy your life ❤️. Be a teen, have fun and faith in GOD. https://youtu.be/g9ZbSaL7JP0	0	Tweet
1180340427750137858	@GtrainGtrain2	2019-10-05 10:04:22	That's from development Greta ,not climate change , please tell the truth.	0	Tweet
1180336538334330880	@SSharptooth	2019-10-05 09:48:54	You really think you are special because of media exposure. You are a sayer, not a doer.. Go do some climate change work or is that too hard for you?	0	Tweet
1180333616741650432	@latinmario24	2019-10-05 09:37:18	@ GretaThunberg nobody stole crap from you, when you suffer mentally and physically to survive, then you can criticize....climate change is a scam....	0	Tweet
1180324541433708545	@Pm4332292Mishra	2019-10-05 09:01:14	I admire you a lot,you have created such a massive protest for climate change.can you tell people and your followers who are protesting across world that they would atleast plant 2 tree with ongoing protest .thank you again	0	Tweet
1180320725368033281	@kerrimanners3	2019-10-05 08:46:04	@ GretaThunberg I have an idea that will fund this most most worthy cause. It will raise millions of dollars to help support REAL CLIMATE CHANGE POLICIES,and INSPIRE INSPIRE all who participate. Help me help you change the world Contact me. Sincerely, Susan Manzi	0	Tweet
1180314431202443265	@EolaBob	2019-10-05 08:21:04	@ GretaThunberg why do you possibly think you know anything about climate change? All you are doing is making emotional rants about something you are naive at. And why not start at home and leave us alone? Get educated first then speak not cry or scream.	0	Tweet
1180307297626722304	@BuddhaBold	2019-10-05 07:52:43	Hi Greta, how about not using the Internet too since much of the world's electricity is powered through means that are not eco-friendly? But in a serious note pls get an education somehow somewhere instead of wandering around preaching...climate change is a complicated topic	0	Tweet
1180278499996655616	@kate185792	2019-10-05 05:58:17	@ GretaThunberg I understand how your generation could be frightened by climate change. I am afraid you are not looking big enough. Do you realize the chemicals used to create your phone and computer? They have to wear masks and work in clean rooms. cont	0	Tweet
1180268591482056704	@theTrutherknows	2019-10-05 05:18:55	Please stop this climate change charade. The elites control the weather through HAARP. Plus we have a firmament above us. Just go back to school please.	0	Tweet
1180266254692749312	@MislavNix517	2019-10-05 05:09:38	Honestly I couldn't give five shits about climate change but oh well some good excuse for not coming to school.	0	Tweet
1180259004548820993	@dancycircle	2019-10-05 04:40:49	The u.s. has been finding ways to slow down climate change for years, but China has been rapidly speeding it up why not try China?	0	Tweet
1180250483455336449	@anna_aosva	2019-10-05 04:06:57	Climate change: 10,000 years ago, most of North America was under 1 to 2 miles of ice and 100 million years before that, it would have been under 200 feet of water. So if the earth was this warm 120,000 years ago, that just proves that the climate is cyclical.	0	Tweet
1180249382240899072	@Tomorrow27834	2019-10-05 04:02:35	Climate change is real 🙏🏽 pic.twitter.com/Uh6KWsb06Q	1	Tweet
1180247513825255425	@DarrylKGreen	2019-10-05 03:55:09	@ GretaThunberg when will you be leading climate change protest in China, the world’s biggest polluter of CO2 emissions?	0	Tweet
1180243740692103170	@4abhi4gmailcom	2019-10-05 03:40:10	Hey.. Equally, as the forest.. Sand is the reason fr this drastic climate change. Sand mining from rivers and seas are causing the ocean levels to rise and natural elements of rivers are destroyed. Plz check the facts you ll be surprised regarding sand.	0	Tweet
1180241278157541377	@lbkasey	2019-10-05 03:30:23	Thank you for coming to Iowa. Our state has been impacted by fluctuating temperatures & repeated floods which the uneducated & misinformed will continue to deny has anything to do with climate change as they are forced to flee their farms. Stand strong. Your voice is powerful!	0	Tweet
1180241199593975808	@Christi15516259	2019-10-05 03:30:04	What is ur solution to climate change....????	0	Tweet
1180237893555539968	@ici_cam	2019-10-05 03:16:56	Would be interesting to see if Dutton will try to bring sanctions/charges against children in Aust for marching for climate change...	1	Tweet
1180235894843985920	@tinndrawers	2019-10-05 03:08:59	and to all the young people striking for climate change.. pic.twitter.com/L32JQoz6E7	0	Tweet
1180235679399178240	@GuptaOU812	2019-10-05 03:08:08	Free willy.....................Iowa is free to move about the cabin looking for climate change pic.twitter.com/t1816PrBvY	0	Tweet
1180231511867580416	@redron100	2019-10-05 02:51:34	Absolutely amazing and I hope effective in the climate change struggle	0	Tweet
1180228973315403777	@HartwigsenSPORT	2019-10-05 02:41:29	Stating the obvious. If this kids wouldn't have a day off at school they wouldn't care a bit about climate change.	0	Tweet
1180227703045144576	@IndyDogDad	2019-10-05 02:36:26	@ JustinTrudeau something you might want to think about as you try to distract Canadians from you dismal failure to address climate change with your idea to plant more trees.	0	Tweet
1180216428139569152	@AleshaGordon1	2019-10-05 01:51:38	Do you really know what you are calling for when you are calling for world leaders to take a stand on climate change? If you've never heard about the National Sunday Law I advise you to go read up about it..other people's lives are at stake here not just yours	1	Tweet
1180214949773111296	@AshutoshRattan	2019-10-05 01:45:46	Not just Friday for future. Everyday is a step for future. And instead of striking your school and campaigning to strike education, boycott the means which causes climate change.	0	Tweet
1180214497144782848	@thelip950321	2019-10-05 01:43:58	@ GretaThunberg All Democrats Drop Out Of Presidential Race Since The World Is Ending From Climate Change And There's No Point https://babylonbee.com/news/all-democrats-drop-out-of-presidential-race-since-climate-change-is-ending-the-world-so-theres-no-point-anyway …	0	Tweet
1180210497498554369	@Wookie_In_Crime	2019-10-05 01:28:04	Well, the future is yours, not of the old stupid white mans. They will die one time, they have nothing to lose except their comfort zone. They wont be affected and faced with the consequences of the climate change.	0	Tweet
1180208694786756608	@josejr1029	2019-10-05 01:20:54	@ GretaThunberg Marching for Climate Change in # iowacity and all I want to know is who is Larry! # climatechangepic.twitter.com/7NQuB4AYkf	0	Tweet
1180201491879092225	@redmayne_robert	2019-10-05 00:52:17	I Agree Greta...... 👋💚 We Must Stay Strong Together...... We Can Win The Climate Change Fight....... We Will Win It...... We Will Continue Fighting For Emergency Climate Change Action Around The World....Until Every Leader And Politician Starts Behaving Like An Adult.... 🌎🌏🌍	2	Tweet
1180194891156070408	@redmayne_robert	2019-10-05 00:26:03	Thank You Greta..... 👋💚 Each And Every Day..... We Stand By You... And We Fight Climate Change Together.... 💚🙏🕊️ You Mean So Much To Us All....... 💚🌎	2	Tweet
1180192532862570496	@eamorris_	2019-10-05 00:16:41	@ GretaThunberg, international community, need acknowledge Justin Trudeau, Liberal Party of Canada doctrine, practice: Climate change of no emergency to them, they practice, approve the rich buying their way out. Everything they do, an act to fool. # elxn43https://twitter.com/anthonyfurey/status/1179752564432216064?s=21 …	0	Retweet
1180191720782389248	@AngiePemberton2	2019-10-05 00:13:27	@ GretaThunberg it’s unfortunate that you are being taught lies and brainwashed with untruths. Man made climate change is not a real issue. The climate has been changing for millions of years all on its own. Those promoting these false ideas are stealing your childhood.	0	Tweet
1180190355011993600	@neilnlopes	2019-10-05 00:08:02	@ GretaThunberg right on Friday our high court declared a lush green area of Aarey to be cut down, our hon. PM who was promising so much to do in order to prevent climate change, his government is responsible for this atrocity, nothing but vague promises # SaveAareyForest	0	Tweet
1180189975930818560	@CPdevo	2019-10-05 00:06:31	Climate change is a hoax. # ClimateChangeEqualsWeather	0	Tweet
1180182361574711298	@MojoFootball972	2019-10-04 23:36:16	@ GretaThunberg here’s some real data for you (from NASA and NOAA) since it’s apparent you’ve missed out...humans have nothing to do with climate change: https://earthobservatory.nasa.gov/features/Milankovitch/milankovitch_2.php …	0	Tweet
1180182234042646528	@JohnYannessa	2019-10-04 23:35:45	@ GretaThunberg I live in South Carolina USA. It’s October, and still... As a college professor, I urge people to listen👏 to 👏 her 👏. Read the science. @ GretaThunberg is telling us the truth. climate change is real. Time has run out! Action is needed now! # ClimateChangepic.twitter.com/l6XhTRZTFt	0	Tweet
1180177158314119169	@DrJohnnyCupcak1	2019-10-04 23:15:35	Sighhhhhhhhhhhhhhhhhhh Man made climate change is a LIE!!! Hey did Soros check clear? You work for the devil.	0	Tweet
1180176760765386755	@eastcodiesel	2019-10-04 23:14:01	Which scientists? There are a lot of them. Some agree with you and some don't. Some think climate change is 100 percent a normal occurrence. And they so far have proven way more than the ones who claim co2 is causing it all.	0	Tweet
1180176052124995586	@DhoniRohith7	2019-10-04 23:11:12	You don't deserve Nobel prize seriously 😆, whatever you are doing that is just for some sake of publicity, you are being used by some of the leftists people. Fake climate change activist striving for publicity	1	Tweet
1180175820884598784	@mikecanm	2019-10-04 23:10:16	when the winter comes along there will not be as many climate change protestors because it will be too cold to go outside to protest the warming of the earth	0	Tweet
1180174152046714880	@sroper7	2019-10-04 23:03:39	@ GretaThunberg Let me tell you something little girl, there has been climate change since the beginning of time God is in control!!! That is why we have Seasons!!!	0	Tweet
1180166793220038657	@stupidgretachi1	2019-10-04 22:34:24	thunberg or tuna is a stupid child. I'm shitting about climate change. My life is limited and I will give up the devil on anything. neither on car with a lot of dirt, on plastic, nor on the weekly flights. I'm absolutely not interested in what happens to her fucking future.	0	Tweet
1180158540817809408	@brojeffdavis	2019-10-04 22:01:37	I’m glad you fight for what you believe in. Everyone else has that right as well. There are certain solutions from the climate change crowd that are unreasonable. Make sure you know both sides.	0	Tweet
1180157456594407424	@Abhishe04124681	2019-10-04 21:57:18	@ GretaThunberg Congratulations Greta And finally another time u define that for any WAR age not define "Greta Thunberg is favourite to win 2019Nobel Peace Prize. Greta has become a figurehead for the youth movement demanding action against climate change" pic.twitter.com/jqXR1tIpKb	0	Tweet
1180151575844663297	@q2fai	2019-10-04 21:33:56	@ GretaThunberg From India, dis Tweet comes when our PM has done all the bragging about Climate Change & how they are doing enough! Whereas this is their true face👇 https://twitter.com/fayedsouza/status/1180000423085654017?s=19 … # HowDareYou	0	Retweet
1180149477643972608	@dogluvr301	2019-10-04 21:25:36	@ GretaThunberg Go home child. You are no more a climate expert than I am. I have however, lived through the screams of the left for "We are going into an ice age!", " The planet is heating up and we're all going to die!", "Global climate change is	0	Tweet
1180146635051024384	@SustainUKorg	2019-10-04 21:14:18	Trees will form a large part of any plan to halt the effects of climate change. Get out and plant a tree in your garden, on your balcony or even in a pot by a window - not only will you be doing your bit, but they're great to look at too.	0	Tweet
1180146395703107584	@ClaireH30676183	2019-10-04 21:13:21	Striking for climate change? HMM,halting traffic watching fumes from all these cars float into the air. Helpful? Do you people walk to where you go? Oh, right YOU FLY	0	Tweet
1180135061301202944	@33Jmcgrath	2019-10-04 20:28:19	@ GretaThunberg how do ya feel about @ JustinTrudeau using two planes for his election campaign? Hypocrisy to climate change at its finest. Would like your take on this	0	Tweet
1180129679262527489	@kathchering	2019-10-04 20:06:55	You poor child i will pray for you, you are being used to push the fake climate change agenda. Truth is being revealed about this wicked fallen world and Gods judgement is upon us.	0	Tweet
1180123198333030401	@in_hartford	2019-10-04 19:41:10	@ GretaThunberg what exactly are your qualifications to lecture mature adults about climate change?	0	Tweet
1180120424438517760	@sarabelltempus	2019-10-04 19:30:09	@ GretaThunberg please help to stop these fossil fuel subsidies! We will never solve climate change if we keep subsidising fossil fuel @ vestager WTF???https://twitter.com/sarabelltempus/status/1180119567856799749 …	0	Retweet
1180120314426073088	@welycha	2019-10-04 19:29:43	Reforestation is an important tool in fighting climate change, but doesn't do any good w/o preserving trees - particularly old growth trees.	0	Tweet
1180107903551918082	@Kev34493618	2019-10-04 18:40:24	@ GretaThunberg ask ppl to plant more plants called Spekboom as it apparently take in more Co2 than trees. I'm doing what I can to help remove this climate change so we can move forward in prosperity young Madam. God bless u more.	0	Tweet
1180105187593261057	@Templestream	2019-10-04 18:29:36	Think about this: The same country that produced 'scientific' alarmist Greta Thunberg also offers 'scientific' cannibalism: 'Swedish Scientist Proposes Cannibalism to Fight Climate Change' http://bit.ly/310Y2DI # EatTheBabies # EatTheChildren # SaveThePlanet # ClimateChange	5	Tweet
1180096719922634752	@retrogeek1980	2019-10-04 17:55:57	The founder of Green Peace admitted climate change is nothing but a political power grab hoax. Google it.	0	Tweet
1180096091812958211	@KPjyLjvuxniVFQ9	2019-10-04 17:53:28	Climate is now a leading topic, and it will be more and more relevant, because life directly depends on the climate. There are difficult times ahead, when crops will die due to climate change, there will be hunger, a large increase in food prices.	0	Tweet
1180093527641989120	@worldcitizen1st	2019-10-04 17:43:16	Realistically, unless Concrete&coordinate actions relate to the protection of the environment are present, among individuals, communities &🌎countries are present, it’s impossible to count with a modest impact, in the temperatures link to climate change.	0	Tweet
1180087765003837440	@XDaneelOlivaw	2019-10-04 17:20:22	@ GretaThunberg deserves the Nobel Peace Prize BIGTIME! Her message, effort and dedication are AMAZING! If only others thought 1/100th of the way Greta thinks, man-made climate change would not have occurred. Brava, Greta!!! 👏👏👏 https://twitter.com/InTheNoosphere/status/1180076236548145152 …	0	Retweet
1180087311884795904	@pizzarollslol	2019-10-04 17:18:34	yk that one friend who’s really changed but only his close friends/people who take the time to know him realize it? and the people who barley know him claim he’s the same, he’s nice, everything’s the same? that’s basically climate change lol	0	Tweet
1180087100802248705	@1775USMCRIIS	2019-10-04 17:17:44	When I was a young person like yourself.... the scientists used to say "global freezing " was coming. It wasn't till about 30 years ago that people began to say "global warming " an now "climate change " the fact is climate can be predicted or controlled.	0	Tweet
1180084905092366336	@KezBenn	2019-10-04 17:09:00	That's right. It's not opinion and the science doesn't support anthropogenic climate change.	0	Tweet
